experiments/results/report_data/suds_transformer_architecture_sim_20260513_tetc_pivot_kernels.csv
tag,workload,model,dataset_or_split,kernel_id,kernel_index,kernel_name,kernel_class,layer_index,m,d,n,macs,tile_m,tile_d,tile_n,dptc_tiles,output_groups,output_values,operand_values,dptc_cycles,base_latency_ns,schedule_start_ns,schedule_deadline_ns,scheduler_slack_norm,slack_source,mapping_evidence,condition,condition_label,keep_ratio,degrade_ratio,prune_ratio,active_compute_ratio,condition_latency_ns,condition_dptc_tiles,condition_output_values
20260513_tetc_pivot,bert_base_glue_seq128,bert_base,"GLUE validation, seq_len=128",bert_base_glue_seq128:k000,0,bert.encoder.layer.0.attention.self.qkv,mha_qkv_projection,0,128,768,2304,226492416,4,24,72,6912,288,294912,1867776,864,172.8,0.0,412.48,0.5138479441427464,dptc_photonic_tile_schedule,generated canonical BERT-base encoder GEMM schedule,lightening_dptc,"Lightening-style DPTC reference, 8-bit ADC",1.0,0.0,0.0,1.0,172.8,6912,294912
20260513_tetc_pivot,bert_base_glue_seq128,bert_base,"GLUE validation, seq_len=128",bert_base_glue_seq128:k001,1,bert.encoder.layer.0.attention.self.qk_scores,mha_qk_scores,0,1536,64,128,12582912,48,2,4,384,192,196608,106496,48,9.600000000000001,172.8,201.76000000000002,0.5422651933701657,dptc_photonic_tile_schedule,generated canonical BERT-base encoder GEMM schedule,lightening_dptc,"Lightening-style DPTC reference, 8-bit ADC",1.0,0.0,0.0,1.0,9.600000000000001,384,196608
20260513_tetc_pivot,bert_base_glue_seq128,bert_base,"GLUE validation, seq_len=128",bert_base_glue_seq128:k002,2,bert.encoder.layer.0.attention.self.av_context,mha_av_context,0,1536,128,64,12582912,48,4,2,384,96,98304,204800,48,9.600000000000001,182.4,211.36,0.5422651933701657,dptc_photonic_tile_schedule,generated canonical BERT-base encoder GEMM schedule,lightening_dptc,"Lightening-style DPTC reference, 8-bit ADC",1.0,0.0,0.0,1.0,9.600000000000001,384,98304
20260513_tetc_pivot,bert_base_glue_seq128,bert_base,"GLUE validation, seq_len=128",bert_base_glue_seq128:k003,3,bert.encoder.layer.0.attention.output.dense,mha_output_projection,0,128,768,768,75497472,4,24,24,2304,96,98304,688128,288,57.6,192.0,333.76,0.517945823927765,dptc_photonic_tile_schedule,generated canonical BERT-base encoder GEMM schedule,lightening_dptc,"Lightening-style DPTC reference, 8-bit ADC",1.0,0.0,0.0,1.0,57.6,2304,98304
20260513_tetc_pivot,bert_base_glue_seq128,bert_base,"GLUE validation, seq_len=128",bert_base_glue_seq128:k004,4,bert.encoder.layer.0.intermediate.dense,ffn_expand,0,128,768,3072,301989888,4,24,96,9216,384,393216,2457600,1152,230.4,249.6,797.44,0.5133177570093458,dptc_photonic_tile_schedule,generated canonical BERT-base encoder GEMM schedule,lightening_dptc,"Lightening-style DPTC reference, 8-bit ADC",1.0,0.0,0.0,1.0,230.4,9216,393216
20260513_tetc_pivot,bert_base_glue_seq128,bert_base,"GLUE validation, seq_len=128",bert_base_glue_seq128:k005,5,bert.encoder.layer.0.output.dense,ffn_project,0,128,3072,768,301989888,4,96,24,9216,96,98304,2752512,1152,230.4,480.0,1027.84,0.5133177570093456,dptc_photonic_tile_schedule,generated canonical BERT-base encoder GEMM schedule,lightening_dptc,"Lightening-style DPTC reference, 8-bit ADC",1.0,0.0,0.0,1.0,230.4,9216,98304
20260513_tetc_pivot,bert_base_glue_seq128,bert_base,"GLUE validation, seq_len=128",bert_base_glue_seq128:k006,6,bert.encoder.layer.1.attention.self.qkv,mha_qkv_projection,1,128,768,2304,226492416,4,24,72,6912,288,294912,1867776,864,172.8,710.4,1122.88,0.5456661259609283,dptc_photonic_tile_schedule,generated canonical BERT-base encoder GEMM schedule,lightening_dptc,"Lightening-style DPTC reference, 8-bit ADC",1.0,0.0,0.0,1.0,172.8,6912,294912
20260513_tetc_pivot,bert_base_glue_seq128,bert_base,"GLUE validation, seq_len=128",bert_base_glue_seq128:k007,7,bert.encoder.layer.1.attention.self.qk_scores,mha_qk_scores,1,1536,64,128,12582912,48,2,4,384,192,196608,106496,48,9.600000000000001,883.2,912.1600000000001,0.5740833751883494,dptc_photonic_tile_schedule,generated canonical BERT-base encoder GEMM schedule,lightening_dptc,"Lightening-style DPTC reference, 8-bit ADC",1.0,0.0,0.0,1.0,9.600000000000001,384,196608
20260513_tetc_pivot,bert_base_glue_seq128,bert_base,"GLUE validation, seq_len=128",bert_base_glue_seq128:k008,8,bert.encoder.layer.1.attention.self.av_context,mha_av_context,1,1536,128,64,12582912,48,4,2,384,96,98304,204800,48,9.600000000000001,892.8000000000001,921.7600000000001,0.5740833751883494,dptc_photonic_tile_schedule,generated canonical BERT-base encoder GEMM schedule,lightening_dptc,"Lightening-style DPTC reference, 8-bit ADC",1.0,0.0,0.0,1.0,9.600000000000001,384,98304
20260513_tetc_pivot,bert_base_glue_seq128,bert_base,"GLUE validation, seq_len=128",bert_base_glue_seq128:k009,9,bert.encoder.layer.1.attention.output.dense,mha_output_projection,1,128,768,768,75497472,4,24,24,2304,96,98304,688128,288,57.6,902.4000000000001,1044.16,0.5497640057459472,dptc_photonic_tile_schedule,generated canonical BERT-base encoder GEMM schedule,lightening_dptc,"Lightening-style DPTC reference, 8-bit ADC",1.0,0.0,0.0,1.0,57.6,2304,98304
20260513_tetc_pivot,bert_base_glue_seq128,bert_base,"GLUE validation, seq_len=128",bert_base_glue_seq128:k010,10,bert.encoder.layer.1.intermediate.dense,ffn_expand,1,128,768,3072,301989888,4,24,96,9216,384,393216,2457600,1152,230.4,960.0000000000001,1507.8400000000001,0.5451359388275278,dptc_photonic_tile_schedule,generated canonical BERT-base encoder GEMM schedule,lightening_dptc,"Lightening-style DPTC reference, 8-bit ADC",1.0,0.0,0.0,1.0,230.4,9216,393216
20260513_tetc_pivot,bert_base_glue_seq128,bert_base,"GLUE validation, seq_len=128",bert_base_glue_seq128:k011,11,bert.encoder.layer.1.output.dense,ffn_project,1,128,3072,768,301989888,4,96,24,9216,96,98304,2752512,1152,230.4,1190.4,1738.2400000000002,0.5451359388275278,dptc_photonic_tile_schedule,generated canonical BERT-base encoder GEMM schedule,lightening_dptc,"Lightening-style DPTC reference, 8-bit ADC",1.0,0.0,0.0,1.0,230.4,9216,98304
20260513_tetc_pivot,bert_base_glue_seq128,bert_base,"GLUE validation, seq_len=128",bert_base_glue_seq128:k012,12,bert.encoder.layer.2.attention.self.qkv,mha_qkv_projection,2,128,768,2304,226492416,4,24,72,6912,288,294912,1867776,864,172.8,1420.8000000000002,1833.2800000000002,0.5774843077791098,dptc_photonic_tile_schedule,generated canonical BERT-base encoder GEMM schedule,lightening_dptc,"Lightening-style DPTC reference, 8-bit ADC",1.0,0.0,0.0,1.0,172.8,6912,294912
20260513_tetc_pivot,bert_base_glue_seq128,bert_base,"GLUE validation, seq_len=128",bert_base_glue_seq128:k013,13,bert.encoder.layer.2.attention.self.qk_scores,mha_qk_scores,2,1536,64,128,12582912,48,2,4,384,192,196608,106496,48,9.600000000000001,1593.6000000000001,1622.56,0.605901557006526,dptc_photonic_tile_schedule,generated canonical BERT-base encoder GEMM schedule,lightening_dptc,"Lightening-style DPTC reference, 8-bit ADC",1.0,0.0,0.0,1.0,9.600000000000001,384,196608
20260513_tetc_pivot,bert_base_glue_seq128,bert_base,"GLUE validation, seq_len=128",bert_base_glue_seq128:k014,14,bert.encoder.layer.2.attention.self.av_context,mha_av_context,2,1536,128,64,12582912,48,4,2,384,96,98304,204800,48,9.600000000000001,1603.2,1632.1599999999999,0.605901557006526,dptc_photonic_tile_schedule,generated canonical BERT-base encoder GEMM schedule,lightening_dptc,"Lightening-style DPTC reference, 8-bit ADC",1.0,0.0,0.0,1.0,9.600000000000001,384,98304
20260513_tetc_pivot,bert_base_glue_seq128,bert_base,"GLUE validation, seq_len=128",bert_base_glue_seq128:k015,15,bert.encoder.layer.2.attention.output.dense,mha_output_projection,2,128,768,768,75497472,4,24,24,2304,96,98304,688128,288,57.6,1612.8,1754.56,0.5815821875641289,dptc_photonic_tile_schedule,generated canonical BERT-base encoder GEMM schedule,lightening_dptc,"Lightening-style DPTC reference, 8-bit ADC",1.0,0.0,0.0,1.0,57.6,2304,98304
20260513_tetc_pivot,bert_base_glue_seq128,bert_base,"GLUE validation, seq_len=128",bert_base_glue_seq128:k016,16,bert.encoder.layer.2.intermediate.dense,ffn_expand,2,128,768,3072,301989888,4,24,96,9216,384,393216,2457600,1152,230.4,1670.3999999999999,2218.24,0.5769541206457092,dptc_photonic_tile_schedule,generated canonical BERT-base encoder GEMM schedule,lightening_dptc,"Lightening-style DPTC reference, 8-bit ADC",1.0,0.0,0.0,1.0,230.4,9216,393216
20260513_tetc_pivot,bert_base_glue_seq128,bert_base,"GLUE validation, seq_len=128",bert_base_glue_seq128:k017,17,bert.encoder.layer.2.output.dense,ffn_project,2,128,3072,768,301989888,4,96,24,9216,96,98304,2752512,1152,230.4,1900.8,2448.64,0.5769541206457092,dptc_photonic_tile_schedule,generated canonical BERT-base encoder GEMM schedule,lightening_dptc,"Lightening-style DPTC reference, 8-bit ADC",1.0,0.0,0.0,1.0,230.4,9216,98304
20260513_tetc_pivot,bert_base_glue_seq128,bert_base,"GLUE validation, seq_len=128",bert_base_glue_seq128:k018,18,bert.encoder.layer.3.attention.self.qkv,mha_qkv_projection,3,128,768,2304,226492416,4,24,72,6912,288,294912,1867776,864,172.8,2131.2,2543.68,0.6093024895972916,dptc_photonic_tile_schedule,generated canonical BERT-base encoder GEMM schedule,lightening_dptc,"Lightening-style DPTC reference, 8-bit ADC",1.0,0.0,0.0,1.0,172.8,6912,294912
20260513_tetc_pivot,bert_base_glue_seq128,bert_base,"GLUE validation, seq_len=128",bert_base_glue_seq128:k019,19,bert.encoder.layer.3.attention.self.qk_scores,mha_qk_scores,3,1536,64,128,12582912,48,2,4,384,192,196608,106496,48,9.600000000000001,2304.0,2332.96,0.6377197388247079,dptc_photonic_tile_schedule,generated canonical BERT-base encoder GEMM schedule,lightening_dptc,"Lightening-style DPTC reference, 8-bit ADC",1.0,0.0,0.0,1.0,9.600000000000001,384,196608
20260513_tetc_pivot,bert_base_glue_seq128,bert_base,"GLUE validation, seq_len=128",bert_base_glue_seq128:k020,20,bert.encoder.layer.3.attention.self.av_context,mha_av_context,3,1536,128,64,12582912,48,4,2,384,96,98304,204800,48,9.600000000000001,2313.6,2342.56,0.6377197388247079,dptc_photonic_tile_schedule,generated canonical BERT-base encoder GEMM schedule,lightening_dptc,"Lightening-style DPTC reference, 8-bit ADC",1.0,0.0,0.0,1.0,9.600000000000001,384,98304
20260513_tetc_pivot,bert_base_glue_seq128,bert_base,"GLUE validation, seq_len=128",bert_base_glue_seq128:k021,21,bert.encoder.layer.3.attention.output.dense,mha_output_projection,3,128,768,768,75497472,4,24,24,2304,96,98304,688128,288,57.6,2323.2,2464.9599999999996,0.6134003693823087,dptc_photonic_tile_schedule,generated canonical BERT-base encoder GEMM schedule,lightening_dptc,"Lightening-style DPTC reference, 8-bit ADC",1.0,0.0,0.0,1.0,57.6,2304,98304
20260513_tetc_pivot,bert_base_glue_seq128,bert_base,"GLUE validation, seq_len=128",bert_base_glue_seq128:k022,22,bert.encoder.layer.3.intermediate.dense,ffn_expand,3,128,768,3072,301989888,4,24,96,9216,384,393216,2457600,1152,230.4,2380.7999999999997,2928.64,0.6087723024638917,dptc_photonic_tile_schedule,generated canonical BERT-base encoder GEMM schedule,lightening_dptc,"Lightening-style DPTC reference, 8-bit ADC",1.0,0.0,0.0,1.0,230.4,9216,393216
20260513_tetc_pivot,bert_base_glue_seq128,bert_base,"GLUE validation, seq_len=128",bert_base_glue_seq128:k023,23,bert.encoder.layer.3.output.dense,ffn_project,3,128,3072,768,301989888,4,96,24,9216,96,98304,2752512,1152,230.4,2611.2,3159.04,0.6087723024638917,dptc_photonic_tile_schedule,generated canonical BERT-base encoder GEMM schedule,lightening_dptc,"Lightening-style DPTC reference, 8-bit ADC",1.0,0.0,0.0,1.0,230.4,9216,98304
20260513_tetc_pivot,bert_base_glue_seq128,bert_base,"GLUE validation, seq_len=128",bert_base_glue_seq128:k024,24,bert.encoder.layer.4.attention.self.qkv,mha_qkv_projection,4,128,768,2304,226492416,4,24,72,6912,288,294912,1867776,864,172.8,2841.6,3254.08,0.6411206714154734,dptc_photonic_tile_schedule,generated canonical BERT-base encoder GEMM schedule,lightening_dptc,"Lightening-style DPTC reference, 8-bit ADC",1.0,0.0,0.0,1.0,172.8,6912,294912
20260513_tetc_pivot,bert_base_glue_seq128,bert_base,"GLUE validation, seq_len=128",bert_base_glue_seq128:k025,25,bert.encoder.layer.4.attention.self.qk_scores,mha_qk_scores,4,1536,64,128,12582912,48,2,4,384,192,196608,106496,48,9.600000000000001,3014.4,3043.36,0.6695379206428898,dptc_photonic_tile_schedule,generated canonical BERT-base encoder GEMM schedule,lightening_dptc,"Lightening-style DPTC reference, 8-bit ADC",1.0,0.0,0.0,1.0,9.600000000000001,384,196608
20260513_tetc_pivot,bert_base_glue_seq128,bert_base,"GLUE validation, seq_len=128",bert_base_glue_seq128:k026,26,bert.encoder.layer.4.attention.self.av_context,mha_av_context,4,1536,128,64,12582912,48,4,2,384,96,98304,204800,48,9.600000000000001,3024.0,3052.96,0.6695379206428898,dptc_photonic_tile_schedule,generated canonical BERT-base encoder GEMM schedule,lightening_dptc,"Lightening-style DPTC reference, 8-bit ADC",1.0,0.0,0.0,1.0,9.600000000000001,384,98304
20260513_tetc_pivot,bert_base_glue_seq128,bert_base,"GLUE validation, seq_len=128",bert_base_glue_seq128:k027,27,bert.encoder.layer.4.attention.output.dense,mha_output_projection,4,128,768,768,75497472,4,24,24,2304,96,98304,688128,288,57.6,3033.6,3175.3599999999997,0.6452185512004904,dptc_photonic_tile_schedule,generated canonical BERT-base encoder GEMM schedule,lightening_dptc,"Lightening-style DPTC reference, 8-bit ADC",1.0,0.0,0.0,1.0,57.6,2304,98304
20260513_tetc_pivot,bert_base_glue_seq128,bert_base,"GLUE validation, seq_len=128",bert_base_glue_seq128:k028,28,bert.encoder.layer.4.intermediate.dense,ffn_expand,4,128,768,3072,301989888,4,24,96,9216,384,393216,2457600,1152,230.4,3091.2,3639.04,0.6405904842820735,dptc_photonic_tile_schedule,generated canonical BERT-base encoder GEMM schedule,lightening_dptc,"Lightening-style DPTC reference, 8-bit ADC",1.0,0.0,0.0,1.0,230.4,9216,393216
20260513_tetc_pivot,bert_base_glue_seq128,bert_base,"GLUE validation, seq_len=128",bert_base_glue_seq128:k029,29,bert.encoder.layer.4.output.dense,ffn_project,4,128,3072,768,301989888,4,96,24,9216,96,98304,2752512,1152,230.4,3321.6,3869.44,0.6405904842820735,dptc_photonic_tile_schedule,generated canonical BERT-base encoder GEMM schedule,lightening_dptc,"Lightening-style DPTC reference, 8-bit ADC",1.0,0.0,0.0,1.0,230.4,9216,98304
20260513_tetc_pivot,bert_base_glue_seq128,bert_base,"GLUE validation, seq_len=128",bert_base_glue_seq128:k030,30,bert.encoder.layer.5.attention.self.qkv,mha_qkv_projection,5,128,768,2304,226492416,4,24,72,6912,288,294912,1867776,864,172.8,3552.0,3964.48,0.6729388532336552,dptc_photonic_tile_schedule,generated canonical BERT-base encoder GEMM schedule,lightening_dptc,"Lightening-style DPTC reference, 8-bit ADC",1.0,0.0,0.0,1.0,172.8,6912,294912
20260513_tetc_pivot,bert_base_glue_seq128,bert_base,"GLUE validation, seq_len=128",bert_base_glue_seq128:k031,31,bert.encoder.layer.5.attention.self.qk_scores,mha_qk_scores,5,1536,64,128,12582912,48,2,4,384,192,196608,106496,48,9.600000000000001,3724.8,3753.76,0.7013561024610715,dptc_photonic_tile_schedule,generated canonical BERT-base encoder GEMM schedule,lightening_dptc,"Lightening-style DPTC reference, 8-bit ADC",1.0,0.0,0.0,1.0,9.600000000000001,384,196608
20260513_tetc_pivot,bert_base_glue_seq128,bert_base,"GLUE validation, seq_len=128",bert_base_glue_seq128:k032,32,bert.encoder.layer.5.attention.self.av_context,mha_av_context,5,1536,128,64,12582912,48,4,2,384,96,98304,204800,48,9.600000000000001,3734.4,3763.36,0.7013561024610715,dptc_photonic_tile_schedule,generated canonical BERT-base encoder GEMM schedule,lightening_dptc,"Lightening-style DPTC reference, 8-bit ADC",1.0,0.0,0.0,1.0,9.600000000000001,384,98304
20260513_tetc_pivot,bert_base_glue_seq128,bert_base,"GLUE validation, seq_len=128",bert_base_glue_seq128:k033,33,bert.encoder.layer.5.attention.output.dense,mha_output_projection,5,128,768,768,75497472,4,24,24,2304,96,98304,688128,288,57.6,3744.0,3885.7599999999998,0.6770367330186723,dptc_photonic_tile_schedule,generated canonical BERT-base encoder GEMM schedule,lightening_dptc,"Lightening-style DPTC reference, 8-bit ADC",1.0,0.0,0.0,1.0,57.6,2304,98304
20260513_tetc_pivot,bert_base_glue_seq128,bert_base,"GLUE validation, seq_len=128",bert_base_glue_seq128:k034,34,bert.encoder.layer.5.intermediate.dense,ffn_expand,5,128,768,3072,301989888,4,24,96,9216,384,393216,2457600,1152,230.4,3801.6,4349.44,0.6724086661002546,dptc_photonic_tile_schedule,generated canonical BERT-base encoder GEMM schedule,lightening_dptc,"Lightening-style DPTC reference, 8-bit ADC",1.0,0.0,0.0,1.0,230.4,9216,393216
20260513_tetc_pivot,bert_base_glue_seq128,bert_base,"GLUE validation, seq_len=128",bert_base_glue_seq128:k035,35,bert.encoder.layer.5.output.dense,ffn_project,5,128,3072,768,301989888,4,96,24,9216,96,98304,2752512,1152,230.4,4032.0,4579.839999999999,0.6724086661002542,dptc_photonic_tile_schedule,generated canonical BERT-base encoder GEMM schedule,lightening_dptc,"Lightening-style DPTC reference, 8-bit ADC",1.0,0.0,0.0,1.0,230.4,9216,98304
20260513_tetc_pivot,bert_base_glue_seq128,bert_base,"GLUE validation, seq_len=128",bert_base_glue_seq128:k036,36,bert.encoder.layer.6.attention.self.qkv,mha_qkv_projection,6,128,768,2304,226492416,4,24,72,6912,288,294912,1867776,864,172.8,4262.4,4674.88,0.7047570350518385,dptc_photonic_tile_schedule,generated canonical BERT-base encoder GEMM schedule,lightening_dptc,"Lightening-style DPTC reference, 8-bit ADC",1.0,0.0,0.0,1.0,172.8,6912,294912
20260513_tetc_pivot,bert_base_glue_seq128,bert_base,"GLUE validation, seq_len=128",bert_base_glue_seq128:k037,37,bert.encoder.layer.6.attention.self.qk_scores,mha_qk_scores,6,1536,64,128,12582912,48,2,4,384,192,196608,106496,48,9.600000000000001,4435.2,4464.16,0.7331742842792534,dptc_photonic_tile_schedule,generated canonical BERT-base encoder GEMM schedule,lightening_dptc,"Lightening-style DPTC reference, 8-bit ADC",1.0,0.0,0.0,1.0,9.600000000000001,384,196608
20260513_tetc_pivot,bert_base_glue_seq128,bert_base,"GLUE validation, seq_len=128",bert_base_glue_seq128:k038,38,bert.encoder.layer.6.attention.self.av_context,mha_av_context,6,1536,128,64,12582912,48,4,2,384,96,98304,204800,48,9.600000000000001,4444.8,4473.76,0.7331742842792534,dptc_photonic_tile_schedule,generated canonical BERT-base encoder GEMM schedule,lightening_dptc,"Lightening-style DPTC reference, 8-bit ADC",1.0,0.0,0.0,1.0,9.600000000000001,384,98304
20260513_tetc_pivot,bert_base_glue_seq128,bert_base,"GLUE validation, seq_len=128",bert_base_glue_seq128:k039,39,bert.encoder.layer.6.attention.output.dense,mha_output_projection,6,128,768,768,75497472,4,24,24,2304,96,98304,688128,288,57.6,4454.400000000001,4596.160000000001,0.7088549148368563,dptc_photonic_tile_schedule,generated canonical BERT-base encoder GEMM schedule,lightening_dptc,"Lightening-style DPTC reference, 8-bit ADC",1.0,0.0,0.0,1.0,57.6,2304,98304
20260513_tetc_pivot,bert_base_glue_seq128,bert_base,"GLUE validation, seq_len=128",bert_base_glue_seq128:k040,40,bert.encoder.layer.6.intermediate.dense,ffn_expand,6,128,768,3072,301989888,4,24,96,9216,384,393216,2457600,1152,230.4,4512.000000000001,5059.84,0.704226847918436,dptc_photonic_tile_schedule,generated canonical BERT-base encoder GEMM schedule,lightening_dptc,"Lightening-style DPTC reference, 8-bit ADC",1.0,0.0,0.0,1.0,230.4,9216,393216
20260513_tetc_pivot,bert_base_glue_seq128,bert_base,"GLUE validation, seq_len=128",bert_base_glue_seq128:k041,41,bert.encoder.layer.6.output.dense,ffn_project,6,128,3072,768,301989888,4,96,24,9216,96,98304,2752512,1152,230.4,4742.400000000001,5290.24,0.704226847918436,dptc_photonic_tile_schedule,generated canonical BERT-base encoder GEMM schedule,lightening_dptc,"Lightening-style DPTC reference, 8-bit ADC",1.0,0.0,0.0,1.0,230.4,9216,98304
20260513_tetc_pivot,bert_base_glue_seq128,bert_base,"GLUE validation, seq_len=128",bert_base_glue_seq128:k042,42,bert.encoder.layer.7.attention.self.qkv,mha_qkv_projection,7,128,768,2304,226492416,4,24,72,6912,288,294912,1867776,864,172.8,4972.8,5385.280000000001,0.7365752168700204,dptc_photonic_tile_schedule,generated canonical BERT-base encoder GEMM schedule,lightening_dptc,"Lightening-style DPTC reference, 8-bit ADC",1.0,0.0,0.0,1.0,172.8,6912,294912
20260513_tetc_pivot,bert_base_glue_seq128,bert_base,"GLUE validation, seq_len=128",bert_base_glue_seq128:k043,43,bert.encoder.layer.7.attention.self.qk_scores,mha_qk_scores,7,1536,64,128,12582912,48,2,4,384,192,196608,106496,48,9.600000000000001,5145.6,5174.56,0.7649924660974352,dptc_photonic_tile_schedule,generated canonical BERT-base encoder GEMM schedule,lightening_dptc,"Lightening-style DPTC reference, 8-bit ADC",1.0,0.0,0.0,1.0,9.600000000000001,384,196608
20260513_tetc_pivot,bert_base_glue_seq128,bert_base,"GLUE validation, seq_len=128",bert_base_glue_seq128:k044,44,bert.encoder.layer.7.attention.self.av_context,mha_av_context,7,1536,128,64,12582912,48,4,2,384,96,98304,204800,48,9.600000000000001,5155.200000000001,5184.160000000001,0.7649924660974352,dptc_photonic_tile_schedule,generated canonical BERT-base encoder GEMM schedule,lightening_dptc,"Lightening-style DPTC reference, 8-bit ADC",1.0,0.0,0.0,1.0,9.600000000000001,384,98304
20260513_tetc_pivot,bert_base_glue_seq128,bert_base,"GLUE validation, seq_len=128",bert_base_glue_seq128:k045,45,bert.encoder.layer.7.attention.output.dense,mha_output_projection,7,128,768,768,75497472,4,24,24,2304,96,98304,688128,288,57.6,5164.800000000001,5306.560000000001,0.7406730966550381,dptc_photonic_tile_schedule,generated canonical BERT-base encoder GEMM schedule,lightening_dptc,"Lightening-style DPTC reference, 8-bit ADC",1.0,0.0,0.0,1.0,57.6,2304,98304
20260513_tetc_pivot,bert_base_glue_seq128,bert_base,"GLUE validation, seq_len=128",bert_base_glue_seq128:k046,46,bert.encoder.layer.7.intermediate.dense,ffn_expand,7,128,768,3072,301989888,4,24,96,9216,384,393216,2457600,1152,230.4,5222.4000000000015,5770.240000000001,0.7360450297366179,dptc_photonic_tile_schedule,generated canonical BERT-base encoder GEMM schedule,lightening_dptc,"Lightening-style DPTC reference, 8-bit ADC",1.0,0.0,0.0,1.0,230.4,9216,393216
20260513_tetc_pivot,bert_base_glue_seq128,bert_base,"GLUE validation, seq_len=128",bert_base_glue_seq128:k047,47,bert.encoder.layer.7.output.dense,ffn_project,7,128,3072,768,301989888,4,96,24,9216,96,98304,2752512,1152,230.4,5452.800000000001,6000.64,0.7360450297366179,dptc_photonic_tile_schedule,generated canonical BERT-base encoder GEMM schedule,lightening_dptc,"Lightening-style DPTC reference, 8-bit ADC",1.0,0.0,0.0,1.0,230.4,9216,98304
20260513_tetc_pivot,bert_base_glue_seq128,bert_base,"GLUE validation, seq_len=128",bert_base_glue_seq128:k048,48,bert.encoder.layer.8.attention.self.qkv,mha_qkv_projection,8,128,768,2304,226492416,4,24,72,6912,288,294912,1867776,864,172.8,5683.200000000001,6095.680000000001,0.7683933986882021,dptc_photonic_tile_schedule,generated canonical BERT-base encoder GEMM schedule,lightening_dptc,"Lightening-style DPTC reference, 8-bit ADC",1.0,0.0,0.0,1.0,172.8,6912,294912
20260513_tetc_pivot,bert_base_glue_seq128,bert_base,"GLUE validation, seq_len=128",bert_base_glue_seq128:k049,49,bert.encoder.layer.8.attention.self.qk_scores,mha_qk_scores,8,1536,64,128,12582912,48,2,4,384,192,196608,106496,48,9.600000000000001,5856.000000000001,5884.960000000001,0.796810647915617,dptc_photonic_tile_schedule,generated canonical BERT-base encoder GEMM schedule,lightening_dptc,"Lightening-style DPTC reference, 8-bit ADC",1.0,0.0,0.0,1.0,9.600000000000001,384,196608
20260513_tetc_pivot,bert_base_glue_seq128,bert_base,"GLUE validation, seq_len=128",bert_base_glue_seq128:k050,50,bert.encoder.layer.8.attention.self.av_context,mha_av_context,8,1536,128,64,12582912,48,4,2,384,96,98304,204800,48,9.600000000000001,5865.600000000001,5894.560000000001,0.796810647915617,dptc_photonic_tile_schedule,generated canonical BERT-base encoder GEMM schedule,lightening_dptc,"Lightening-style DPTC reference, 8-bit ADC",1.0,0.0,0.0,1.0,9.600000000000001,384,98304
20260513_tetc_pivot,bert_base_glue_seq128,bert_base,"GLUE validation, seq_len=128",bert_base_glue_seq128:k051,51,bert.encoder.layer.8.attention.output.dense,mha_output_projection,8,128,768,768,75497472,4,24,24,2304,96,98304,688128,288,57.6,5875.200000000002,6016.960000000002,0.7724912784732199,dptc_photonic_tile_schedule,generated canonical BERT-base encoder GEMM schedule,lightening_dptc,"Lightening-style DPTC reference, 8-bit ADC",1.0,0.0,0.0,1.0,57.6,2304,98304
20260513_tetc_pivot,bert_base_glue_seq128,bert_base,"GLUE validation, seq_len=128",bert_base_glue_seq128:k052,52,bert.encoder.layer.8.intermediate.dense,ffn_expand,8,128,768,3072,301989888,4,24,96,9216,384,393216,2457600,1152,230.4,5932.800000000002,6480.640000000001,0.7678632115547996,dptc_photonic_tile_schedule,generated canonical BERT-base encoder GEMM schedule,lightening_dptc,"Lightening-style DPTC reference, 8-bit ADC",1.0,0.0,0.0,1.0,230.4,9216,393216
20260513_tetc_pivot,bert_base_glue_seq128,bert_base,"GLUE validation, seq_len=128",bert_base_glue_seq128:k053,53,bert.encoder.layer.8.output.dense,ffn_project,8,128,3072,768,301989888,4,96,24,9216,96,98304,2752512,1152,230.4,6163.200000000002,6711.040000000001,0.7678632115547996,dptc_photonic_tile_schedule,generated canonical BERT-base encoder GEMM schedule,lightening_dptc,"Lightening-style DPTC reference, 8-bit ADC",1.0,0.0,0.0,1.0,230.4,9216,98304
20260513_tetc_pivot,bert_base_glue_seq128,bert_base,"GLUE validation, seq_len=128",bert_base_glue_seq128:k054,54,bert.encoder.layer.9.attention.self.qkv,mha_qkv_projection,9,128,768,2304,226492416,4,24,72,6912,288,294912,1867776,864,172.8,6393.600000000001,6806.080000000002,0.800211580506384,dptc_photonic_tile_schedule,generated canonical BERT-base encoder GEMM schedule,lightening_dptc,"Lightening-style DPTC reference, 8-bit ADC",1.0,0.0,0.0,1.0,172.8,6912,294912
20260513_tetc_pivot,bert_base_glue_seq128,bert_base,"GLUE validation, seq_len=128",bert_base_glue_seq128:k055,55,bert.encoder.layer.9.attention.self.qk_scores,mha_qk_scores,9,1536,64,128,12582912,48,2,4,384,192,196608,106496,48,9.600000000000001,6566.4000000000015,6595.3600000000015,0.8286288297337988,dptc_photonic_tile_schedule,generated canonical BERT-base encoder GEMM schedule,lightening_dptc,"Lightening-style DPTC reference, 8-bit ADC",1.0,0.0,0.0,1.0,9.600000000000001,384,196608
20260513_tetc_pivot,bert_base_glue_seq128,bert_base,"GLUE validation, seq_len=128",bert_base_glue_seq128:k056,56,bert.encoder.layer.9.attention.self.av_context,mha_av_context,9,1536,128,64,12582912,48,4,2,384,96,98304,204800,48,9.600000000000001,6576.000000000002,6604.960000000002,0.8286288297337988,dptc_photonic_tile_schedule,generated canonical BERT-base encoder GEMM schedule,lightening_dptc,"Lightening-style DPTC reference, 8-bit ADC",1.0,0.0,0.0,1.0,9.600000000000001,384,98304
20260513_tetc_pivot,bert_base_glue_seq128,bert_base,"GLUE validation, seq_len=128",bert_base_glue_seq128:k057,57,bert.encoder.layer.9.attention.output.dense,mha_output_projection,9,128,768,768,75497472,4,24,24,2304,96,98304,688128,288,57.6,6585.600000000002,6727.360000000002,0.8043094602914017,dptc_photonic_tile_schedule,generated canonical BERT-base encoder GEMM schedule,lightening_dptc,"Lightening-style DPTC reference, 8-bit ADC",1.0,0.0,0.0,1.0,57.6,2304,98304
20260513_tetc_pivot,bert_base_glue_seq128,bert_base,"GLUE validation, seq_len=128",bert_base_glue_seq128:k058,58,bert.encoder.layer.9.intermediate.dense,ffn_expand,9,128,768,3072,301989888,4,24,96,9216,384,393216,2457600,1152,230.4,6643.200000000003,7191.040000000002,0.7996813933729815,dptc_photonic_tile_schedule,generated canonical BERT-base encoder GEMM schedule,lightening_dptc,"Lightening-style DPTC reference, 8-bit ADC",1.0,0.0,0.0,1.0,230.4,9216,393216
20260513_tetc_pivot,bert_base_glue_seq128,bert_base,"GLUE validation, seq_len=128",bert_base_glue_seq128:k059,59,bert.encoder.layer.9.output.dense,ffn_project,9,128,3072,768,301989888,4,96,24,9216,96,98304,2752512,1152,230.4,6873.600000000002,7421.440000000001,0.7996813933729815,dptc_photonic_tile_schedule,generated canonical BERT-base encoder GEMM schedule,lightening_dptc,"Lightening-style DPTC reference, 8-bit ADC",1.0,0.0,0.0,1.0,230.4,9216,98304
20260513_tetc_pivot,bert_base_glue_seq128,bert_base,"GLUE validation, seq_len=128",bert_base_glue_seq128:k060,60,bert.encoder.layer.10.attention.self.qkv,mha_qkv_projection,10,128,768,2304,226492416,4,24,72,6912,288,294912,1867776,864,172.8,7104.000000000002,7516.480000000002,0.8320297623245658,dptc_photonic_tile_schedule,generated canonical BERT-base encoder GEMM schedule,lightening_dptc,"Lightening-style DPTC reference, 8-bit ADC",1.0,0.0,0.0,1.0,172.8,6912,294912
20260513_tetc_pivot,bert_base_glue_seq128,bert_base,"GLUE validation, seq_len=128",bert_base_glue_seq128:k061,61,bert.encoder.layer.10.attention.self.qk_scores,mha_qk_scores,10,1536,64,128,12582912,48,2,4,384,192,196608,106496,48,9.600000000000001,7276.800000000002,7305.760000000002,0.8604470115519807,dptc_photonic_tile_schedule,generated canonical BERT-base encoder GEMM schedule,lightening_dptc,"Lightening-style DPTC reference, 8-bit ADC",1.0,0.0,0.0,1.0,9.600000000000001,384,196608
20260513_tetc_pivot,bert_base_glue_seq128,bert_base,"GLUE validation, seq_len=128",bert_base_glue_seq128:k062,62,bert.encoder.layer.10.attention.self.av_context,mha_av_context,10,1536,128,64,12582912,48,4,2,384,96,98304,204800,48,9.600000000000001,7286.400000000002,7315.360000000002,0.8604470115519807,dptc_photonic_tile_schedule,generated canonical BERT-base encoder GEMM schedule,lightening_dptc,"Lightening-style DPTC reference, 8-bit ADC",1.0,0.0,0.0,1.0,9.600000000000001,384,98304
20260513_tetc_pivot,bert_base_glue_seq128,bert_base,"GLUE validation, seq_len=128",bert_base_glue_seq128:k063,63,bert.encoder.layer.10.attention.output.dense,mha_output_projection,10,128,768,768,75497472,4,24,24,2304,96,98304,688128,288,57.6,7296.000000000003,7437.760000000003,0.8361276421095836,dptc_photonic_tile_schedule,generated canonical BERT-base encoder GEMM schedule,lightening_dptc,"Lightening-style DPTC reference, 8-bit ADC",1.0,0.0,0.0,1.0,57.6,2304,98304
20260513_tetc_pivot,bert_base_glue_seq128,bert_base,"GLUE validation, seq_len=128",bert_base_glue_seq128:k064,64,bert.encoder.layer.10.intermediate.dense,ffn_expand,10,128,768,3072,301989888,4,24,96,9216,384,393216,2457600,1152,230.4,7353.600000000003,7901.440000000002,0.8314995751911634,dptc_photonic_tile_schedule,generated canonical BERT-base encoder GEMM schedule,lightening_dptc,"Lightening-style DPTC reference, 8-bit ADC",1.0,0.0,0.0,1.0,230.4,9216,393216
20260513_tetc_pivot,bert_base_glue_seq128,bert_base,"GLUE validation, seq_len=128",bert_base_glue_seq128:k065,65,bert.encoder.layer.10.output.dense,ffn_project,10,128,3072,768,301989888,4,96,24,9216,96,98304,2752512,1152,230.4,7584.000000000003,8131.840000000002,0.8314995751911634,dptc_photonic_tile_schedule,generated canonical BERT-base encoder GEMM schedule,lightening_dptc,"Lightening-style DPTC reference, 8-bit ADC",1.0,0.0,0.0,1.0,230.4,9216,98304
20260513_tetc_pivot,bert_base_glue_seq128,bert_base,"GLUE validation, seq_len=128",bert_base_glue_seq128:k066,66,bert.encoder.layer.11.attention.self.qkv,mha_qkv_projection,11,128,768,2304,226492416,4,24,72,6912,288,294912,1867776,864,172.8,7814.400000000002,8226.880000000003,0.8638479441427476,dptc_photonic_tile_schedule,generated canonical BERT-base encoder GEMM schedule,lightening_dptc,"Lightening-style DPTC reference, 8-bit ADC",1.0,0.0,0.0,1.0,172.8,6912,294912
20260513_tetc_pivot,bert_base_glue_seq128,bert_base,"GLUE validation, seq_len=128",bert_base_glue_seq128:k067,67,bert.encoder.layer.11.attention.self.qk_scores,mha_qk_scores,11,1536,64,128,12582912,48,2,4,384,192,196608,106496,48,9.600000000000001,7987.200000000003,8016.160000000003,0.8922651933701624,dptc_photonic_tile_schedule,generated canonical BERT-base encoder GEMM schedule,lightening_dptc,"Lightening-style DPTC reference, 8-bit ADC",1.0,0.0,0.0,1.0,9.600000000000001,384,196608
20260513_tetc_pivot,bert_base_glue_seq128,bert_base,"GLUE validation, seq_len=128",bert_base_glue_seq128:k068,68,bert.encoder.layer.11.attention.self.av_context,mha_av_context,11,1536,128,64,12582912,48,4,2,384,96,98304,204800,48,9.600000000000001,7996.800000000003,8025.760000000003,0.8922651933701624,dptc_photonic_tile_schedule,generated canonical BERT-base encoder GEMM schedule,lightening_dptc,"Lightening-style DPTC reference, 8-bit ADC",1.0,0.0,0.0,1.0,9.600000000000001,384,98304
20260513_tetc_pivot,bert_base_glue_seq128,bert_base,"GLUE validation, seq_len=128",bert_base_glue_seq128:k069,69,bert.encoder.layer.11.attention.output.dense,mha_output_projection,11,128,768,768,75497472,4,24,24,2304,96,98304,688128,288,57.6,8006.400000000003,8148.1600000000035,0.8679458239277653,dptc_photonic_tile_schedule,generated canonical BERT-base encoder GEMM schedule,lightening_dptc,"Lightening-style DPTC reference, 8-bit ADC",1.0,0.0,0.0,1.0,57.6,2304,98304
20260513_tetc_pivot,bert_base_glue_seq128,bert_base,"GLUE validation, seq_len=128",bert_base_glue_seq128:k070,70,bert.encoder.layer.11.intermediate.dense,ffn_expand,11,128,768,3072,301989888,4,24,96,9216,384,393216,2457600,1152,230.4,8064.000000000004,8611.840000000004,0.8633177570093462,dptc_photonic_tile_schedule,generated canonical BERT-base encoder GEMM schedule,lightening_dptc,"Lightening-style DPTC reference, 8-bit ADC",1.0,0.0,0.0,1.0,230.4,9216,393216
20260513_tetc_pivot,bert_base_glue_seq128,bert_base,"GLUE validation, seq_len=128",bert_base_glue_seq128:k071,71,bert.encoder.layer.11.output.dense,ffn_project,11,128,3072,768,301989888,4,96,24,9216,96,98304,2752512,1152,230.4,8294.400000000003,8842.240000000003,0.8633177570093451,dptc_photonic_tile_schedule,generated canonical BERT-base encoder GEMM schedule,lightening_dptc,"Lightening-style DPTC reference, 8-bit ADC",1.0,0.0,0.0,1.0,230.4,9216,98304
20260513_tetc_pivot,bert_base_glue_seq128,bert_base,"GLUE validation, seq_len=128",bert_base_glue_seq128:k000,0,bert.encoder.layer.0.attention.self.qkv,mha_qkv_projection,0,128,768,2304,226492416,4,24,72,6912,288,294912,1867776,864,172.8,0.0,412.48,0.5138479441427464,dptc_photonic_tile_schedule,generated canonical BERT-base encoder GEMM schedule,uniform_8bit,Uniform 8-bit DPTC mapping,1.0,0.0,0.0,1.0,172.8,6912,294912
20260513_tetc_pivot,bert_base_glue_seq128,bert_base,"GLUE validation, seq_len=128",bert_base_glue_seq128:k001,1,bert.encoder.layer.0.attention.self.qk_scores,mha_qk_scores,0,1536,64,128,12582912,48,2,4,384,192,196608,106496,48,9.600000000000001,172.8,201.76000000000002,0.5422651933701657,dptc_photonic_tile_schedule,generated canonical BERT-base encoder GEMM schedule,uniform_8bit,Uniform 8-bit DPTC mapping,1.0,0.0,0.0,1.0,9.600000000000001,384,196608
20260513_tetc_pivot,bert_base_glue_seq128,bert_base,"GLUE validation, seq_len=128",bert_base_glue_seq128:k002,2,bert.encoder.layer.0.attention.self.av_context,mha_av_context,0,1536,128,64,12582912,48,4,2,384,96,98304,204800,48,9.600000000000001,182.4,211.36,0.5422651933701657,dptc_photonic_tile_schedule,generated canonical BERT-base encoder GEMM schedule,uniform_8bit,Uniform 8-bit DPTC mapping,1.0,0.0,0.0,1.0,9.600000000000001,384,98304
20260513_tetc_pivot,bert_base_glue_seq128,bert_base,"GLUE validation, seq_len=128",bert_base_glue_seq128:k003,3,bert.encoder.layer.0.attention.output.dense,mha_output_projection,0,128,768,768,75497472,4,24,24,2304,96,98304,688128,288,57.6,192.0,333.76,0.517945823927765,dptc_photonic_tile_schedule,generated canonical BERT-base encoder GEMM schedule,uniform_8bit,Uniform 8-bit DPTC mapping,1.0,0.0,0.0,1.0,57.6,2304,98304
20260513_tetc_pivot,bert_base_glue_seq128,bert_base,"GLUE validation, seq_len=128",bert_base_glue_seq128:k004,4,bert.encoder.layer.0.intermediate.dense,ffn_expand,0,128,768,3072,301989888,4,24,96,9216,384,393216,2457600,1152,230.4,249.6,797.44,0.5133177570093458,dptc_photonic_tile_schedule,generated canonical BERT-base encoder GEMM schedule,uniform_8bit,Uniform 8-bit DPTC mapping,1.0,0.0,0.0,1.0,230.4,9216,393216
20260513_tetc_pivot,bert_base_glue_seq128,bert_base,"GLUE validation, seq_len=128",bert_base_glue_seq128:k005,5,bert.encoder.layer.0.output.dense,ffn_project,0,128,3072,768,301989888,4,96,24,9216,96,98304,2752512,1152,230.4,480.0,1027.84,0.5133177570093456,dptc_photonic_tile_schedule,generated canonical BERT-base encoder GEMM schedule,uniform_8bit,Uniform 8-bit DPTC mapping,1.0,0.0,0.0,1.0,230.4,9216,98304
20260513_tetc_pivot,bert_base_glue_seq128,bert_base,"GLUE validation, seq_len=128",bert_base_glue_seq128:k006,6,bert.encoder.layer.1.attention.self.qkv,mha_qkv_projection,1,128,768,2304,226492416,4,24,72,6912,288,294912,1867776,864,172.8,710.4,1122.88,0.5456661259609283,dptc_photonic_tile_schedule,generated canonical BERT-base encoder GEMM schedule,uniform_8bit,Uniform 8-bit DPTC mapping,1.0,0.0,0.0,1.0,172.8,6912,294912
20260513_tetc_pivot,bert_base_glue_seq128,bert_base,"GLUE validation, seq_len=128",bert_base_glue_seq128:k007,7,bert.encoder.layer.1.attention.self.qk_scores,mha_qk_scores,1,1536,64,128,12582912,48,2,4,384,192,196608,106496,48,9.600000000000001,883.2,912.1600000000001,0.5740833751883494,dptc_photonic_tile_schedule,generated canonical BERT-base encoder GEMM schedule,uniform_8bit,Uniform 8-bit DPTC mapping,1.0,0.0,0.0,1.0,9.600000000000001,384,196608
20260513_tetc_pivot,bert_base_glue_seq128,bert_base,"GLUE validation, seq_len=128",bert_base_glue_seq128:k008,8,bert.encoder.layer.1.attention.self.av_context,mha_av_context,1,1536,128,64,12582912,48,4,2,384,96,98304,204800,48,9.600000000000001,892.8000000000001,921.7600000000001,0.5740833751883494,dptc_photonic_tile_schedule,generated canonical BERT-base encoder GEMM schedule,uniform_8bit,Uniform 8-bit DPTC mapping,1.0,0.0,0.0,1.0,9.600000000000001,384,98304
20260513_tetc_pivot,bert_base_glue_seq128,bert_base,"GLUE validation, seq_len=128",bert_base_glue_seq128:k009,9,bert.encoder.layer.1.attention.output.dense,mha_output_projection,1,128,768,768,75497472,4,24,24,2304,96,98304,688128,288,57.6,902.4000000000001,1044.16,0.5497640057459472,dptc_photonic_tile_schedule,generated canonical BERT-base encoder GEMM schedule,uniform_8bit,Uniform 8-bit DPTC mapping,1.0,0.0,0.0,1.0,57.6,2304,98304
20260513_tetc_pivot,bert_base_glue_seq128,bert_base,"GLUE validation, seq_len=128",bert_base_glue_seq128:k010,10,bert.encoder.layer.1.intermediate.dense,ffn_expand,1,128,768,3072,301989888,4,24,96,9216,384,393216,2457600,1152,230.4,960.0000000000001,1507.8400000000001,0.5451359388275278,dptc_photonic_tile_schedule,generated canonical BERT-base encoder GEMM schedule,uniform_8bit,Uniform 8-bit DPTC mapping,1.0,0.0,0.0,1.0,230.4,9216,393216
20260513_tetc_pivot,bert_base_glue_seq128,bert_base,"GLUE validation, seq_len=128",bert_base_glue_seq128:k011,11,bert.encoder.layer.1.output.dense,ffn_project,1,128,3072,768,301989888,4,96,24,9216,96,98304,2752512,1152,230.4,1190.4,1738.2400000000002,0.5451359388275278,dptc_photonic_tile_schedule,generated canonical BERT-base encoder GEMM schedule,uniform_8bit,Uniform 8-bit DPTC mapping,1.0,0.0,0.0,1.0,230.4,9216,98304
20260513_tetc_pivot,bert_base_glue_seq128,bert_base,"GLUE validation, seq_len=128",bert_base_glue_seq128:k012,12,bert.encoder.layer.2.attention.self.qkv,mha_qkv_projection,2,128,768,2304,226492416,4,24,72,6912,288,294912,1867776,864,172.8,1420.8000000000002,1833.2800000000002,0.5774843077791098,dptc_photonic_tile_schedule,generated canonical BERT-base encoder GEMM schedule,uniform_8bit,Uniform 8-bit DPTC mapping,1.0,0.0,0.0,1.0,172.8,6912,294912
20260513_tetc_pivot,bert_base_glue_seq128,bert_base,"GLUE validation, seq_len=128",bert_base_glue_seq128:k013,13,bert.encoder.layer.2.attention.self.qk_scores,mha_qk_scores,2,1536,64,128,12582912,48,2,4,384,192,196608,106496,48,9.600000000000001,1593.6000000000001,1622.56,0.605901557006526,dptc_photonic_tile_schedule,generated canonical BERT-base encoder GEMM schedule,uniform_8bit,Uniform 8-bit DPTC mapping,1.0,0.0,0.0,1.0,9.600000000000001,384,196608
20260513_tetc_pivot,bert_base_glue_seq128,bert_base,"GLUE validation, seq_len=128",bert_base_glue_seq128:k014,14,bert.encoder.layer.2.attention.self.av_context,mha_av_context,2,1536,128,64,12582912,48,4,2,384,96,98304,204800,48,9.600000000000001,1603.2,1632.1599999999999,0.605901557006526,dptc_photonic_tile_schedule,generated canonical BERT-base encoder GEMM schedule,uniform_8bit,Uniform 8-bit DPTC mapping,1.0,0.0,0.0,1.0,9.600000000000001,384,98304
20260513_tetc_pivot,bert_base_glue_seq128,bert_base,"GLUE validation, seq_len=128",bert_base_glue_seq128:k015,15,bert.encoder.layer.2.attention.output.dense,mha_output_projection,2,128,768,768,75497472,4,24,24,2304,96,98304,688128,288,57.6,1612.8,1754.56,0.5815821875641289,dptc_photonic_tile_schedule,generated canonical BERT-base encoder GEMM schedule,uniform_8bit,Uniform 8-bit DPTC mapping,1.0,0.0,0.0,1.0,57.6,2304,98304
20260513_tetc_pivot,bert_base_glue_seq128,bert_base,"GLUE validation, seq_len=128",bert_base_glue_seq128:k016,16,bert.encoder.layer.2.intermediate.dense,ffn_expand,2,128,768,3072,301989888,4,24,96,9216,384,393216,2457600,1152,230.4,1670.3999999999999,2218.24,0.5769541206457092,dptc_photonic_tile_schedule,generated canonical BERT-base encoder GEMM schedule,uniform_8bit,Uniform 8-bit DPTC mapping,1.0,0.0,0.0,1.0,230.4,9216,393216
20260513_tetc_pivot,bert_base_glue_seq128,bert_base,"GLUE validation, seq_len=128",bert_base_glue_seq128:k017,17,bert.encoder.layer.2.output.dense,ffn_project,2,128,3072,768,301989888,4,96,24,9216,96,98304,2752512,1152,230.4,1900.8,2448.64,0.5769541206457092,dptc_photonic_tile_schedule,generated canonical BERT-base encoder GEMM schedule,uniform_8bit,Uniform 8-bit DPTC mapping,1.0,0.0,0.0,1.0,230.4,9216,98304
20260513_tetc_pivot,bert_base_glue_seq128,bert_base,"GLUE validation, seq_len=128",bert_base_glue_seq128:k018,18,bert.encoder.layer.3.attention.self.qkv,mha_qkv_projection,3,128,768,2304,226492416,4,24,72,6912,288,294912,1867776,864,172.8,2131.2,2543.68,0.6093024895972916,dptc_photonic_tile_schedule,generated canonical BERT-base encoder GEMM schedule,uniform_8bit,Uniform 8-bit DPTC mapping,1.0,0.0,0.0,1.0,172.8,6912,294912
20260513_tetc_pivot,bert_base_glue_seq128,bert_base,"GLUE validation, seq_len=128",bert_base_glue_seq128:k019,19,bert.encoder.layer.3.attention.self.qk_scores,mha_qk_scores,3,1536,64,128,12582912,48,2,4,384,192,196608,106496,48,9.600000000000001,2304.0,2332.96,0.6377197388247079,dptc_photonic_tile_schedule,generated canonical BERT-base encoder GEMM schedule,uniform_8bit,Uniform 8-bit DPTC mapping,1.0,0.0,0.0,1.0,9.600000000000001,384,196608
20260513_tetc_pivot,bert_base_glue_seq128,bert_base,"GLUE validation, seq_len=128",bert_base_glue_seq128:k020,20,bert.encoder.layer.3.attention.self.av_context,mha_av_context,3,1536,128,64,12582912,48,4,2,384,96,98304,204800,48,9.600000000000001,2313.6,2342.56,0.6377197388247079,dptc_photonic_tile_schedule,generated canonical BERT-base encoder GEMM schedule,uniform_8bit,Uniform 8-bit DPTC mapping,1.0,0.0,0.0,1.0,9.600000000000001,384,98304
20260513_tetc_pivot,bert_base_glue_seq128,bert_base,"GLUE validation, seq_len=128",bert_base_glue_seq128:k021,21,bert.encoder.layer.3.attention.output.dense,mha_output_projection,3,128,768,768,75497472,4,24,24,2304,96,98304,688128,288,57.6,2323.2,2464.9599999999996,0.6134003693823087,dptc_photonic_tile_schedule,generated canonical BERT-base encoder GEMM schedule,uniform_8bit,Uniform 8-bit DPTC mapping,1.0,0.0,0.0,1.0,57.6,2304,98304
20260513_tetc_pivot,bert_base_glue_seq128,bert_base,"GLUE validation, seq_len=128",bert_base_glue_seq128:k022,22,bert.encoder.layer.3.intermediate.dense,ffn_expand,3,128,768,3072,301989888,4,24,96,9216,384,393216,2457600,1152,230.4,2380.7999999999997,2928.64,0.6087723024638917,dptc_photonic_tile_schedule,generated canonical BERT-base encoder GEMM schedule,uniform_8bit,Uniform 8-bit DPTC mapping,1.0,0.0,0.0,1.0,230.4,9216,393216
20260513_tetc_pivot,bert_base_glue_seq128,bert_base,"GLUE validation, seq_len=128",bert_base_glue_seq128:k023,23,bert.encoder.layer.3.output.dense,ffn_project,3,128,3072,768,301989888,4,96,24,9216,96,98304,2752512,1152,230.4,2611.2,3159.04,0.6087723024638917,dptc_photonic_tile_schedule,generated canonical BERT-base encoder GEMM schedule,uniform_8bit,Uniform 8-bit DPTC mapping,1.0,0.0,0.0,1.0,230.4,9216,98304
20260513_tetc_pivot,bert_base_glue_seq128,bert_base,"GLUE validation, seq_len=128",bert_base_glue_seq128:k024,24,bert.encoder.layer.4.attention.self.qkv,mha_qkv_projection,4,128,768,2304,226492416,4,24,72,6912,288,294912,1867776,864,172.8,2841.6,3254.08,0.6411206714154734,dptc_photonic_tile_schedule,generated canonical BERT-base encoder GEMM schedule,uniform_8bit,Uniform 8-bit DPTC mapping,1.0,0.0,0.0,1.0,172.8,6912,294912
20260513_tetc_pivot,bert_base_glue_seq128,bert_base,"GLUE validation, seq_len=128",bert_base_glue_seq128:k025,25,bert.encoder.layer.4.attention.self.qk_scores,mha_qk_scores,4,1536,64,128,12582912,48,2,4,384,192,196608,106496,48,9.600000000000001,3014.4,3043.36,0.6695379206428898,dptc_photonic_tile_schedule,generated canonical BERT-base encoder GEMM schedule,uniform_8bit,Uniform 8-bit DPTC mapping,1.0,0.0,0.0,1.0,9.600000000000001,384,196608
20260513_tetc_pivot,bert_base_glue_seq128,bert_base,"GLUE validation, seq_len=128",bert_base_glue_seq128:k026,26,bert.encoder.layer.4.attention.self.av_context,mha_av_context,4,1536,128,64,12582912,48,4,2,384,96,98304,204800,48,9.600000000000001,3024.0,3052.96,0.6695379206428898,dptc_photonic_tile_schedule,generated canonical BERT-base encoder GEMM schedule,uniform_8bit,Uniform 8-bit DPTC mapping,1.0,0.0,0.0,1.0,9.600000000000001,384,98304
20260513_tetc_pivot,bert_base_glue_seq128,bert_base,"GLUE validation, seq_len=128",bert_base_glue_seq128:k027,27,bert.encoder.layer.4.attention.output.dense,mha_output_projection,4,128,768,768,75497472,4,24,24,2304,96,98304,688128,288,57.6,3033.6,3175.3599999999997,0.6452185512004904,dptc_photonic_tile_schedule,generated canonical BERT-base encoder GEMM schedule,uniform_8bit,Uniform 8-bit DPTC mapping,1.0,0.0,0.0,1.0,57.6,2304,98304
20260513_tetc_pivot,bert_base_glue_seq128,bert_base,"GLUE validation, seq_len=128",bert_base_glue_seq128:k028,28,bert.encoder.layer.4.intermediate.dense,ffn_expand,4,128,768,3072,301989888,4,24,96,9216,384,393216,2457600,1152,230.4,3091.2,3639.04,0.6405904842820735,dptc_photonic_tile_schedule,generated canonical BERT-base encoder GEMM schedule,uniform_8bit,Uniform 8-bit DPTC mapping,1.0,0.0,0.0,1.0,230.4,9216,393216
20260513_tetc_pivot,bert_base_glue_seq128,bert_base,"GLUE validation, seq_len=128",bert_base_glue_seq128:k029,29,bert.encoder.layer.4.output.dense,ffn_project,4,128,3072,768,301989888,4,96,24,9216,96,98304,2752512,1152,230.4,3321.6,3869.44,0.6405904842820735,dptc_photonic_tile_schedule,generated canonical BERT-base encoder GEMM schedule,uniform_8bit,Uniform 8-bit DPTC mapping,1.0,0.0,0.0,1.0,230.4,9216,98304
20260513_tetc_pivot,bert_base_glue_seq128,bert_base,"GLUE validation, seq_len=128",bert_base_glue_seq128:k030,30,bert.encoder.layer.5.attention.self.qkv,mha_qkv_projection,5,128,768,2304,226492416,4,24,72,6912,288,294912,1867776,864,172.8,3552.0,3964.48,0.6729388532336552,dptc_photonic_tile_schedule,generated canonical BERT-base encoder GEMM schedule,uniform_8bit,Uniform 8-bit DPTC mapping,1.0,0.0,0.0,1.0,172.8,6912,294912
20260513_tetc_pivot,bert_base_glue_seq128,bert_base,"GLUE validation, seq_len=128",bert_base_glue_seq128:k031,31,bert.encoder.layer.5.attention.self.qk_scores,mha_qk_scores,5,1536,64,128,12582912,48,2,4,384,192,196608,106496,48,9.600000000000001,3724.8,3753.76,0.7013561024610715,dptc_photonic_tile_schedule,generated canonical BERT-base encoder GEMM schedule,uniform_8bit,Uniform 8-bit DPTC mapping,1.0,0.0,0.0,1.0,9.600000000000001,384,196608
20260513_tetc_pivot,bert_base_glue_seq128,bert_base,"GLUE validation, seq_len=128",bert_base_glue_seq128:k032,32,bert.encoder.layer.5.attention.self.av_context,mha_av_context,5,1536,128,64,12582912,48,4,2,384,96,98304,204800,48,9.600000000000001,3734.4,3763.36,0.7013561024610715,dptc_photonic_tile_schedule,generated canonical BERT-base encoder GEMM schedule,uniform_8bit,Uniform 8-bit DPTC mapping,1.0,0.0,0.0,1.0,9.600000000000001,384,98304
20260513_tetc_pivot,bert_base_glue_seq128,bert_base,"GLUE validation, seq_len=128",bert_base_glue_seq128:k033,33,bert.encoder.layer.5.attention.output.dense,mha_output_projection,5,128,768,768,75497472,4,24,24,2304,96,98304,688128,288,57.6,3744.0,3885.7599999999998,0.6770367330186723,dptc_photonic_tile_schedule,generated canonical BERT-base encoder GEMM schedule,uniform_8bit,Uniform 8-bit DPTC mapping,1.0,0.0,0.0,1.0,57.6,2304,98304
20260513_tetc_pivot,bert_base_glue_seq128,bert_base,"GLUE validation, seq_len=128",bert_base_glue_seq128:k034,34,bert.encoder.layer.5.intermediate.dense,ffn_expand,5,128,768,3072,301989888,4,24,96,9216,384,393216,2457600,1152,230.4,3801.6,4349.44,0.6724086661002546,dptc_photonic_tile_schedule,generated canonical BERT-base encoder GEMM schedule,uniform_8bit,Uniform 8-bit DPTC mapping,1.0,0.0,0.0,1.0,230.4,9216,393216
20260513_tetc_pivot,bert_base_glue_seq128,bert_base,"GLUE validation, seq_len=128",bert_base_glue_seq128:k035,35,bert.encoder.layer.5.output.dense,ffn_project,5,128,3072,768,301989888,4,96,24,9216,96,98304,2752512,1152,230.4,4032.0,4579.839999999999,0.6724086661002542,dptc_photonic_tile_schedule,generated canonical BERT-base encoder GEMM schedule,uniform_8bit,Uniform 8-bit DPTC mapping,1.0,0.0,0.0,1.0,230.4,9216,98304
20260513_tetc_pivot,bert_base_glue_seq128,bert_base,"GLUE validation, seq_len=128",bert_base_glue_seq128:k036,36,bert.encoder.layer.6.attention.self.qkv,mha_qkv_projection,6,128,768,2304,226492416,4,24,72,6912,288,294912,1867776,864,172.8,4262.4,4674.88,0.7047570350518385,dptc_photonic_tile_schedule,generated canonical BERT-base encoder GEMM schedule,uniform_8bit,Uniform 8-bit DPTC mapping,1.0,0.0,0.0,1.0,172.8,6912,294912
20260513_tetc_pivot,bert_base_glue_seq128,bert_base,"GLUE validation, seq_len=128",bert_base_glue_seq128:k037,37,bert.encoder.layer.6.attention.self.qk_scores,mha_qk_scores,6,1536,64,128,12582912,48,2,4,384,192,196608,106496,48,9.600000000000001,4435.2,4464.16,0.7331742842792534,dptc_photonic_tile_schedule,generated canonical BERT-base encoder GEMM schedule,uniform_8bit,Uniform 8-bit DPTC mapping,1.0,0.0,0.0,1.0,9.600000000000001,384,196608
20260513_tetc_pivot,bert_base_glue_seq128,bert_base,"GLUE validation, seq_len=128",bert_base_glue_seq128:k038,38,bert.encoder.layer.6.attention.self.av_context,mha_av_context,6,1536,128,64,12582912,48,4,2,384,96,98304,204800,48,9.600000000000001,4444.8,4473.76,0.7331742842792534,dptc_photonic_tile_schedule,generated canonical BERT-base encoder GEMM schedule,uniform_8bit,Uniform 8-bit DPTC mapping,1.0,0.0,0.0,1.0,9.600000000000001,384,98304
20260513_tetc_pivot,bert_base_glue_seq128,bert_base,"GLUE validation, seq_len=128",bert_base_glue_seq128:k039,39,bert.encoder.layer.6.attention.output.dense,mha_output_projection,6,128,768,768,75497472,4,24,24,2304,96,98304,688128,288,57.6,4454.400000000001,4596.160000000001,0.7088549148368563,dptc_photonic_tile_schedule,generated canonical BERT-base encoder GEMM schedule,uniform_8bit,Uniform 8-bit DPTC mapping,1.0,0.0,0.0,1.0,57.6,2304,98304
20260513_tetc_pivot,bert_base_glue_seq128,bert_base,"GLUE validation, seq_len=128",bert_base_glue_seq128:k040,40,bert.encoder.layer.6.intermediate.dense,ffn_expand,6,128,768,3072,301989888,4,24,96,9216,384,393216,2457600,1152,230.4,4512.000000000001,5059.84,0.704226847918436,dptc_photonic_tile_schedule,generated canonical BERT-base encoder GEMM schedule,uniform_8bit,Uniform 8-bit DPTC mapping,1.0,0.0,0.0,1.0,230.4,9216,393216
20260513_tetc_pivot,bert_base_glue_seq128,bert_base,"GLUE validation, seq_len=128",bert_base_glue_seq128:k041,41,bert.encoder.layer.6.output.dense,ffn_project,6,128,3072,768,301989888,4,96,24,9216,96,98304,2752512,1152,230.4,4742.400000000001,5290.24,0.704226847918436,dptc_photonic_tile_schedule,generated canonical BERT-base encoder GEMM schedule,uniform_8bit,Uniform 8-bit DPTC mapping,1.0,0.0,0.0,1.0,230.4,9216,98304
20260513_tetc_pivot,bert_base_glue_seq128,bert_base,"GLUE validation, seq_len=128",bert_base_glue_seq128:k042,42,bert.encoder.layer.7.attention.self.qkv,mha_qkv_projection,7,128,768,2304,226492416,4,24,72,6912,288,294912,1867776,864,172.8,4972.8,5385.280000000001,0.7365752168700204,dptc_photonic_tile_schedule,generated canonical BERT-base encoder GEMM schedule,uniform_8bit,Uniform 8-bit DPTC mapping,1.0,0.0,0.0,1.0,172.8,6912,294912
20260513_tetc_pivot,bert_base_glue_seq128,bert_base,"GLUE validation, seq_len=128",bert_base_glue_seq128:k043,43,bert.encoder.layer.7.attention.self.qk_scores,mha_qk_scores,7,1536,64,128,12582912,48,2,4,384,192,196608,106496,48,9.600000000000001,5145.6,5174.56,0.7649924660974352,dptc_photonic_tile_schedule,generated canonical BERT-base encoder GEMM schedule,uniform_8bit,Uniform 8-bit DPTC mapping,1.0,0.0,0.0,1.0,9.600000000000001,384,196608
20260513_tetc_pivot,bert_base_glue_seq128,bert_base,"GLUE validation, seq_len=128",bert_base_glue_seq128:k044,44,bert.encoder.layer.7.attention.self.av_context,mha_av_context,7,1536,128,64,12582912,48,4,2,384,96,98304,204800,48,9.600000000000001,5155.200000000001,5184.160000000001,0.7649924660974352,dptc_photonic_tile_schedule,generated canonical BERT-base encoder GEMM schedule,uniform_8bit,Uniform 8-bit DPTC mapping,1.0,0.0,0.0,1.0,9.600000000000001,384,98304
20260513_tetc_pivot,bert_base_glue_seq128,bert_base,"GLUE validation, seq_len=128",bert_base_glue_seq128:k045,45,bert.encoder.layer.7.attention.output.dense,mha_output_projection,7,128,768,768,75497472,4,24,24,2304,96,98304,688128,288,57.6,5164.800000000001,5306.560000000001,0.7406730966550381,dptc_photonic_tile_schedule,generated canonical BERT-base encoder GEMM schedule,uniform_8bit,Uniform 8-bit DPTC mapping,1.0,0.0,0.0,1.0,57.6,2304,98304
20260513_tetc_pivot,bert_base_glue_seq128,bert_base,"GLUE validation, seq_len=128",bert_base_glue_seq128:k046,46,bert.encoder.layer.7.intermediate.dense,ffn_expand,7,128,768,3072,301989888,4,24,96,9216,384,393216,2457600,1152,230.4,5222.4000000000015,5770.240000000001,0.7360450297366179,dptc_photonic_tile_schedule,generated canonical BERT-base encoder GEMM schedule,uniform_8bit,Uniform 8-bit DPTC mapping,1.0,0.0,0.0,1.0,230.4,9216,393216
20260513_tetc_pivot,bert_base_glue_seq128,bert_base,"GLUE validation, seq_len=128",bert_base_glue_seq128:k047,47,bert.encoder.layer.7.output.dense,ffn_project,7,128,3072,768,301989888,4,96,24,9216,96,98304,2752512,1152,230.4,5452.800000000001,6000.64,0.7360450297366179,dptc_photonic_tile_schedule,generated canonical BERT-base encoder GEMM schedule,uniform_8bit,Uniform 8-bit DPTC mapping,1.0,0.0,0.0,1.0,230.4,9216,98304
20260513_tetc_pivot,bert_base_glue_seq128,bert_base,"GLUE validation, seq_len=128",bert_base_glue_seq128:k048,48,bert.encoder.layer.8.attention.self.qkv,mha_qkv_projection,8,128,768,2304,226492416,4,24,72,6912,288,294912,1867776,864,172.8,5683.200000000001,6095.680000000001,0.7683933986882021,dptc_photonic_tile_schedule,generated canonical BERT-base encoder GEMM schedule,uniform_8bit,Uniform 8-bit DPTC mapping,1.0,0.0,0.0,1.0,172.8,6912,294912
20260513_tetc_pivot,bert_base_glue_seq128,bert_base,"GLUE validation, seq_len=128",bert_base_glue_seq128:k049,49,bert.encoder.layer.8.attention.self.qk_scores,mha_qk_scores,8,1536,64,128,12582912,48,2,4,384,192,196608,106496,48,9.600000000000001,5856.000000000001,5884.960000000001,0.796810647915617,dptc_photonic_tile_schedule,generated canonical BERT-base encoder GEMM schedule,uniform_8bit,Uniform 8-bit DPTC mapping,1.0,0.0,0.0,1.0,9.600000000000001,384,196608
20260513_tetc_pivot,bert_base_glue_seq128,bert_base,"GLUE validation, seq_len=128",bert_base_glue_seq128:k050,50,bert.encoder.layer.8.attention.self.av_context,mha_av_context,8,1536,128,64,12582912,48,4,2,384,96,98304,204800,48,9.600000000000001,5865.600000000001,5894.560000000001,0.796810647915617,dptc_photonic_tile_schedule,generated canonical BERT-base encoder GEMM schedule,uniform_8bit,Uniform 8-bit DPTC mapping,1.0,0.0,0.0,1.0,9.600000000000001,384,98304
20260513_tetc_pivot,bert_base_glue_seq128,bert_base,"GLUE validation, seq_len=128",bert_base_glue_seq128:k051,51,bert.encoder.layer.8.attention.output.dense,mha_output_projection,8,128,768,768,75497472,4,24,24,2304,96,98304,688128,288,57.6,5875.200000000002,6016.960000000002,0.7724912784732199,dptc_photonic_tile_schedule,generated canonical BERT-base encoder GEMM schedule,uniform_8bit,Uniform 8-bit DPTC mapping,1.0,0.0,0.0,1.0,57.6,2304,98304
20260513_tetc_pivot,bert_base_glue_seq128,bert_base,"GLUE validation, seq_len=128",bert_base_glue_seq128:k052,52,bert.encoder.layer.8.intermediate.dense,ffn_expand,8,128,768,3072,301989888,4,24,96,9216,384,393216,2457600,1152,230.4,5932.800000000002,6480.640000000001,0.7678632115547996,dptc_photonic_tile_schedule,generated canonical BERT-base encoder GEMM schedule,uniform_8bit,Uniform 8-bit DPTC mapping,1.0,0.0,0.0,1.0,230.4,9216,393216
20260513_tetc_pivot,bert_base_glue_seq128,bert_base,"GLUE validation, seq_len=128",bert_base_glue_seq128:k053,53,bert.encoder.layer.8.output.dense,ffn_project,8,128,3072,768,301989888,4,96,24,9216,96,98304,2752512,1152,230.4,6163.200000000002,6711.040000000001,0.7678632115547996,dptc_photonic_tile_schedule,generated canonical BERT-base encoder GEMM schedule,uniform_8bit,Uniform 8-bit DPTC mapping,1.0,0.0,0.0,1.0,230.4,9216,98304
20260513_tetc_pivot,bert_base_glue_seq128,bert_base,"GLUE validation, seq_len=128",bert_base_glue_seq128:k054,54,bert.encoder.layer.9.attention.self.qkv,mha_qkv_projection,9,128,768,2304,226492416,4,24,72,6912,288,294912,1867776,864,172.8,6393.600000000001,6806.080000000002,0.800211580506384,dptc_photonic_tile_schedule,generated canonical BERT-base encoder GEMM schedule,uniform_8bit,Uniform 8-bit DPTC mapping,1.0,0.0,0.0,1.0,172.8,6912,294912
20260513_tetc_pivot,bert_base_glue_seq128,bert_base,"GLUE validation, seq_len=128",bert_base_glue_seq128:k055,55,bert.encoder.layer.9.attention.self.qk_scores,mha_qk_scores,9,1536,64,128,12582912,48,2,4,384,192,196608,106496,48,9.600000000000001,6566.4000000000015,6595.3600000000015,0.8286288297337988,dptc_photonic_tile_schedule,generated canonical BERT-base encoder GEMM schedule,uniform_8bit,Uniform 8-bit DPTC mapping,1.0,0.0,0.0,1.0,9.600000000000001,384,196608
20260513_tetc_pivot,bert_base_glue_seq128,bert_base,"GLUE validation, seq_len=128",bert_base_glue_seq128:k056,56,bert.encoder.layer.9.attention.self.av_context,mha_av_context,9,1536,128,64,12582912,48,4,2,384,96,98304,204800,48,9.600000000000001,6576.000000000002,6604.960000000002,0.8286288297337988,dptc_photonic_tile_schedule,generated canonical BERT-base encoder GEMM schedule,uniform_8bit,Uniform 8-bit DPTC mapping,1.0,0.0,0.0,1.0,9.600000000000001,384,98304
20260513_tetc_pivot,bert_base_glue_seq128,bert_base,"GLUE validation, seq_len=128",bert_base_glue_seq128:k057,57,bert.encoder.layer.9.attention.output.dense,mha_output_projection,9,128,768,768,75497472,4,24,24,2304,96,98304,688128,288,57.6,6585.600000000002,6727.360000000002,0.8043094602914017,dptc_photonic_tile_schedule,generated canonical BERT-base encoder GEMM schedule,uniform_8bit,Uniform 8-bit DPTC mapping,1.0,0.0,0.0,1.0,57.6,2304,98304
20260513_tetc_pivot,bert_base_glue_seq128,bert_base,"GLUE validation, seq_len=128",bert_base_glue_seq128:k058,58,bert.encoder.layer.9.intermediate.dense,ffn_expand,9,128,768,3072,301989888,4,24,96,9216,384,393216,2457600,1152,230.4,6643.200000000003,7191.040000000002,0.7996813933729815,dptc_photonic_tile_schedule,generated canonical BERT-base encoder GEMM schedule,uniform_8bit,Uniform 8-bit DPTC mapping,1.0,0.0,0.0,1.0,230.4,9216,393216
20260513_tetc_pivot,bert_base_glue_seq128,bert_base,"GLUE validation, seq_len=128",bert_base_glue_seq128:k059,59,bert.encoder.layer.9.output.dense,ffn_project,9,128,3072,768,301989888,4,96,24,9216,96,98304,2752512,1152,230.4,6873.600000000002,7421.440000000001,0.7996813933729815,dptc_photonic_tile_schedule,generated canonical BERT-base encoder GEMM schedule,uniform_8bit,Uniform 8-bit DPTC mapping,1.0,0.0,0.0,1.0,230.4,9216,98304
20260513_tetc_pivot,bert_base_glue_seq128,bert_base,"GLUE validation, seq_len=128",bert_base_glue_seq128:k060,60,bert.encoder.layer.10.attention.self.qkv,mha_qkv_projection,10,128,768,2304,226492416,4,24,72,6912,288,294912,1867776,864,172.8,7104.000000000002,7516.480000000002,0.8320297623245658,dptc_photonic_tile_schedule,generated canonical BERT-base encoder GEMM schedule,uniform_8bit,Uniform 8-bit DPTC mapping,1.0,0.0,0.0,1.0,172.8,6912,294912
20260513_tetc_pivot,bert_base_glue_seq128,bert_base,"GLUE validation, seq_len=128",bert_base_glue_seq128:k061,61,bert.encoder.layer.10.attention.self.qk_scores,mha_qk_scores,10,1536,64,128,12582912,48,2,4,384,192,196608,106496,48,9.600000000000001,7276.800000000002,7305.760000000002,0.8604470115519807,dptc_photonic_tile_schedule,generated canonical BERT-base encoder GEMM schedule,uniform_8bit,Uniform 8-bit DPTC mapping,1.0,0.0,0.0,1.0,9.600000000000001,384,196608
20260513_tetc_pivot,bert_base_glue_seq128,bert_base,"GLUE validation, seq_len=128",bert_base_glue_seq128:k062,62,bert.encoder.layer.10.attention.self.av_context,mha_av_context,10,1536,128,64,12582912,48,4,2,384,96,98304,204800,48,9.600000000000001,7286.400000000002,7315.360000000002,0.8604470115519807,dptc_photonic_tile_schedule,generated canonical BERT-base encoder GEMM schedule,uniform_8bit,Uniform 8-bit DPTC mapping,1.0,0.0,0.0,1.0,9.600000000000001,384,98304
20260513_tetc_pivot,bert_base_glue_seq128,bert_base,"GLUE validation, seq_len=128",bert_base_glue_seq128:k063,63,bert.encoder.layer.10.attention.output.dense,mha_output_projection,10,128,768,768,75497472,4,24,24,2304,96,98304,688128,288,57.6,7296.000000000003,7437.760000000003,0.8361276421095836,dptc_photonic_tile_schedule,generated canonical BERT-base encoder GEMM schedule,uniform_8bit,Uniform 8-bit DPTC mapping,1.0,0.0,0.0,1.0,57.6,2304,98304
20260513_tetc_pivot,bert_base_glue_seq128,bert_base,"GLUE validation, seq_len=128",bert_base_glue_seq128:k064,64,bert.encoder.layer.10.intermediate.dense,ffn_expand,10,128,768,3072,301989888,4,24,96,9216,384,393216,2457600,1152,230.4,7353.600000000003,7901.440000000002,0.8314995751911634,dptc_photonic_tile_schedule,generated canonical BERT-base encoder GEMM schedule,uniform_8bit,Uniform 8-bit DPTC mapping,1.0,0.0,0.0,1.0,230.4,9216,393216
20260513_tetc_pivot,bert_base_glue_seq128,bert_base,"GLUE validation, seq_len=128",bert_base_glue_seq128:k065,65,bert.encoder.layer.10.output.dense,ffn_project,10,128,3072,768,301989888,4,96,24,9216,96,98304,2752512,1152,230.4,7584.000000000003,8131.840000000002,0.8314995751911634,dptc_photonic_tile_schedule,generated canonical BERT-base encoder GEMM schedule,uniform_8bit,Uniform 8-bit DPTC mapping,1.0,0.0,0.0,1.0,230.4,9216,98304
20260513_tetc_pivot,bert_base_glue_seq128,bert_base,"GLUE validation, seq_len=128",bert_base_glue_seq128:k066,66,bert.encoder.layer.11.attention.self.qkv,mha_qkv_projection,11,128,768,2304,226492416,4,24,72,6912,288,294912,1867776,864,172.8,7814.400000000002,8226.880000000003,0.8638479441427476,dptc_photonic_tile_schedule,generated canonical BERT-base encoder GEMM schedule,uniform_8bit,Uniform 8-bit DPTC mapping,1.0,0.0,0.0,1.0,172.8,6912,294912
20260513_tetc_pivot,bert_base_glue_seq128,bert_base,"GLUE validation, seq_len=128",bert_base_glue_seq128:k067,67,bert.encoder.layer.11.attention.self.qk_scores,mha_qk_scores,11,1536,64,128,12582912,48,2,4,384,192,196608,106496,48,9.600000000000001,7987.200000000003,8016.160000000003,0.8922651933701624,dptc_photonic_tile_schedule,generated canonical BERT-base encoder GEMM schedule,uniform_8bit,Uniform 8-bit DPTC mapping,1.0,0.0,0.0,1.0,9.600000000000001,384,196608
20260513_tetc_pivot,bert_base_glue_seq128,bert_base,"GLUE validation, seq_len=128",bert_base_glue_seq128:k068,68,bert.encoder.layer.11.attention.self.av_context,mha_av_context,11,1536,128,64,12582912,48,4,2,384,96,98304,204800,48,9.600000000000001,7996.800000000003,8025.760000000003,0.8922651933701624,dptc_photonic_tile_schedule,generated canonical BERT-base encoder GEMM schedule,uniform_8bit,Uniform 8-bit DPTC mapping,1.0,0.0,0.0,1.0,9.600000000000001,384,98304
20260513_tetc_pivot,bert_base_glue_seq128,bert_base,"GLUE validation, seq_len=128",bert_base_glue_seq128:k069,69,bert.encoder.layer.11.attention.output.dense,mha_output_projection,11,128,768,768,75497472,4,24,24,2304,96,98304,688128,288,57.6,8006.400000000003,8148.1600000000035,0.8679458239277653,dptc_photonic_tile_schedule,generated canonical BERT-base encoder GEMM schedule,uniform_8bit,Uniform 8-bit DPTC mapping,1.0,0.0,0.0,1.0,57.6,2304,98304
20260513_tetc_pivot,bert_base_glue_seq128,bert_base,"GLUE validation, seq_len=128",bert_base_glue_seq128:k070,70,bert.encoder.layer.11.intermediate.dense,ffn_expand,11,128,768,3072,301989888,4,24,96,9216,384,393216,2457600,1152,230.4,8064.000000000004,8611.840000000004,0.8633177570093462,dptc_photonic_tile_schedule,generated canonical BERT-base encoder GEMM schedule,uniform_8bit,Uniform 8-bit DPTC mapping,1.0,0.0,0.0,1.0,230.4,9216,393216
20260513_tetc_pivot,bert_base_glue_seq128,bert_base,"GLUE validation, seq_len=128",bert_base_glue_seq128:k071,71,bert.encoder.layer.11.output.dense,ffn_project,11,128,3072,768,301989888,4,96,24,9216,96,98304,2752512,1152,230.4,8294.400000000003,8842.240000000003,0.8633177570093451,dptc_photonic_tile_schedule,generated canonical BERT-base encoder GEMM schedule,uniform_8bit,Uniform 8-bit DPTC mapping,1.0,0.0,0.0,1.0,230.4,9216,98304
20260513_tetc_pivot,bert_base_glue_seq128,bert_base,"GLUE validation, seq_len=128",bert_base_glue_seq128:k000,0,bert.encoder.layer.0.attention.self.qkv,mha_qkv_projection,0,128,768,2304,226492416,4,24,72,6912,288,294912,1867776,864,172.8,0.0,412.48,0.5138479441427464,dptc_photonic_tile_schedule,generated canonical BERT-base encoder GEMM schedule,uniform_4bit,Uniform 4-bit DPTC mapping,0.0,1.0,0.0,1.0,172.8,6912,294912
20260513_tetc_pivot,bert_base_glue_seq128,bert_base,"GLUE validation, seq_len=128",bert_base_glue_seq128:k001,1,bert.encoder.layer.0.attention.self.qk_scores,mha_qk_scores,0,1536,64,128,12582912,48,2,4,384,192,196608,106496,48,9.600000000000001,172.8,201.76000000000002,0.5422651933701657,dptc_photonic_tile_schedule,generated canonical BERT-base encoder GEMM schedule,uniform_4bit,Uniform 4-bit DPTC mapping,0.0,1.0,0.0,1.0,9.600000000000001,384,196608
20260513_tetc_pivot,bert_base_glue_seq128,bert_base,"GLUE validation, seq_len=128",bert_base_glue_seq128:k002,2,bert.encoder.layer.0.attention.self.av_context,mha_av_context,0,1536,128,64,12582912,48,4,2,384,96,98304,204800,48,9.600000000000001,182.4,211.36,0.5422651933701657,dptc_photonic_tile_schedule,generated canonical BERT-base encoder GEMM schedule,uniform_4bit,Uniform 4-bit DPTC mapping,0.0,1.0,0.0,1.0,9.600000000000001,384,98304
20260513_tetc_pivot,bert_base_glue_seq128,bert_base,"GLUE validation, seq_len=128",bert_base_glue_seq128:k003,3,bert.encoder.layer.0.attention.output.dense,mha_output_projection,0,128,768,768,75497472,4,24,24,2304,96,98304,688128,288,57.6,192.0,333.76,0.517945823927765,dptc_photonic_tile_schedule,generated canonical BERT-base encoder GEMM schedule,uniform_4bit,Uniform 4-bit DPTC mapping,0.0,1.0,0.0,1.0,57.6,2304,98304
20260513_tetc_pivot,bert_base_glue_seq128,bert_base,"GLUE validation, seq_len=128",bert_base_glue_seq128:k004,4,bert.encoder.layer.0.intermediate.dense,ffn_expand,0,128,768,3072,301989888,4,24,96,9216,384,393216,2457600,1152,230.4,249.6,797.44,0.5133177570093458,dptc_photonic_tile_schedule,generated canonical BERT-base encoder GEMM schedule,uniform_4bit,Uniform 4-bit DPTC mapping,0.0,1.0,0.0,1.0,230.4,9216,393216
20260513_tetc_pivot,bert_base_glue_seq128,bert_base,"GLUE validation, seq_len=128",bert_base_glue_seq128:k005,5,bert.encoder.layer.0.output.dense,ffn_project,0,128,3072,768,301989888,4,96,24,9216,96,98304,2752512,1152,230.4,480.0,1027.84,0.5133177570093456,dptc_photonic_tile_schedule,generated canonical BERT-base encoder GEMM schedule,uniform_4bit,Uniform 4-bit DPTC mapping,0.0,1.0,0.0,1.0,230.4,9216,98304
20260513_tetc_pivot,bert_base_glue_seq128,bert_base,"GLUE validation, seq_len=128",bert_base_glue_seq128:k006,6,bert.encoder.layer.1.attention.self.qkv,mha_qkv_projection,1,128,768,2304,226492416,4,24,72,6912,288,294912,1867776,864,172.8,710.4,1122.88,0.5456661259609283,dptc_photonic_tile_schedule,generated canonical BERT-base encoder GEMM schedule,uniform_4bit,Uniform 4-bit DPTC mapping,0.0,1.0,0.0,1.0,172.8,6912,294912
20260513_tetc_pivot,bert_base_glue_seq128,bert_base,"GLUE validation, seq_len=128",bert_base_glue_seq128:k007,7,bert.encoder.layer.1.attention.self.qk_scores,mha_qk_scores,1,1536,64,128,12582912,48,2,4,384,192,196608,106496,48,9.600000000000001,883.2,912.1600000000001,0.5740833751883494,dptc_photonic_tile_schedule,generated canonical BERT-base encoder GEMM schedule,uniform_4bit,Uniform 4-bit DPTC mapping,0.0,1.0,0.0,1.0,9.600000000000001,384,196608
20260513_tetc_pivot,bert_base_glue_seq128,bert_base,"GLUE validation, seq_len=128",bert_base_glue_seq128:k008,8,bert.encoder.layer.1.attention.self.av_context,mha_av_context,1,1536,128,64,12582912,48,4,2,384,96,98304,204800,48,9.600000000000001,892.8000000000001,921.7600000000001,0.5740833751883494,dptc_photonic_tile_schedule,generated canonical BERT-base encoder GEMM schedule,uniform_4bit,Uniform 4-bit DPTC mapping,0.0,1.0,0.0,1.0,9.600000000000001,384,98304
20260513_tetc_pivot,bert_base_glue_seq128,bert_base,"GLUE validation, seq_len=128",bert_base_glue_seq128:k009,9,bert.encoder.layer.1.attention.output.dense,mha_output_projection,1,128,768,768,75497472,4,24,24,2304,96,98304,688128,288,57.6,902.4000000000001,1044.16,0.5497640057459472,dptc_photonic_tile_schedule,generated canonical BERT-base encoder GEMM schedule,uniform_4bit,Uniform 4-bit DPTC mapping,0.0,1.0,0.0,1.0,57.6,2304,98304
20260513_tetc_pivot,bert_base_glue_seq128,bert_base,"GLUE validation, seq_len=128",bert_base_glue_seq128:k010,10,bert.encoder.layer.1.intermediate.dense,ffn_expand,1,128,768,3072,301989888,4,24,96,9216,384,393216,2457600,1152,230.4,960.0000000000001,1507.8400000000001,0.5451359388275278,dptc_photonic_tile_schedule,generated canonical BERT-base encoder GEMM schedule,uniform_4bit,Uniform 4-bit DPTC mapping,0.0,1.0,0.0,1.0,230.4,9216,393216
20260513_tetc_pivot,bert_base_glue_seq128,bert_base,"GLUE validation, seq_len=128",bert_base_glue_seq128:k011,11,bert.encoder.layer.1.output.dense,ffn_project,1,128,3072,768,301989888,4,96,24,9216,96,98304,2752512,1152,230.4,1190.4,1738.2400000000002,0.5451359388275278,dptc_photonic_tile_schedule,generated canonical BERT-base encoder GEMM schedule,uniform_4bit,Uniform 4-bit DPTC mapping,0.0,1.0,0.0,1.0,230.4,9216,98304
20260513_tetc_pivot,bert_base_glue_seq128,bert_base,"GLUE validation, seq_len=128",bert_base_glue_seq128:k012,12,bert.encoder.layer.2.attention.self.qkv,mha_qkv_projection,2,128,768,2304,226492416,4,24,72,6912,288,294912,1867776,864,172.8,1420.8000000000002,1833.2800000000002,0.5774843077791098,dptc_photonic_tile_schedule,generated canonical BERT-base encoder GEMM schedule,uniform_4bit,Uniform 4-bit DPTC mapping,0.0,1.0,0.0,1.0,172.8,6912,294912
20260513_tetc_pivot,bert_base_glue_seq128,bert_base,"GLUE validation, seq_len=128",bert_base_glue_seq128:k013,13,bert.encoder.layer.2.attention.self.qk_scores,mha_qk_scores,2,1536,64,128,12582912,48,2,4,384,192,196608,106496,48,9.600000000000001,1593.6000000000001,1622.56,0.605901557006526,dptc_photonic_tile_schedule,generated canonical BERT-base encoder GEMM schedule,uniform_4bit,Uniform 4-bit DPTC mapping,0.0,1.0,0.0,1.0,9.600000000000001,384,196608
20260513_tetc_pivot,bert_base_glue_seq128,bert_base,"GLUE validation, seq_len=128",bert_base_glue_seq128:k014,14,bert.encoder.layer.2.attention.self.av_context,mha_av_context,2,1536,128,64,12582912,48,4,2,384,96,98304,204800,48,9.600000000000001,1603.2,1632.1599999999999,0.605901557006526,dptc_photonic_tile_schedule,generated canonical BERT-base encoder GEMM schedule,uniform_4bit,Uniform 4-bit DPTC mapping,0.0,1.0,0.0,1.0,9.600000000000001,384,98304
20260513_tetc_pivot,bert_base_glue_seq128,bert_base,"GLUE validation, seq_len=128",bert_base_glue_seq128:k015,15,bert.encoder.layer.2.attention.output.dense,mha_output_projection,2,128,768,768,75497472,4,24,24,2304,96,98304,688128,288,57.6,1612.8,1754.56,0.5815821875641289,dptc_photonic_tile_schedule,generated canonical BERT-base encoder GEMM schedule,uniform_4bit,Uniform 4-bit DPTC mapping,0.0,1.0,0.0,1.0,57.6,2304,98304
20260513_tetc_pivot,bert_base_glue_seq128,bert_base,"GLUE validation, seq_len=128",bert_base_glue_seq128:k016,16,bert.encoder.layer.2.intermediate.dense,ffn_expand,2,128,768,3072,301989888,4,24,96,9216,384,393216,2457600,1152,230.4,1670.3999999999999,2218.24,0.5769541206457092,dptc_photonic_tile_schedule,generated canonical BERT-base encoder GEMM schedule,uniform_4bit,Uniform 4-bit DPTC mapping,0.0,1.0,0.0,1.0,230.4,9216,393216
20260513_tetc_pivot,bert_base_glue_seq128,bert_base,"GLUE validation, seq_len=128",bert_base_glue_seq128:k017,17,bert.encoder.layer.2.output.dense,ffn_project,2,128,3072,768,301989888,4,96,24,9216,96,98304,2752512,1152,230.4,1900.8,2448.64,0.5769541206457092,dptc_photonic_tile_schedule,generated canonical BERT-base encoder GEMM schedule,uniform_4bit,Uniform 4-bit DPTC mapping,0.0,1.0,0.0,1.0,230.4,9216,98304
20260513_tetc_pivot,bert_base_glue_seq128,bert_base,"GLUE validation, seq_len=128",bert_base_glue_seq128:k018,18,bert.encoder.layer.3.attention.self.qkv,mha_qkv_projection,3,128,768,2304,226492416,4,24,72,6912,288,294912,1867776,864,172.8,2131.2,2543.68,0.6093024895972916,dptc_photonic_tile_schedule,generated canonical BERT-base encoder GEMM schedule,uniform_4bit,Uniform 4-bit DPTC mapping,0.0,1.0,0.0,1.0,172.8,6912,294912
20260513_tetc_pivot,bert_base_glue_seq128,bert_base,"GLUE validation, seq_len=128",bert_base_glue_seq128:k019,19,bert.encoder.layer.3.attention.self.qk_scores,mha_qk_scores,3,1536,64,128,12582912,48,2,4,384,192,196608,106496,48,9.600000000000001,2304.0,2332.96,0.6377197388247079,dptc_photonic_tile_schedule,generated canonical BERT-base encoder GEMM schedule,uniform_4bit,Uniform 4-bit DPTC mapping,0.0,1.0,0.0,1.0,9.600000000000001,384,196608
20260513_tetc_pivot,bert_base_glue_seq128,bert_base,"GLUE validation, seq_len=128",bert_base_glue_seq128:k020,20,bert.encoder.layer.3.attention.self.av_context,mha_av_context,3,1536,128,64,12582912,48,4,2,384,96,98304,204800,48,9.600000000000001,2313.6,2342.56,0.6377197388247079,dptc_photonic_tile_schedule,generated canonical BERT-base encoder GEMM schedule,uniform_4bit,Uniform 4-bit DPTC mapping,0.0,1.0,0.0,1.0,9.600000000000001,384,98304
20260513_tetc_pivot,bert_base_glue_seq128,bert_base,"GLUE validation, seq_len=128",bert_base_glue_seq128:k021,21,bert.encoder.layer.3.attention.output.dense,mha_output_projection,3,128,768,768,75497472,4,24,24,2304,96,98304,688128,288,57.6,2323.2,2464.9599999999996,0.6134003693823087,dptc_photonic_tile_schedule,generated canonical BERT-base encoder GEMM schedule,uniform_4bit,Uniform 4-bit DPTC mapping,0.0,1.0,0.0,1.0,57.6,2304,98304
20260513_tetc_pivot,bert_base_glue_seq128,bert_base,"GLUE validation, seq_len=128",bert_base_glue_seq128:k022,22,bert.encoder.layer.3.intermediate.dense,ffn_expand,3,128,768,3072,301989888,4,24,96,9216,384,393216,2457600,1152,230.4,2380.7999999999997,2928.64,0.6087723024638917,dptc_photonic_tile_schedule,generated canonical BERT-base encoder GEMM schedule,uniform_4bit,Uniform 4-bit DPTC mapping,0.0,1.0,0.0,1.0,230.4,9216,393216
20260513_tetc_pivot,bert_base_glue_seq128,bert_base,"GLUE validation, seq_len=128",bert_base_glue_seq128:k023,23,bert.encoder.layer.3.output.dense,ffn_project,3,128,3072,768,301989888,4,96,24,9216,96,98304,2752512,1152,230.4,2611.2,3159.04,0.6087723024638917,dptc_photonic_tile_schedule,generated canonical BERT-base encoder GEMM schedule,uniform_4bit,Uniform 4-bit DPTC mapping,0.0,1.0,0.0,1.0,230.4,9216,98304
20260513_tetc_pivot,bert_base_glue_seq128,bert_base,"GLUE validation, seq_len=128",bert_base_glue_seq128:k024,24,bert.encoder.layer.4.attention.self.qkv,mha_qkv_projection,4,128,768,2304,226492416,4,24,72,6912,288,294912,1867776,864,172.8,2841.6,3254.08,0.6411206714154734,dptc_photonic_tile_schedule,generated canonical BERT-base encoder GEMM schedule,uniform_4bit,Uniform 4-bit DPTC mapping,0.0,1.0,0.0,1.0,172.8,6912,294912
20260513_tetc_pivot,bert_base_glue_seq128,bert_base,"GLUE validation, seq_len=128",bert_base_glue_seq128:k025,25,bert.encoder.layer.4.attention.self.qk_scores,mha_qk_scores,4,1536,64,128,12582912,48,2,4,384,192,196608,106496,48,9.600000000000001,3014.4,3043.36,0.6695379206428898,dptc_photonic_tile_schedule,generated canonical BERT-base encoder GEMM schedule,uniform_4bit,Uniform 4-bit DPTC mapping,0.0,1.0,0.0,1.0,9.600000000000001,384,196608
20260513_tetc_pivot,bert_base_glue_seq128,bert_base,"GLUE validation, seq_len=128",bert_base_glue_seq128:k026,26,bert.encoder.layer.4.attention.self.av_context,mha_av_context,4,1536,128,64,12582912,48,4,2,384,96,98304,204800,48,9.600000000000001,3024.0,3052.96,0.6695379206428898,dptc_photonic_tile_schedule,generated canonical BERT-base encoder GEMM schedule,uniform_4bit,Uniform 4-bit DPTC mapping,0.0,1.0,0.0,1.0,9.600000000000001,384,98304
20260513_tetc_pivot,bert_base_glue_seq128,bert_base,"GLUE validation, seq_len=128",bert_base_glue_seq128:k027,27,bert.encoder.layer.4.attention.output.dense,mha_output_projection,4,128,768,768,75497472,4,24,24,2304,96,98304,688128,288,57.6,3033.6,3175.3599999999997,0.6452185512004904,dptc_photonic_tile_schedule,generated canonical BERT-base encoder GEMM schedule,uniform_4bit,Uniform 4-bit DPTC mapping,0.0,1.0,0.0,1.0,57.6,2304,98304
20260513_tetc_pivot,bert_base_glue_seq128,bert_base,"GLUE validation, seq_len=128",bert_base_glue_seq128:k028,28,bert.encoder.layer.4.intermediate.dense,ffn_expand,4,128,768,3072,301989888,4,24,96,9216,384,393216,2457600,1152,230.4,3091.2,3639.04,0.6405904842820735,dptc_photonic_tile_schedule,generated canonical BERT-base encoder GEMM schedule,uniform_4bit,Uniform 4-bit DPTC mapping,0.0,1.0,0.0,1.0,230.4,9216,393216
20260513_tetc_pivot,bert_base_glue_seq128,bert_base,"GLUE validation, seq_len=128",bert_base_glue_seq128:k029,29,bert.encoder.layer.4.output.dense,ffn_project,4,128,3072,768,301989888,4,96,24,9216,96,98304,2752512,1152,230.4,3321.6,3869.44,0.6405904842820735,dptc_photonic_tile_schedule,generated canonical BERT-base encoder GEMM schedule,uniform_4bit,Uniform 4-bit DPTC mapping,0.0,1.0,0.0,1.0,230.4,9216,98304
20260513_tetc_pivot,bert_base_glue_seq128,bert_base,"GLUE validation, seq_len=128",bert_base_glue_seq128:k030,30,bert.encoder.layer.5.attention.self.qkv,mha_qkv_projection,5,128,768,2304,226492416,4,24,72,6912,288,294912,1867776,864,172.8,3552.0,3964.48,0.6729388532336552,dptc_photonic_tile_schedule,generated canonical BERT-base encoder GEMM schedule,uniform_4bit,Uniform 4-bit DPTC mapping,0.0,1.0,0.0,1.0,172.8,6912,294912
20260513_tetc_pivot,bert_base_glue_seq128,bert_base,"GLUE validation, seq_len=128",bert_base_glue_seq128:k031,31,bert.encoder.layer.5.attention.self.qk_scores,mha_qk_scores,5,1536,64,128,12582912,48,2,4,384,192,196608,106496,48,9.600000000000001,3724.8,3753.76,0.7013561024610715,dptc_photonic_tile_schedule,generated canonical BERT-base encoder GEMM schedule,uniform_4bit,Uniform 4-bit DPTC mapping,0.0,1.0,0.0,1.0,9.600000000000001,384,196608
20260513_tetc_pivot,bert_base_glue_seq128,bert_base,"GLUE validation, seq_len=128",bert_base_glue_seq128:k032,32,bert.encoder.layer.5.attention.self.av_context,mha_av_context,5,1536,128,64,12582912,48,4,2,384,96,98304,204800,48,9.600000000000001,3734.4,3763.36,0.7013561024610715,dptc_photonic_tile_schedule,generated canonical BERT-base encoder GEMM schedule,uniform_4bit,Uniform 4-bit DPTC mapping,0.0,1.0,0.0,1.0,9.600000000000001,384,98304
20260513_tetc_pivot,bert_base_glue_seq128,bert_base,"GLUE validation, seq_len=128",bert_base_glue_seq128:k033,33,bert.encoder.layer.5.attention.output.dense,mha_output_projection,5,128,768,768,75497472,4,24,24,2304,96,98304,688128,288,57.6,3744.0,3885.7599999999998,0.6770367330186723,dptc_photonic_tile_schedule,generated canonical BERT-base encoder GEMM schedule,uniform_4bit,Uniform 4-bit DPTC mapping,0.0,1.0,0.0,1.0,57.6,2304,98304
20260513_tetc_pivot,bert_base_glue_seq128,bert_base,"GLUE validation, seq_len=128",bert_base_glue_seq128:k034,34,bert.encoder.layer.5.intermediate.dense,ffn_expand,5,128,768,3072,301989888,4,24,96,9216,384,393216,2457600,1152,230.4,3801.6,4349.44,0.6724086661002546,dptc_photonic_tile_schedule,generated canonical BERT-base encoder GEMM schedule,uniform_4bit,Uniform 4-bit DPTC mapping,0.0,1.0,0.0,1.0,230.4,9216,393216
20260513_tetc_pivot,bert_base_glue_seq128,bert_base,"GLUE validation, seq_len=128",bert_base_glue_seq128:k035,35,bert.encoder.layer.5.output.dense,ffn_project,5,128,3072,768,301989888,4,96,24,9216,96,98304,2752512,1152,230.4,4032.0,4579.839999999999,0.6724086661002542,dptc_photonic_tile_schedule,generated canonical BERT-base encoder GEMM schedule,uniform_4bit,Uniform 4-bit DPTC mapping,0.0,1.0,0.0,1.0,230.4,9216,98304
20260513_tetc_pivot,bert_base_glue_seq128,bert_base,"GLUE validation, seq_len=128",bert_base_glue_seq128:k036,36,bert.encoder.layer.6.attention.self.qkv,mha_qkv_projection,6,128,768,2304,226492416,4,24,72,6912,288,294912,1867776,864,172.8,4262.4,4674.88,0.7047570350518385,dptc_photonic_tile_schedule,generated canonical BERT-base encoder GEMM schedule,uniform_4bit,Uniform 4-bit DPTC mapping,0.0,1.0,0.0,1.0,172.8,6912,294912
20260513_tetc_pivot,bert_base_glue_seq128,bert_base,"GLUE validation, seq_len=128",bert_base_glue_seq128:k037,37,bert.encoder.layer.6.attention.self.qk_scores,mha_qk_scores,6,1536,64,128,12582912,48,2,4,384,192,196608,106496,48,9.600000000000001,4435.2,4464.16,0.7331742842792534,dptc_photonic_tile_schedule,generated canonical BERT-base encoder GEMM schedule,uniform_4bit,Uniform 4-bit DPTC mapping,0.0,1.0,0.0,1.0,9.600000000000001,384,196608
20260513_tetc_pivot,bert_base_glue_seq128,bert_base,"GLUE validation, seq_len=128",bert_base_glue_seq128:k038,38,bert.encoder.layer.6.attention.self.av_context,mha_av_context,6,1536,128,64,12582912,48,4,2,384,96,98304,204800,48,9.600000000000001,4444.8,4473.76,0.7331742842792534,dptc_photonic_tile_schedule,generated canonical BERT-base encoder GEMM schedule,uniform_4bit,Uniform 4-bit DPTC mapping,0.0,1.0,0.0,1.0,9.600000000000001,384,98304
20260513_tetc_pivot,bert_base_glue_seq128,bert_base,"GLUE validation, seq_len=128",bert_base_glue_seq128:k039,39,bert.encoder.layer.6.attention.output.dense,mha_output_projection,6,128,768,768,75497472,4,24,24,2304,96,98304,688128,288,57.6,4454.400000000001,4596.160000000001,0.7088549148368563,dptc_photonic_tile_schedule,generated canonical BERT-base encoder GEMM schedule,uniform_4bit,Uniform 4-bit DPTC mapping,0.0,1.0,0.0,1.0,57.6,2304,98304
20260513_tetc_pivot,bert_base_glue_seq128,bert_base,"GLUE validation, seq_len=128",bert_base_glue_seq128:k040,40,bert.encoder.layer.6.intermediate.dense,ffn_expand,6,128,768,3072,301989888,4,24,96,9216,384,393216,2457600,1152,230.4,4512.000000000001,5059.84,0.704226847918436,dptc_photonic_tile_schedule,generated canonical BERT-base encoder GEMM schedule,uniform_4bit,Uniform 4-bit DPTC mapping,0.0,1.0,0.0,1.0,230.4,9216,393216
20260513_tetc_pivot,bert_base_glue_seq128,bert_base,"GLUE validation, seq_len=128",bert_base_glue_seq128:k041,41,bert.encoder.layer.6.output.dense,ffn_project,6,128,3072,768,301989888,4,96,24,9216,96,98304,2752512,1152,230.4,4742.400000000001,5290.24,0.704226847918436,dptc_photonic_tile_schedule,generated canonical BERT-base encoder GEMM schedule,uniform_4bit,Uniform 4-bit DPTC mapping,0.0,1.0,0.0,1.0,230.4,9216,98304
20260513_tetc_pivot,bert_base_glue_seq128,bert_base,"GLUE validation, seq_len=128",bert_base_glue_seq128:k042,42,bert.encoder.layer.7.attention.self.qkv,mha_qkv_projection,7,128,768,2304,226492416,4,24,72,6912,288,294912,1867776,864,172.8,4972.8,5385.280000000001,0.7365752168700204,dptc_photonic_tile_schedule,generated canonical BERT-base encoder GEMM schedule,uniform_4bit,Uniform 4-bit DPTC mapping,0.0,1.0,0.0,1.0,172.8,6912,294912
20260513_tetc_pivot,bert_base_glue_seq128,bert_base,"GLUE validation, seq_len=128",bert_base_glue_seq128:k043,43,bert.encoder.layer.7.attention.self.qk_scores,mha_qk_scores,7,1536,64,128,12582912,48,2,4,384,192,196608,106496,48,9.600000000000001,5145.6,5174.56,0.7649924660974352,dptc_photonic_tile_schedule,generated canonical BERT-base encoder GEMM schedule,uniform_4bit,Uniform 4-bit DPTC mapping,0.0,1.0,0.0,1.0,9.600000000000001,384,196608
20260513_tetc_pivot,bert_base_glue_seq128,bert_base,"GLUE validation, seq_len=128",bert_base_glue_seq128:k044,44,bert.encoder.layer.7.attention.self.av_context,mha_av_context,7,1536,128,64,12582912,48,4,2,384,96,98304,204800,48,9.600000000000001,5155.200000000001,5184.160000000001,0.7649924660974352,dptc_photonic_tile_schedule,generated canonical BERT-base encoder GEMM schedule,uniform_4bit,Uniform 4-bit DPTC mapping,0.0,1.0,0.0,1.0,9.600000000000001,384,98304
20260513_tetc_pivot,bert_base_glue_seq128,bert_base,"GLUE validation, seq_len=128",bert_base_glue_seq128:k045,45,bert.encoder.layer.7.attention.output.dense,mha_output_projection,7,128,768,768,75497472,4,24,24,2304,96,98304,688128,288,57.6,5164.800000000001,5306.560000000001,0.7406730966550381,dptc_photonic_tile_schedule,generated canonical BERT-base encoder GEMM schedule,uniform_4bit,Uniform 4-bit DPTC mapping,0.0,1.0,0.0,1.0,57.6,2304,98304
20260513_tetc_pivot,bert_base_glue_seq128,bert_base,"GLUE validation, seq_len=128",bert_base_glue_seq128:k046,46,bert.encoder.layer.7.intermediate.dense,ffn_expand,7,128,768,3072,301989888,4,24,96,9216,384,393216,2457600,1152,230.4,5222.4000000000015,5770.240000000001,0.7360450297366179,dptc_photonic_tile_schedule,generated canonical BERT-base encoder GEMM schedule,uniform_4bit,Uniform 4-bit DPTC mapping,0.0,1.0,0.0,1.0,230.4,9216,393216
20260513_tetc_pivot,bert_base_glue_seq128,bert_base,"GLUE validation, seq_len=128",bert_base_glue_seq128:k047,47,bert.encoder.layer.7.output.dense,ffn_project,7,128,3072,768,301989888,4,96,24,9216,96,98304,2752512,1152,230.4,5452.800000000001,6000.64,0.7360450297366179,dptc_photonic_tile_schedule,generated canonical BERT-base encoder GEMM schedule,uniform_4bit,Uniform 4-bit DPTC mapping,0.0,1.0,0.0,1.0,230.4,9216,98304
20260513_tetc_pivot,bert_base_glue_seq128,bert_base,"GLUE validation, seq_len=128",bert_base_glue_seq128:k048,48,bert.encoder.layer.8.attention.self.qkv,mha_qkv_projection,8,128,768,2304,226492416,4,24,72,6912,288,294912,1867776,864,172.8,5683.200000000001,6095.680000000001,0.7683933986882021,dptc_photonic_tile_schedule,generated canonical BERT-base encoder GEMM schedule,uniform_4bit,Uniform 4-bit DPTC mapping,0.0,1.0,0.0,1.0,172.8,6912,294912
20260513_tetc_pivot,bert_base_glue_seq128,bert_base,"GLUE validation, seq_len=128",bert_base_glue_seq128:k049,49,bert.encoder.layer.8.attention.self.qk_scores,mha_qk_scores,8,1536,64,128,12582912,48,2,4,384,192,196608,106496,48,9.600000000000001,5856.000000000001,5884.960000000001,0.796810647915617,dptc_photonic_tile_schedule,generated canonical BERT-base encoder GEMM schedule,uniform_4bit,Uniform 4-bit DPTC mapping,0.0,1.0,0.0,1.0,9.600000000000001,384,196608
20260513_tetc_pivot,bert_base_glue_seq128,bert_base,"GLUE validation, seq_len=128",bert_base_glue_seq128:k050,50,bert.encoder.layer.8.attention.self.av_context,mha_av_context,8,1536,128,64,12582912,48,4,2,384,96,98304,204800,48,9.600000000000001,5865.600000000001,5894.560000000001,0.796810647915617,dptc_photonic_tile_schedule,generated canonical BERT-base encoder GEMM schedule,uniform_4bit,Uniform 4-bit DPTC mapping,0.0,1.0,0.0,1.0,9.600000000000001,384,98304
20260513_tetc_pivot,bert_base_glue_seq128,bert_base,"GLUE validation, seq_len=128",bert_base_glue_seq128:k051,51,bert.encoder.layer.8.attention.output.dense,mha_output_projection,8,128,768,768,75497472,4,24,24,2304,96,98304,688128,288,57.6,5875.200000000002,6016.960000000002,0.7724912784732199,dptc_photonic_tile_schedule,generated canonical BERT-base encoder GEMM schedule,uniform_4bit,Uniform 4-bit DPTC mapping,0.0,1.0,0.0,1.0,57.6,2304,98304
20260513_tetc_pivot,bert_base_glue_seq128,bert_base,"GLUE validation, seq_len=128",bert_base_glue_seq128:k052,52,bert.encoder.layer.8.intermediate.dense,ffn_expand,8,128,768,3072,301989888,4,24,96,9216,384,393216,2457600,1152,230.4,5932.800000000002,6480.640000000001,0.7678632115547996,dptc_photonic_tile_schedule,generated canonical BERT-base encoder GEMM schedule,uniform_4bit,Uniform 4-bit DPTC mapping,0.0,1.0,0.0,1.0,230.4,9216,393216
20260513_tetc_pivot,bert_base_glue_seq128,bert_base,"GLUE validation, seq_len=128",bert_base_glue_seq128:k053,53,bert.encoder.layer.8.output.dense,ffn_project,8,128,3072,768,301989888,4,96,24,9216,96,98304,2752512,1152,230.4,6163.200000000002,6711.040000000001,0.7678632115547996,dptc_photonic_tile_schedule,generated canonical BERT-base encoder GEMM schedule,uniform_4bit,Uniform 4-bit DPTC mapping,0.0,1.0,0.0,1.0,230.4,9216,98304
20260513_tetc_pivot,bert_base_glue_seq128,bert_base,"GLUE validation, seq_len=128",bert_base_glue_seq128:k054,54,bert.encoder.layer.9.attention.self.qkv,mha_qkv_projection,9,128,768,2304,226492416,4,24,72,6912,288,294912,1867776,864,172.8,6393.600000000001,6806.080000000002,0.800211580506384,dptc_photonic_tile_schedule,generated canonical BERT-base encoder GEMM schedule,uniform_4bit,Uniform 4-bit DPTC mapping,0.0,1.0,0.0,1.0,172.8,6912,294912
20260513_tetc_pivot,bert_base_glue_seq128,bert_base,"GLUE validation, seq_len=128",bert_base_glue_seq128:k055,55,bert.encoder.layer.9.attention.self.qk_scores,mha_qk_scores,9,1536,64,128,12582912,48,2,4,384,192,196608,106496,48,9.600000000000001,6566.4000000000015,6595.3600000000015,0.8286288297337988,dptc_photonic_tile_schedule,generated canonical BERT-base encoder GEMM schedule,uniform_4bit,Uniform 4-bit DPTC mapping,0.0,1.0,0.0,1.0,9.600000000000001,384,196608
20260513_tetc_pivot,bert_base_glue_seq128,bert_base,"GLUE validation, seq_len=128",bert_base_glue_seq128:k056,56,bert.encoder.layer.9.attention.self.av_context,mha_av_context,9,1536,128,64,12582912,48,4,2,384,96,98304,204800,48,9.600000000000001,6576.000000000002,6604.960000000002,0.8286288297337988,dptc_photonic_tile_schedule,generated canonical BERT-base encoder GEMM schedule,uniform_4bit,Uniform 4-bit DPTC mapping,0.0,1.0,0.0,1.0,9.600000000000001,384,98304
20260513_tetc_pivot,bert_base_glue_seq128,bert_base,"GLUE validation, seq_len=128",bert_base_glue_seq128:k057,57,bert.encoder.layer.9.attention.output.dense,mha_output_projection,9,128,768,768,75497472,4,24,24,2304,96,98304,688128,288,57.6,6585.600000000002,6727.360000000002,0.8043094602914017,dptc_photonic_tile_schedule,generated canonical BERT-base encoder GEMM schedule,uniform_4bit,Uniform 4-bit DPTC mapping,0.0,1.0,0.0,1.0,57.6,2304,98304
20260513_tetc_pivot,bert_base_glue_seq128,bert_base,"GLUE validation, seq_len=128",bert_base_glue_seq128:k058,58,bert.encoder.layer.9.intermediate.dense,ffn_expand,9,128,768,3072,301989888,4,24,96,9216,384,393216,2457600,1152,230.4,6643.200000000003,7191.040000000002,0.7996813933729815,dptc_photonic_tile_schedule,generated canonical BERT-base encoder GEMM schedule,uniform_4bit,Uniform 4-bit DPTC mapping,0.0,1.0,0.0,1.0,230.4,9216,393216
20260513_tetc_pivot,bert_base_glue_seq128,bert_base,"GLUE validation, seq_len=128",bert_base_glue_seq128:k059,59,bert.encoder.layer.9.output.dense,ffn_project,9,128,3072,768,301989888,4,96,24,9216,96,98304,2752512,1152,230.4,6873.600000000002,7421.440000000001,0.7996813933729815,dptc_photonic_tile_schedule,generated canonical BERT-base encoder GEMM schedule,uniform_4bit,Uniform 4-bit DPTC mapping,0.0,1.0,0.0,1.0,230.4,9216,98304
20260513_tetc_pivot,bert_base_glue_seq128,bert_base,"GLUE validation, seq_len=128",bert_base_glue_seq128:k060,60,bert.encoder.layer.10.attention.self.qkv,mha_qkv_projection,10,128,768,2304,226492416,4,24,72,6912,288,294912,1867776,864,172.8,7104.000000000002,7516.480000000002,0.8320297623245658,dptc_photonic_tile_schedule,generated canonical BERT-base encoder GEMM schedule,uniform_4bit,Uniform 4-bit DPTC mapping,0.0,1.0,0.0,1.0,172.8,6912,294912
20260513_tetc_pivot,bert_base_glue_seq128,bert_base,"GLUE validation, seq_len=128",bert_base_glue_seq128:k061,61,bert.encoder.layer.10.attention.self.qk_scores,mha_qk_scores,10,1536,64,128,12582912,48,2,4,384,192,196608,106496,48,9.600000000000001,7276.800000000002,7305.760000000002,0.8604470115519807,dptc_photonic_tile_schedule,generated canonical BERT-base encoder GEMM schedule,uniform_4bit,Uniform 4-bit DPTC mapping,0.0,1.0,0.0,1.0,9.600000000000001,384,196608
20260513_tetc_pivot,bert_base_glue_seq128,bert_base,"GLUE validation, seq_len=128",bert_base_glue_seq128:k062,62,bert.encoder.layer.10.attention.self.av_context,mha_av_context,10,1536,128,64,12582912,48,4,2,384,96,98304,204800,48,9.600000000000001,7286.400000000002,7315.360000000002,0.8604470115519807,dptc_photonic_tile_schedule,generated canonical BERT-base encoder GEMM schedule,uniform_4bit,Uniform 4-bit DPTC mapping,0.0,1.0,0.0,1.0,9.600000000000001,384,98304
20260513_tetc_pivot,bert_base_glue_seq128,bert_base,"GLUE validation, seq_len=128",bert_base_glue_seq128:k063,63,bert.encoder.layer.10.attention.output.dense,mha_output_projection,10,128,768,768,75497472,4,24,24,2304,96,98304,688128,288,57.6,7296.000000000003,7437.760000000003,0.8361276421095836,dptc_photonic_tile_schedule,generated canonical BERT-base encoder GEMM schedule,uniform_4bit,Uniform 4-bit DPTC mapping,0.0,1.0,0.0,1.0,57.6,2304,98304
20260513_tetc_pivot,bert_base_glue_seq128,bert_base,"GLUE validation, seq_len=128",bert_base_glue_seq128:k064,64,bert.encoder.layer.10.intermediate.dense,ffn_expand,10,128,768,3072,301989888,4,24,96,9216,384,393216,2457600,1152,230.4,7353.600000000003,7901.440000000002,0.8314995751911634,dptc_photonic_tile_schedule,generated canonical BERT-base encoder GEMM schedule,uniform_4bit,Uniform 4-bit DPTC mapping,0.0,1.0,0.0,1.0,230.4,9216,393216
20260513_tetc_pivot,bert_base_glue_seq128,bert_base,"GLUE validation, seq_len=128",bert_base_glue_seq128:k065,65,bert.encoder.layer.10.output.dense,ffn_project,10,128,3072,768,301989888,4,96,24,9216,96,98304,2752512,1152,230.4,7584.000000000003,8131.840000000002,0.8314995751911634,dptc_photonic_tile_schedule,generated canonical BERT-base encoder GEMM schedule,uniform_4bit,Uniform 4-bit DPTC mapping,0.0,1.0,0.0,1.0,230.4,9216,98304
20260513_tetc_pivot,bert_base_glue_seq128,bert_base,"GLUE validation, seq_len=128",bert_base_glue_seq128:k066,66,bert.encoder.layer.11.attention.self.qkv,mha_qkv_projection,11,128,768,2304,226492416,4,24,72,6912,288,294912,1867776,864,172.8,7814.400000000002,8226.880000000003,0.8638479441427476,dptc_photonic_tile_schedule,generated canonical BERT-base encoder GEMM schedule,uniform_4bit,Uniform 4-bit DPTC mapping,0.0,1.0,0.0,1.0,172.8,6912,294912
20260513_tetc_pivot,bert_base_glue_seq128,bert_base,"GLUE validation, seq_len=128",bert_base_glue_seq128:k067,67,bert.encoder.layer.11.attention.self.qk_scores,mha_qk_scores,11,1536,64,128,12582912,48,2,4,384,192,196608,106496,48,9.600000000000001,7987.200000000003,8016.160000000003,0.8922651933701624,dptc_photonic_tile_schedule,generated canonical BERT-base encoder GEMM schedule,uniform_4bit,Uniform 4-bit DPTC mapping,0.0,1.0,0.0,1.0,9.600000000000001,384,196608
20260513_tetc_pivot,bert_base_glue_seq128,bert_base,"GLUE validation, seq_len=128",bert_base_glue_seq128:k068,68,bert.encoder.layer.11.attention.self.av_context,mha_av_context,11,1536,128,64,12582912,48,4,2,384,96,98304,204800,48,9.600000000000001,7996.800000000003,8025.760000000003,0.8922651933701624,dptc_photonic_tile_schedule,generated canonical BERT-base encoder GEMM schedule,uniform_4bit,Uniform 4-bit DPTC mapping,0.0,1.0,0.0,1.0,9.600000000000001,384,98304
20260513_tetc_pivot,bert_base_glue_seq128,bert_base,"GLUE validation, seq_len=128",bert_base_glue_seq128:k069,69,bert.encoder.layer.11.attention.output.dense,mha_output_projection,11,128,768,768,75497472,4,24,24,2304,96,98304,688128,288,57.6,8006.400000000003,8148.1600000000035,0.8679458239277653,dptc_photonic_tile_schedule,generated canonical BERT-base encoder GEMM schedule,uniform_4bit,Uniform 4-bit DPTC mapping,0.0,1.0,0.0,1.0,57.6,2304,98304
20260513_tetc_pivot,bert_base_glue_seq128,bert_base,"GLUE validation, seq_len=128",bert_base_glue_seq128:k070,70,bert.encoder.layer.11.intermediate.dense,ffn_expand,11,128,768,3072,301989888,4,24,96,9216,384,393216,2457600,1152,230.4,8064.000000000004,8611.840000000004,0.8633177570093462,dptc_photonic_tile_schedule,generated canonical BERT-base encoder GEMM schedule,uniform_4bit,Uniform 4-bit DPTC mapping,0.0,1.0,0.0,1.0,230.4,9216,393216
20260513_tetc_pivot,bert_base_glue_seq128,bert_base,"GLUE validation, seq_len=128",bert_base_glue_seq128:k071,71,bert.encoder.layer.11.output.dense,ffn_project,11,128,3072,768,301989888,4,96,24,9216,96,98304,2752512,1152,230.4,8294.400000000003,8842.240000000003,0.8633177570093451,dptc_photonic_tile_schedule,generated canonical BERT-base encoder GEMM schedule,uniform_4bit,Uniform 4-bit DPTC mapping,0.0,1.0,0.0,1.0,230.4,9216,98304
20260513_tetc_pivot,bert_base_glue_seq128,bert_base,"GLUE validation, seq_len=128",bert_base_glue_seq128:k000,0,bert.encoder.layer.0.attention.self.qkv,mha_qkv_projection,0,128,768,2304,226492416,4,24,72,6912,288,294912,1867776,864,172.8,0.0,412.48,0.5138479441427464,dptc_photonic_tile_schedule,generated canonical BERT-base encoder GEMM schedule,random,Random same-sparsity selector,0.7002314814814816,0.0,0.29976851851851843,0.7002314814814816,162.44000000000003,4840,206507
20260513_tetc_pivot,bert_base_glue_seq128,bert_base,"GLUE validation, seq_len=128",bert_base_glue_seq128:k001,1,bert.encoder.layer.0.attention.self.qk_scores,mha_qk_scores,0,1536,64,128,12582912,48,2,4,384,192,196608,106496,48,9.600000000000001,172.8,201.76000000000002,0.5422651933701657,dptc_photonic_tile_schedule,generated canonical BERT-base encoder GEMM schedule,random,Random same-sparsity selector,0.7002314814814816,0.0,0.29976851851851843,0.7002314814814816,9.024444444444446,269,137671
20260513_tetc_pivot,bert_base_glue_seq128,bert_base,"GLUE validation, seq_len=128",bert_base_glue_seq128:k002,2,bert.encoder.layer.0.attention.self.av_context,mha_av_context,0,1536,128,64,12582912,48,4,2,384,96,98304,204800,48,9.600000000000001,182.4,211.36,0.5422651933701657,dptc_photonic_tile_schedule,generated canonical BERT-base encoder GEMM schedule,random,Random same-sparsity selector,0.7002314814814816,0.0,0.29976851851851843,0.7002314814814816,9.024444444444446,269,68836
20260513_tetc_pivot,bert_base_glue_seq128,bert_base,"GLUE validation, seq_len=128",bert_base_glue_seq128:k003,3,bert.encoder.layer.0.attention.output.dense,mha_output_projection,0,128,768,768,75497472,4,24,24,2304,96,98304,688128,288,57.6,192.0,333.76,0.517945823927765,dptc_photonic_tile_schedule,generated canonical BERT-base encoder GEMM schedule,random,Random same-sparsity selector,0.7002314814814816,0.0,0.29976851851851843,0.7002314814814816,54.14666666666667,1613,68836
20260513_tetc_pivot,bert_base_glue_seq128,bert_base,"GLUE validation, seq_len=128",bert_base_glue_seq128:k004,4,bert.encoder.layer.0.intermediate.dense,ffn_expand,0,128,768,3072,301989888,4,24,96,9216,384,393216,2457600,1152,230.4,249.6,797.44,0.5133177570093458,dptc_photonic_tile_schedule,generated canonical BERT-base encoder GEMM schedule,random,Random same-sparsity selector,0.7002314814814816,0.0,0.29976851851851843,0.7002314814814816,216.58666666666667,6453,275342
20260513_tetc_pivot,bert_base_glue_seq128,bert_base,"GLUE validation, seq_len=128",bert_base_glue_seq128:k005,5,bert.encoder.layer.0.output.dense,ffn_project,0,128,3072,768,301989888,4,96,24,9216,96,98304,2752512,1152,230.4,480.0,1027.84,0.5133177570093456,dptc_photonic_tile_schedule,generated canonical BERT-base encoder GEMM schedule,random,Random same-sparsity selector,0.7002314814814816,0.0,0.29976851851851843,0.7002314814814816,216.58666666666667,6453,68836
20260513_tetc_pivot,bert_base_glue_seq128,bert_base,"GLUE validation, seq_len=128",bert_base_glue_seq128:k006,6,bert.encoder.layer.1.attention.self.qkv,mha_qkv_projection,1,128,768,2304,226492416,4,24,72,6912,288,294912,1867776,864,172.8,710.4,1122.88,0.5456661259609283,dptc_photonic_tile_schedule,generated canonical BERT-base encoder GEMM schedule,random,Random same-sparsity selector,0.7002314814814816,0.0,0.29976851851851843,0.7002314814814816,162.44000000000003,4840,206507
20260513_tetc_pivot,bert_base_glue_seq128,bert_base,"GLUE validation, seq_len=128",bert_base_glue_seq128:k007,7,bert.encoder.layer.1.attention.self.qk_scores,mha_qk_scores,1,1536,64,128,12582912,48,2,4,384,192,196608,106496,48,9.600000000000001,883.2,912.1600000000001,0.5740833751883494,dptc_photonic_tile_schedule,generated canonical BERT-base encoder GEMM schedule,random,Random same-sparsity selector,0.7002314814814816,0.0,0.29976851851851843,0.7002314814814816,9.024444444444446,269,137671
20260513_tetc_pivot,bert_base_glue_seq128,bert_base,"GLUE validation, seq_len=128",bert_base_glue_seq128:k008,8,bert.encoder.layer.1.attention.self.av_context,mha_av_context,1,1536,128,64,12582912,48,4,2,384,96,98304,204800,48,9.600000000000001,892.8000000000001,921.7600000000001,0.5740833751883494,dptc_photonic_tile_schedule,generated canonical BERT-base encoder GEMM schedule,random,Random same-sparsity selector,0.7002314814814816,0.0,0.29976851851851843,0.7002314814814816,9.024444444444446,269,68836
20260513_tetc_pivot,bert_base_glue_seq128,bert_base,"GLUE validation, seq_len=128",bert_base_glue_seq128:k009,9,bert.encoder.layer.1.attention.output.dense,mha_output_projection,1,128,768,768,75497472,4,24,24,2304,96,98304,688128,288,57.6,902.4000000000001,1044.16,0.5497640057459472,dptc_photonic_tile_schedule,generated canonical BERT-base encoder GEMM schedule,random,Random same-sparsity selector,0.7002314814814816,0.0,0.29976851851851843,0.7002314814814816,54.14666666666667,1613,68836
20260513_tetc_pivot,bert_base_glue_seq128,bert_base,"GLUE validation, seq_len=128",bert_base_glue_seq128:k010,10,bert.encoder.layer.1.intermediate.dense,ffn_expand,1,128,768,3072,301989888,4,24,96,9216,384,393216,2457600,1152,230.4,960.0000000000001,1507.8400000000001,0.5451359388275278,dptc_photonic_tile_schedule,generated canonical BERT-base encoder GEMM schedule,random,Random same-sparsity selector,0.7002314814814816,0.0,0.29976851851851843,0.7002314814814816,216.58666666666667,6453,275342
20260513_tetc_pivot,bert_base_glue_seq128,bert_base,"GLUE validation, seq_len=128",bert_base_glue_seq128:k011,11,bert.encoder.layer.1.output.dense,ffn_project,1,128,3072,768,301989888,4,96,24,9216,96,98304,2752512,1152,230.4,1190.4,1738.2400000000002,0.5451359388275278,dptc_photonic_tile_schedule,generated canonical BERT-base encoder GEMM schedule,random,Random same-sparsity selector,0.7002314814814816,0.0,0.29976851851851843,0.7002314814814816,216.58666666666667,6453,68836
20260513_tetc_pivot,bert_base_glue_seq128,bert_base,"GLUE validation, seq_len=128",bert_base_glue_seq128:k012,12,bert.encoder.layer.2.attention.self.qkv,mha_qkv_projection,2,128,768,2304,226492416,4,24,72,6912,288,294912,1867776,864,172.8,1420.8000000000002,1833.2800000000002,0.5774843077791098,dptc_photonic_tile_schedule,generated canonical BERT-base encoder GEMM schedule,random,Random same-sparsity selector,0.7002314814814816,0.0,0.29976851851851843,0.7002314814814816,162.44000000000003,4840,206507
20260513_tetc_pivot,bert_base_glue_seq128,bert_base,"GLUE validation, seq_len=128",bert_base_glue_seq128:k013,13,bert.encoder.layer.2.attention.self.qk_scores,mha_qk_scores,2,1536,64,128,12582912,48,2,4,384,192,196608,106496,48,9.600000000000001,1593.6000000000001,1622.56,0.605901557006526,dptc_photonic_tile_schedule,generated canonical BERT-base encoder GEMM schedule,random,Random same-sparsity selector,0.7002314814814816,0.0,0.29976851851851843,0.7002314814814816,9.024444444444446,269,137671
20260513_tetc_pivot,bert_base_glue_seq128,bert_base,"GLUE validation, seq_len=128",bert_base_glue_seq128:k014,14,bert.encoder.layer.2.attention.self.av_context,mha_av_context,2,1536,128,64,12582912,48,4,2,384,96,98304,204800,48,9.600000000000001,1603.2,1632.1599999999999,0.605901557006526,dptc_photonic_tile_schedule,generated canonical BERT-base encoder GEMM schedule,random,Random same-sparsity selector,0.7002314814814816,0.0,0.29976851851851843,0.7002314814814816,9.024444444444446,269,68836
20260513_tetc_pivot,bert_base_glue_seq128,bert_base,"GLUE validation, seq_len=128",bert_base_glue_seq128:k015,15,bert.encoder.layer.2.attention.output.dense,mha_output_projection,2,128,768,768,75497472,4,24,24,2304,96,98304,688128,288,57.6,1612.8,1754.56,0.5815821875641289,dptc_photonic_tile_schedule,generated canonical BERT-base encoder GEMM schedule,random,Random same-sparsity selector,0.7002314814814816,0.0,0.29976851851851843,0.7002314814814816,54.14666666666667,1613,68836
20260513_tetc_pivot,bert_base_glue_seq128,bert_base,"GLUE validation, seq_len=128",bert_base_glue_seq128:k016,16,bert.encoder.layer.2.intermediate.dense,ffn_expand,2,128,768,3072,301989888,4,24,96,9216,384,393216,2457600,1152,230.4,1670.3999999999999,2218.24,0.5769541206457092,dptc_photonic_tile_schedule,generated canonical BERT-base encoder GEMM schedule,random,Random same-sparsity selector,0.7002314814814816,0.0,0.29976851851851843,0.7002314814814816,216.58666666666667,6453,275342
20260513_tetc_pivot,bert_base_glue_seq128,bert_base,"GLUE validation, seq_len=128",bert_base_glue_seq128:k017,17,bert.encoder.layer.2.output.dense,ffn_project,2,128,3072,768,301989888,4,96,24,9216,96,98304,2752512,1152,230.4,1900.8,2448.64,0.5769541206457092,dptc_photonic_tile_schedule,generated canonical BERT-base encoder GEMM schedule,random,Random same-sparsity selector,0.7002314814814816,0.0,0.29976851851851843,0.7002314814814816,216.58666666666667,6453,68836
20260513_tetc_pivot,bert_base_glue_seq128,bert_base,"GLUE validation, seq_len=128",bert_base_glue_seq128:k018,18,bert.encoder.layer.3.attention.self.qkv,mha_qkv_projection,3,128,768,2304,226492416,4,24,72,6912,288,294912,1867776,864,172.8,2131.2,2543.68,0.6093024895972916,dptc_photonic_tile_schedule,generated canonical BERT-base encoder GEMM schedule,random,Random same-sparsity selector,0.7002314814814816,0.0,0.29976851851851843,0.7002314814814816,162.44000000000003,4840,206507
20260513_tetc_pivot,bert_base_glue_seq128,bert_base,"GLUE validation, seq_len=128",bert_base_glue_seq128:k019,19,bert.encoder.layer.3.attention.self.qk_scores,mha_qk_scores,3,1536,64,128,12582912,48,2,4,384,192,196608,106496,48,9.600000000000001,2304.0,2332.96,0.6377197388247079,dptc_photonic_tile_schedule,generated canonical BERT-base encoder GEMM schedule,random,Random same-sparsity selector,0.7002314814814816,0.0,0.29976851851851843,0.7002314814814816,9.024444444444446,269,137671
20260513_tetc_pivot,bert_base_glue_seq128,bert_base,"GLUE validation, seq_len=128",bert_base_glue_seq128:k020,20,bert.encoder.layer.3.attention.self.av_context,mha_av_context,3,1536,128,64,12582912,48,4,2,384,96,98304,204800,48,9.600000000000001,2313.6,2342.56,0.6377197388247079,dptc_photonic_tile_schedule,generated canonical BERT-base encoder GEMM schedule,random,Random same-sparsity selector,0.7002314814814816,0.0,0.29976851851851843,0.7002314814814816,9.024444444444446,269,68836
20260513_tetc_pivot,bert_base_glue_seq128,bert_base,"GLUE validation, seq_len=128",bert_base_glue_seq128:k021,21,bert.encoder.layer.3.attention.output.dense,mha_output_projection,3,128,768,768,75497472,4,24,24,2304,96,98304,688128,288,57.6,2323.2,2464.9599999999996,0.6134003693823087,dptc_photonic_tile_schedule,generated canonical BERT-base encoder GEMM schedule,random,Random same-sparsity selector,0.7002314814814816,0.0,0.29976851851851843,0.7002314814814816,54.14666666666667,1613,68836
20260513_tetc_pivot,bert_base_glue_seq128,bert_base,"GLUE validation, seq_len=128",bert_base_glue_seq128:k022,22,bert.encoder.layer.3.intermediate.dense,ffn_expand,3,128,768,3072,301989888,4,24,96,9216,384,393216,2457600,1152,230.4,2380.7999999999997,2928.64,0.6087723024638917,dptc_photonic_tile_schedule,generated canonical BERT-base encoder GEMM schedule,random,Random same-sparsity selector,0.7002314814814816,0.0,0.29976851851851843,0.7002314814814816,216.58666666666667,6453,275342
20260513_tetc_pivot,bert_base_glue_seq128,bert_base,"GLUE validation, seq_len=128",bert_base_glue_seq128:k023,23,bert.encoder.layer.3.output.dense,ffn_project,3,128,3072,768,301989888,4,96,24,9216,96,98304,2752512,1152,230.4,2611.2,3159.04,0.6087723024638917,dptc_photonic_tile_schedule,generated canonical BERT-base encoder GEMM schedule,random,Random same-sparsity selector,0.7002314814814816,0.0,0.29976851851851843,0.7002314814814816,216.58666666666667,6453,68836
20260513_tetc_pivot,bert_base_glue_seq128,bert_base,"GLUE validation, seq_len=128",bert_base_glue_seq128:k024,24,bert.encoder.layer.4.attention.self.qkv,mha_qkv_projection,4,128,768,2304,226492416,4,24,72,6912,288,294912,1867776,864,172.8,2841.6,3254.08,0.6411206714154734,dptc_photonic_tile_schedule,generated canonical BERT-base encoder GEMM schedule,random,Random same-sparsity selector,0.7002314814814816,0.0,0.29976851851851843,0.7002314814814816,162.44000000000003,4840,206507
20260513_tetc_pivot,bert_base_glue_seq128,bert_base,"GLUE validation, seq_len=128",bert_base_glue_seq128:k025,25,bert.encoder.layer.4.attention.self.qk_scores,mha_qk_scores,4,1536,64,128,12582912,48,2,4,384,192,196608,106496,48,9.600000000000001,3014.4,3043.36,0.6695379206428898,dptc_photonic_tile_schedule,generated canonical BERT-base encoder GEMM schedule,random,Random same-sparsity selector,0.7002314814814816,0.0,0.29976851851851843,0.7002314814814816,9.024444444444446,269,137671
20260513_tetc_pivot,bert_base_glue_seq128,bert_base,"GLUE validation, seq_len=128",bert_base_glue_seq128:k026,26,bert.encoder.layer.4.attention.self.av_context,mha_av_context,4,1536,128,64,12582912,48,4,2,384,96,98304,204800,48,9.600000000000001,3024.0,3052.96,0.6695379206428898,dptc_photonic_tile_schedule,generated canonical BERT-base encoder GEMM schedule,random,Random same-sparsity selector,0.7002314814814816,0.0,0.29976851851851843,0.7002314814814816,9.024444444444446,269,68836
20260513_tetc_pivot,bert_base_glue_seq128,bert_base,"GLUE validation, seq_len=128",bert_base_glue_seq128:k027,27,bert.encoder.layer.4.attention.output.dense,mha_output_projection,4,128,768,768,75497472,4,24,24,2304,96,98304,688128,288,57.6,3033.6,3175.3599999999997,0.6452185512004904,dptc_photonic_tile_schedule,generated canonical BERT-base encoder GEMM schedule,random,Random same-sparsity selector,0.7002314814814816,0.0,0.29976851851851843,0.7002314814814816,54.14666666666667,1613,68836
20260513_tetc_pivot,bert_base_glue_seq128,bert_base,"GLUE validation, seq_len=128",bert_base_glue_seq128:k028,28,bert.encoder.layer.4.intermediate.dense,ffn_expand,4,128,768,3072,301989888,4,24,96,9216,384,393216,2457600,1152,230.4,3091.2,3639.04,0.6405904842820735,dptc_photonic_tile_schedule,generated canonical BERT-base encoder GEMM schedule,random,Random same-sparsity selector,0.7002314814814816,0.0,0.29976851851851843,0.7002314814814816,216.58666666666667,6453,275342
20260513_tetc_pivot,bert_base_glue_seq128,bert_base,"GLUE validation, seq_len=128",bert_base_glue_seq128:k029,29,bert.encoder.layer.4.output.dense,ffn_project,4,128,3072,768,301989888,4,96,24,9216,96,98304,2752512,1152,230.4,3321.6,3869.44,0.6405904842820735,dptc_photonic_tile_schedule,generated canonical BERT-base encoder GEMM schedule,random,Random same-sparsity selector,0.7002314814814816,0.0,0.29976851851851843,0.7002314814814816,216.58666666666667,6453,68836
20260513_tetc_pivot,bert_base_glue_seq128,bert_base,"GLUE validation, seq_len=128",bert_base_glue_seq128:k030,30,bert.encoder.layer.5.attention.self.qkv,mha_qkv_projection,5,128,768,2304,226492416,4,24,72,6912,288,294912,1867776,864,172.8,3552.0,3964.48,0.6729388532336552,dptc_photonic_tile_schedule,generated canonical BERT-base encoder GEMM schedule,random,Random same-sparsity selector,0.7002314814814816,0.0,0.29976851851851843,0.7002314814814816,162.44000000000003,4840,206507
20260513_tetc_pivot,bert_base_glue_seq128,bert_base,"GLUE validation, seq_len=128",bert_base_glue_seq128:k031,31,bert.encoder.layer.5.attention.self.qk_scores,mha_qk_scores,5,1536,64,128,12582912,48,2,4,384,192,196608,106496,48,9.600000000000001,3724.8,3753.76,0.7013561024610715,dptc_photonic_tile_schedule,generated canonical BERT-base encoder GEMM schedule,random,Random same-sparsity selector,0.7002314814814816,0.0,0.29976851851851843,0.7002314814814816,9.024444444444446,269,137671
20260513_tetc_pivot,bert_base_glue_seq128,bert_base,"GLUE validation, seq_len=128",bert_base_glue_seq128:k032,32,bert.encoder.layer.5.attention.self.av_context,mha_av_context,5,1536,128,64,12582912,48,4,2,384,96,98304,204800,48,9.600000000000001,3734.4,3763.36,0.7013561024610715,dptc_photonic_tile_schedule,generated canonical BERT-base encoder GEMM schedule,random,Random same-sparsity selector,0.7002314814814816,0.0,0.29976851851851843,0.7002314814814816,9.024444444444446,269,68836
20260513_tetc_pivot,bert_base_glue_seq128,bert_base,"GLUE validation, seq_len=128",bert_base_glue_seq128:k033,33,bert.encoder.layer.5.attention.output.dense,mha_output_projection,5,128,768,768,75497472,4,24,24,2304,96,98304,688128,288,57.6,3744.0,3885.7599999999998,0.6770367330186723,dptc_photonic_tile_schedule,generated canonical BERT-base encoder GEMM schedule,random,Random same-sparsity selector,0.7002314814814816,0.0,0.29976851851851843,0.7002314814814816,54.14666666666667,1613,68836
20260513_tetc_pivot,bert_base_glue_seq128,bert_base,"GLUE validation, seq_len=128",bert_base_glue_seq128:k034,34,bert.encoder.layer.5.intermediate.dense,ffn_expand,5,128,768,3072,301989888,4,24,96,9216,384,393216,2457600,1152,230.4,3801.6,4349.44,0.6724086661002546,dptc_photonic_tile_schedule,generated canonical BERT-base encoder GEMM schedule,random,Random same-sparsity selector,0.7002314814814816,0.0,0.29976851851851843,0.7002314814814816,216.58666666666667,6453,275342
20260513_tetc_pivot,bert_base_glue_seq128,bert_base,"GLUE validation, seq_len=128",bert_base_glue_seq128:k035,35,bert.encoder.layer.5.output.dense,ffn_project,5,128,3072,768,301989888,4,96,24,9216,96,98304,2752512,1152,230.4,4032.0,4579.839999999999,0.6724086661002542,dptc_photonic_tile_schedule,generated canonical BERT-base encoder GEMM schedule,random,Random same-sparsity selector,0.7002314814814816,0.0,0.29976851851851843,0.7002314814814816,216.58666666666667,6453,68836
20260513_tetc_pivot,bert_base_glue_seq128,bert_base,"GLUE validation, seq_len=128",bert_base_glue_seq128:k036,36,bert.encoder.layer.6.attention.self.qkv,mha_qkv_projection,6,128,768,2304,226492416,4,24,72,6912,288,294912,1867776,864,172.8,4262.4,4674.88,0.7047570350518385,dptc_photonic_tile_schedule,generated canonical BERT-base encoder GEMM schedule,random,Random same-sparsity selector,0.7002314814814816,0.0,0.29976851851851843,0.7002314814814816,162.44000000000003,4840,206507
20260513_tetc_pivot,bert_base_glue_seq128,bert_base,"GLUE validation, seq_len=128",bert_base_glue_seq128:k037,37,bert.encoder.layer.6.attention.self.qk_scores,mha_qk_scores,6,1536,64,128,12582912,48,2,4,384,192,196608,106496,48,9.600000000000001,4435.2,4464.16,0.7331742842792534,dptc_photonic_tile_schedule,generated canonical BERT-base encoder GEMM schedule,random,Random same-sparsity selector,0.7002314814814816,0.0,0.29976851851851843,0.7002314814814816,9.024444444444446,269,137671
20260513_tetc_pivot,bert_base_glue_seq128,bert_base,"GLUE validation, seq_len=128",bert_base_glue_seq128:k038,38,bert.encoder.layer.6.attention.self.av_context,mha_av_context,6,1536,128,64,12582912,48,4,2,384,96,98304,204800,48,9.600000000000001,4444.8,4473.76,0.7331742842792534,dptc_photonic_tile_schedule,generated canonical BERT-base encoder GEMM schedule,random,Random same-sparsity selector,0.7002314814814816,0.0,0.29976851851851843,0.7002314814814816,9.024444444444446,269,68836
20260513_tetc_pivot,bert_base_glue_seq128,bert_base,"GLUE validation, seq_len=128",bert_base_glue_seq128:k039,39,bert.encoder.layer.6.attention.output.dense,mha_output_projection,6,128,768,768,75497472,4,24,24,2304,96,98304,688128,288,57.6,4454.400000000001,4596.160000000001,0.7088549148368563,dptc_photonic_tile_schedule,generated canonical BERT-base encoder GEMM schedule,random,Random same-sparsity selector,0.7002314814814816,0.0,0.29976851851851843,0.7002314814814816,54.14666666666667,1613,68836
20260513_tetc_pivot,bert_base_glue_seq128,bert_base,"GLUE validation, seq_len=128",bert_base_glue_seq128:k040,40,bert.encoder.layer.6.intermediate.dense,ffn_expand,6,128,768,3072,301989888,4,24,96,9216,384,393216,2457600,1152,230.4,4512.000000000001,5059.84,0.704226847918436,dptc_photonic_tile_schedule,generated canonical BERT-base encoder GEMM schedule,random,Random same-sparsity selector,0.7002314814814816,0.0,0.29976851851851843,0.7002314814814816,216.58666666666667,6453,275342
20260513_tetc_pivot,bert_base_glue_seq128,bert_base,"GLUE validation, seq_len=128",bert_base_glue_seq128:k041,41,bert.encoder.layer.6.output.dense,ffn_project,6,128,3072,768,301989888,4,96,24,9216,96,98304,2752512,1152,230.4,4742.400000000001,5290.24,0.704226847918436,dptc_photonic_tile_schedule,generated canonical BERT-base encoder GEMM schedule,random,Random same-sparsity selector,0.7002314814814816,0.0,0.29976851851851843,0.7002314814814816,216.58666666666667,6453,68836
20260513_tetc_pivot,bert_base_glue_seq128,bert_base,"GLUE validation, seq_len=128",bert_base_glue_seq128:k042,42,bert.encoder.layer.7.attention.self.qkv,mha_qkv_projection,7,128,768,2304,226492416,4,24,72,6912,288,294912,1867776,864,172.8,4972.8,5385.280000000001,0.7365752168700204,dptc_photonic_tile_schedule,generated canonical BERT-base encoder GEMM schedule,random,Random same-sparsity selector,0.7002314814814816,0.0,0.29976851851851843,0.7002314814814816,162.44000000000003,4840,206507
20260513_tetc_pivot,bert_base_glue_seq128,bert_base,"GLUE validation, seq_len=128",bert_base_glue_seq128:k043,43,bert.encoder.layer.7.attention.self.qk_scores,mha_qk_scores,7,1536,64,128,12582912,48,2,4,384,192,196608,106496,48,9.600000000000001,5145.6,5174.56,0.7649924660974352,dptc_photonic_tile_schedule,generated canonical BERT-base encoder GEMM schedule,random,Random same-sparsity selector,0.7002314814814816,0.0,0.29976851851851843,0.7002314814814816,9.024444444444446,269,137671
20260513_tetc_pivot,bert_base_glue_seq128,bert_base,"GLUE validation, seq_len=128",bert_base_glue_seq128:k044,44,bert.encoder.layer.7.attention.self.av_context,mha_av_context,7,1536,128,64,12582912,48,4,2,384,96,98304,204800,48,9.600000000000001,5155.200000000001,5184.160000000001,0.7649924660974352,dptc_photonic_tile_schedule,generated canonical BERT-base encoder GEMM schedule,random,Random same-sparsity selector,0.7002314814814816,0.0,0.29976851851851843,0.7002314814814816,9.024444444444446,269,68836
20260513_tetc_pivot,bert_base_glue_seq128,bert_base,"GLUE validation, seq_len=128",bert_base_glue_seq128:k045,45,bert.encoder.layer.7.attention.output.dense,mha_output_projection,7,128,768,768,75497472,4,24,24,2304,96,98304,688128,288,57.6,5164.800000000001,5306.560000000001,0.7406730966550381,dptc_photonic_tile_schedule,generated canonical BERT-base encoder GEMM schedule,random,Random same-sparsity selector,0.7002314814814816,0.0,0.29976851851851843,0.7002314814814816,54.14666666666667,1613,68836
20260513_tetc_pivot,bert_base_glue_seq128,bert_base,"GLUE validation, seq_len=128",bert_base_glue_seq128:k046,46,bert.encoder.layer.7.intermediate.dense,ffn_expand,7,128,768,3072,301989888,4,24,96,9216,384,393216,2457600,1152,230.4,5222.4000000000015,5770.240000000001,0.7360450297366179,dptc_photonic_tile_schedule,generated canonical BERT-base encoder GEMM schedule,random,Random same-sparsity selector,0.7002314814814816,0.0,0.29976851851851843,0.7002314814814816,216.58666666666667,6453,275342
20260513_tetc_pivot,bert_base_glue_seq128,bert_base,"GLUE validation, seq_len=128",bert_base_glue_seq128:k047,47,bert.encoder.layer.7.output.dense,ffn_project,7,128,3072,768,301989888,4,96,24,9216,96,98304,2752512,1152,230.4,5452.800000000001,6000.64,0.7360450297366179,dptc_photonic_tile_schedule,generated canonical BERT-base encoder GEMM schedule,random,Random same-sparsity selector,0.7002314814814816,0.0,0.29976851851851843,0.7002314814814816,216.58666666666667,6453,68836
20260513_tetc_pivot,bert_base_glue_seq128,bert_base,"GLUE validation, seq_len=128",bert_base_glue_seq128:k048,48,bert.encoder.layer.8.attention.self.qkv,mha_qkv_projection,8,128,768,2304,226492416,4,24,72,6912,288,294912,1867776,864,172.8,5683.200000000001,6095.680000000001,0.7683933986882021,dptc_photonic_tile_schedule,generated canonical BERT-base encoder GEMM schedule,random,Random same-sparsity selector,0.7002314814814816,0.0,0.29976851851851843,0.7002314814814816,162.44000000000003,4840,206507
20260513_tetc_pivot,bert_base_glue_seq128,bert_base,"GLUE validation, seq_len=128",bert_base_glue_seq128:k049,49,bert.encoder.layer.8.attention.self.qk_scores,mha_qk_scores,8,1536,64,128,12582912,48,2,4,384,192,196608,106496,48,9.600000000000001,5856.000000000001,5884.960000000001,0.796810647915617,dptc_photonic_tile_schedule,generated canonical BERT-base encoder GEMM schedule,random,Random same-sparsity selector,0.7002314814814816,0.0,0.29976851851851843,0.7002314814814816,9.024444444444446,269,137671
20260513_tetc_pivot,bert_base_glue_seq128,bert_base,"GLUE validation, seq_len=128",bert_base_glue_seq128:k050,50,bert.encoder.layer.8.attention.self.av_context,mha_av_context,8,1536,128,64,12582912,48,4,2,384,96,98304,204800,48,9.600000000000001,5865.600000000001,5894.560000000001,0.796810647915617,dptc_photonic_tile_schedule,generated canonical BERT-base encoder GEMM schedule,random,Random same-sparsity selector,0.7002314814814816,0.0,0.29976851851851843,0.7002314814814816,9.024444444444446,269,68836
20260513_tetc_pivot,bert_base_glue_seq128,bert_base,"GLUE validation, seq_len=128",bert_base_glue_seq128:k051,51,bert.encoder.layer.8.attention.output.dense,mha_output_projection,8,128,768,768,75497472,4,24,24,2304,96,98304,688128,288,57.6,5875.200000000002,6016.960000000002,0.7724912784732199,dptc_photonic_tile_schedule,generated canonical BERT-base encoder GEMM schedule,random,Random same-sparsity selector,0.7002314814814816,0.0,0.29976851851851843,0.7002314814814816,54.14666666666667,1613,68836
20260513_tetc_pivot,bert_base_glue_seq128,bert_base,"GLUE validation, seq_len=128",bert_base_glue_seq128:k052,52,bert.encoder.layer.8.intermediate.dense,ffn_expand,8,128,768,3072,301989888,4,24,96,9216,384,393216,2457600,1152,230.4,5932.800000000002,6480.640000000001,0.7678632115547996,dptc_photonic_tile_schedule,generated canonical BERT-base encoder GEMM schedule,random,Random same-sparsity selector,0.7002314814814816,0.0,0.29976851851851843,0.7002314814814816,216.58666666666667,6453,275342
20260513_tetc_pivot,bert_base_glue_seq128,bert_base,"GLUE validation, seq_len=128",bert_base_glue_seq128:k053,53,bert.encoder.layer.8.output.dense,ffn_project,8,128,3072,768,301989888,4,96,24,9216,96,98304,2752512,1152,230.4,6163.200000000002,6711.040000000001,0.7678632115547996,dptc_photonic_tile_schedule,generated canonical BERT-base encoder GEMM schedule,random,Random same-sparsity selector,0.7002314814814816,0.0,0.29976851851851843,0.7002314814814816,216.58666666666667,6453,68836
20260513_tetc_pivot,bert_base_glue_seq128,bert_base,"GLUE validation, seq_len=128",bert_base_glue_seq128:k054,54,bert.encoder.layer.9.attention.self.qkv,mha_qkv_projection,9,128,768,2304,226492416,4,24,72,6912,288,294912,1867776,864,172.8,6393.600000000001,6806.080000000002,0.800211580506384,dptc_photonic_tile_schedule,generated canonical BERT-base encoder GEMM schedule,random,Random same-sparsity selector,0.7002314814814816,0.0,0.29976851851851843,0.7002314814814816,162.44000000000003,4840,206507
20260513_tetc_pivot,bert_base_glue_seq128,bert_base,"GLUE validation, seq_len=128",bert_base_glue_seq128:k055,55,bert.encoder.layer.9.attention.self.qk_scores,mha_qk_scores,9,1536,64,128,12582912,48,2,4,384,192,196608,106496,48,9.600000000000001,6566.4000000000015,6595.3600000000015,0.8286288297337988,dptc_photonic_tile_schedule,generated canonical BERT-base encoder GEMM schedule,random,Random same-sparsity selector,0.7002314814814816,0.0,0.29976851851851843,0.7002314814814816,9.024444444444446,269,137671
20260513_tetc_pivot,bert_base_glue_seq128,bert_base,"GLUE validation, seq_len=128",bert_base_glue_seq128:k056,56,bert.encoder.layer.9.attention.self.av_context,mha_av_context,9,1536,128,64,12582912,48,4,2,384,96,98304,204800,48,9.600000000000001,6576.000000000002,6604.960000000002,0.8286288297337988,dptc_photonic_tile_schedule,generated canonical BERT-base encoder GEMM schedule,random,Random same-sparsity selector,0.7002314814814816,0.0,0.29976851851851843,0.7002314814814816,9.024444444444446,269,68836
20260513_tetc_pivot,bert_base_glue_seq128,bert_base,"GLUE validation, seq_len=128",bert_base_glue_seq128:k057,57,bert.encoder.layer.9.attention.output.dense,mha_output_projection,9,128,768,768,75497472,4,24,24,2304,96,98304,688128,288,57.6,6585.600000000002,6727.360000000002,0.8043094602914017,dptc_photonic_tile_schedule,generated canonical BERT-base encoder GEMM schedule,random,Random same-sparsity selector,0.7002314814814816,0.0,0.29976851851851843,0.7002314814814816,54.14666666666667,1613,68836
20260513_tetc_pivot,bert_base_glue_seq128,bert_base,"GLUE validation, seq_len=128",bert_base_glue_seq128:k058,58,bert.encoder.layer.9.intermediate.dense,ffn_expand,9,128,768,3072,301989888,4,24,96,9216,384,393216,2457600,1152,230.4,6643.200000000003,7191.040000000002,0.7996813933729815,dptc_photonic_tile_schedule,generated canonical BERT-base encoder GEMM schedule,random,Random same-sparsity selector,0.7002314814814816,0.0,0.29976851851851843,0.7002314814814816,216.58666666666667,6453,275342
20260513_tetc_pivot,bert_base_glue_seq128,bert_base,"GLUE validation, seq_len=128",bert_base_glue_seq128:k059,59,bert.encoder.layer.9.output.dense,ffn_project,9,128,3072,768,301989888,4,96,24,9216,96,98304,2752512,1152,230.4,6873.600000000002,7421.440000000001,0.7996813933729815,dptc_photonic_tile_schedule,generated canonical BERT-base encoder GEMM schedule,random,Random same-sparsity selector,0.7002314814814816,0.0,0.29976851851851843,0.7002314814814816,216.58666666666667,6453,68836
20260513_tetc_pivot,bert_base_glue_seq128,bert_base,"GLUE validation, seq_len=128",bert_base_glue_seq128:k060,60,bert.encoder.layer.10.attention.self.qkv,mha_qkv_projection,10,128,768,2304,226492416,4,24,72,6912,288,294912,1867776,864,172.8,7104.000000000002,7516.480000000002,0.8320297623245658,dptc_photonic_tile_schedule,generated canonical BERT-base encoder GEMM schedule,random,Random same-sparsity selector,0.7002314814814816,0.0,0.29976851851851843,0.7002314814814816,162.44000000000003,4840,206507
20260513_tetc_pivot,bert_base_glue_seq128,bert_base,"GLUE validation, seq_len=128",bert_base_glue_seq128:k061,61,bert.encoder.layer.10.attention.self.qk_scores,mha_qk_scores,10,1536,64,128,12582912,48,2,4,384,192,196608,106496,48,9.600000000000001,7276.800000000002,7305.760000000002,0.8604470115519807,dptc_photonic_tile_schedule,generated canonical BERT-base encoder GEMM schedule,random,Random same-sparsity selector,0.7002314814814816,0.0,0.29976851851851843,0.7002314814814816,9.024444444444446,269,137671
20260513_tetc_pivot,bert_base_glue_seq128,bert_base,"GLUE validation, seq_len=128",bert_base_glue_seq128:k062,62,bert.encoder.layer.10.attention.self.av_context,mha_av_context,10,1536,128,64,12582912,48,4,2,384,96,98304,204800,48,9.600000000000001,7286.400000000002,7315.360000000002,0.8604470115519807,dptc_photonic_tile_schedule,generated canonical BERT-base encoder GEMM schedule,random,Random same-sparsity selector,0.7002314814814816,0.0,0.29976851851851843,0.7002314814814816,9.024444444444446,269,68836
20260513_tetc_pivot,bert_base_glue_seq128,bert_base,"GLUE validation, seq_len=128",bert_base_glue_seq128:k063,63,bert.encoder.layer.10.attention.output.dense,mha_output_projection,10,128,768,768,75497472,4,24,24,2304,96,98304,688128,288,57.6,7296.000000000003,7437.760000000003,0.8361276421095836,dptc_photonic_tile_schedule,generated canonical BERT-base encoder GEMM schedule,random,Random same-sparsity selector,0.7002314814814816,0.0,0.29976851851851843,0.7002314814814816,54.14666666666667,1613,68836
20260513_tetc_pivot,bert_base_glue_seq128,bert_base,"GLUE validation, seq_len=128",bert_base_glue_seq128:k064,64,bert.encoder.layer.10.intermediate.dense,ffn_expand,10,128,768,3072,301989888,4,24,96,9216,384,393216,2457600,1152,230.4,7353.600000000003,7901.440000000002,0.8314995751911634,dptc_photonic_tile_schedule,generated canonical BERT-base encoder GEMM schedule,random,Random same-sparsity selector,0.7002314814814816,0.0,0.29976851851851843,0.7002314814814816,216.58666666666667,6453,275342
20260513_tetc_pivot,bert_base_glue_seq128,bert_base,"GLUE validation, seq_len=128",bert_base_glue_seq128:k065,65,bert.encoder.layer.10.output.dense,ffn_project,10,128,3072,768,301989888,4,96,24,9216,96,98304,2752512,1152,230.4,7584.000000000003,8131.840000000002,0.8314995751911634,dptc_photonic_tile_schedule,generated canonical BERT-base encoder GEMM schedule,random,Random same-sparsity selector,0.7002314814814816,0.0,0.29976851851851843,0.7002314814814816,216.58666666666667,6453,68836
20260513_tetc_pivot,bert_base_glue_seq128,bert_base,"GLUE validation, seq_len=128",bert_base_glue_seq128:k066,66,bert.encoder.layer.11.attention.self.qkv,mha_qkv_projection,11,128,768,2304,226492416,4,24,72,6912,288,294912,1867776,864,172.8,7814.400000000002,8226.880000000003,0.8638479441427476,dptc_photonic_tile_schedule,generated canonical BERT-base encoder GEMM schedule,random,Random same-sparsity selector,0.7002314814814816,0.0,0.29976851851851843,0.7002314814814816,162.44000000000003,4840,206507
20260513_tetc_pivot,bert_base_glue_seq128,bert_base,"GLUE validation, seq_len=128",bert_base_glue_seq128:k067,67,bert.encoder.layer.11.attention.self.qk_scores,mha_qk_scores,11,1536,64,128,12582912,48,2,4,384,192,196608,106496,48,9.600000000000001,7987.200000000003,8016.160000000003,0.8922651933701624,dptc_photonic_tile_schedule,generated canonical BERT-base encoder GEMM schedule,random,Random same-sparsity selector,0.7002314814814816,0.0,0.29976851851851843,0.7002314814814816,9.024444444444446,269,137671
20260513_tetc_pivot,bert_base_glue_seq128,bert_base,"GLUE validation, seq_len=128",bert_base_glue_seq128:k068,68,bert.encoder.layer.11.attention.self.av_context,mha_av_context,11,1536,128,64,12582912,48,4,2,384,96,98304,204800,48,9.600000000000001,7996.800000000003,8025.760000000003,0.8922651933701624,dptc_photonic_tile_schedule,generated canonical BERT-base encoder GEMM schedule,random,Random same-sparsity selector,0.7002314814814816,0.0,0.29976851851851843,0.7002314814814816,9.024444444444446,269,68836
20260513_tetc_pivot,bert_base_glue_seq128,bert_base,"GLUE validation, seq_len=128",bert_base_glue_seq128:k069,69,bert.encoder.layer.11.attention.output.dense,mha_output_projection,11,128,768,768,75497472,4,24,24,2304,96,98304,688128,288,57.6,8006.400000000003,8148.1600000000035,0.8679458239277653,dptc_photonic_tile_schedule,generated canonical BERT-base encoder GEMM schedule,random,Random same-sparsity selector,0.7002314814814816,0.0,0.29976851851851843,0.7002314814814816,54.14666666666667,1613,68836
20260513_tetc_pivot,bert_base_glue_seq128,bert_base,"GLUE validation, seq_len=128",bert_base_glue_seq128:k070,70,bert.encoder.layer.11.intermediate.dense,ffn_expand,11,128,768,3072,301989888,4,24,96,9216,384,393216,2457600,1152,230.4,8064.000000000004,8611.840000000004,0.8633177570093462,dptc_photonic_tile_schedule,generated canonical BERT-base encoder GEMM schedule,random,Random same-sparsity selector,0.7002314814814816,0.0,0.29976851851851843,0.7002314814814816,216.58666666666667,6453,275342
20260513_tetc_pivot,bert_base_glue_seq128,bert_base,"GLUE validation, seq_len=128",bert_base_glue_seq128:k071,71,bert.encoder.layer.11.output.dense,ffn_project,11,128,3072,768,301989888,4,96,24,9216,96,98304,2752512,1152,230.4,8294.400000000003,8842.240000000003,0.8633177570093451,dptc_photonic_tile_schedule,generated canonical BERT-base encoder GEMM schedule,random,Random same-sparsity selector,0.7002314814814816,0.0,0.29976851851851843,0.7002314814814816,216.58666666666667,6453,68836
20260513_tetc_pivot,bert_base_glue_seq128,bert_base,"GLUE validation, seq_len=128",bert_base_glue_seq128:k000,0,bert.encoder.layer.0.attention.self.qkv,mha_qkv_projection,0,128,768,2304,226492416,4,24,72,6912,288,294912,1867776,864,172.8,0.0,412.48,0.5138479441427464,dptc_photonic_tile_schedule,generated canonical BERT-base encoder GEMM schedule,l1,L1 selector,0.7002314814814814,0.0,0.29976851851851843,0.7002314814814816,162.44000000000003,4840,206507
20260513_tetc_pivot,bert_base_glue_seq128,bert_base,"GLUE validation, seq_len=128",bert_base_glue_seq128:k001,1,bert.encoder.layer.0.attention.self.qk_scores,mha_qk_scores,0,1536,64,128,12582912,48,2,4,384,192,196608,106496,48,9.600000000000001,172.8,201.76000000000002,0.5422651933701657,dptc_photonic_tile_schedule,generated canonical BERT-base encoder GEMM schedule,l1,L1 selector,0.7002314814814814,0.0,0.29976851851851843,0.7002314814814816,9.024444444444446,269,137671
20260513_tetc_pivot,bert_base_glue_seq128,bert_base,"GLUE validation, seq_len=128",bert_base_glue_seq128:k002,2,bert.encoder.layer.0.attention.self.av_context,mha_av_context,0,1536,128,64,12582912,48,4,2,384,96,98304,204800,48,9.600000000000001,182.4,211.36,0.5422651933701657,dptc_photonic_tile_schedule,generated canonical BERT-base encoder GEMM schedule,l1,L1 selector,0.7002314814814814,0.0,0.29976851851851843,0.7002314814814816,9.024444444444446,269,68836
20260513_tetc_pivot,bert_base_glue_seq128,bert_base,"GLUE validation, seq_len=128",bert_base_glue_seq128:k003,3,bert.encoder.layer.0.attention.output.dense,mha_output_projection,0,128,768,768,75497472,4,24,24,2304,96,98304,688128,288,57.6,192.0,333.76,0.517945823927765,dptc_photonic_tile_schedule,generated canonical BERT-base encoder GEMM schedule,l1,L1 selector,0.7002314814814814,0.0,0.29976851851851843,0.7002314814814816,54.14666666666667,1613,68836
20260513_tetc_pivot,bert_base_glue_seq128,bert_base,"GLUE validation, seq_len=128",bert_base_glue_seq128:k004,4,bert.encoder.layer.0.intermediate.dense,ffn_expand,0,128,768,3072,301989888,4,24,96,9216,384,393216,2457600,1152,230.4,249.6,797.44,0.5133177570093458,dptc_photonic_tile_schedule,generated canonical BERT-base encoder GEMM schedule,l1,L1 selector,0.7002314814814814,0.0,0.29976851851851843,0.7002314814814816,216.58666666666667,6453,275342
20260513_tetc_pivot,bert_base_glue_seq128,bert_base,"GLUE validation, seq_len=128",bert_base_glue_seq128:k005,5,bert.encoder.layer.0.output.dense,ffn_project,0,128,3072,768,301989888,4,96,24,9216,96,98304,2752512,1152,230.4,480.0,1027.84,0.5133177570093456,dptc_photonic_tile_schedule,generated canonical BERT-base encoder GEMM schedule,l1,L1 selector,0.7002314814814814,0.0,0.29976851851851843,0.7002314814814816,216.58666666666667,6453,68836
20260513_tetc_pivot,bert_base_glue_seq128,bert_base,"GLUE validation, seq_len=128",bert_base_glue_seq128:k006,6,bert.encoder.layer.1.attention.self.qkv,mha_qkv_projection,1,128,768,2304,226492416,4,24,72,6912,288,294912,1867776,864,172.8,710.4,1122.88,0.5456661259609283,dptc_photonic_tile_schedule,generated canonical BERT-base encoder GEMM schedule,l1,L1 selector,0.7002314814814814,0.0,0.29976851851851843,0.7002314814814816,162.44000000000003,4840,206507
20260513_tetc_pivot,bert_base_glue_seq128,bert_base,"GLUE validation, seq_len=128",bert_base_glue_seq128:k007,7,bert.encoder.layer.1.attention.self.qk_scores,mha_qk_scores,1,1536,64,128,12582912,48,2,4,384,192,196608,106496,48,9.600000000000001,883.2,912.1600000000001,0.5740833751883494,dptc_photonic_tile_schedule,generated canonical BERT-base encoder GEMM schedule,l1,L1 selector,0.7002314814814814,0.0,0.29976851851851843,0.7002314814814816,9.024444444444446,269,137671
20260513_tetc_pivot,bert_base_glue_seq128,bert_base,"GLUE validation, seq_len=128",bert_base_glue_seq128:k008,8,bert.encoder.layer.1.attention.self.av_context,mha_av_context,1,1536,128,64,12582912,48,4,2,384,96,98304,204800,48,9.600000000000001,892.8000000000001,921.7600000000001,0.5740833751883494,dptc_photonic_tile_schedule,generated canonical BERT-base encoder GEMM schedule,l1,L1 selector,0.7002314814814814,0.0,0.29976851851851843,0.7002314814814816,9.024444444444446,269,68836
20260513_tetc_pivot,bert_base_glue_seq128,bert_base,"GLUE validation, seq_len=128",bert_base_glue_seq128:k009,9,bert.encoder.layer.1.attention.output.dense,mha_output_projection,1,128,768,768,75497472,4,24,24,2304,96,98304,688128,288,57.6,902.4000000000001,1044.16,0.5497640057459472,dptc_photonic_tile_schedule,generated canonical BERT-base encoder GEMM schedule,l1,L1 selector,0.7002314814814814,0.0,0.29976851851851843,0.7002314814814816,54.14666666666667,1613,68836
20260513_tetc_pivot,bert_base_glue_seq128,bert_base,"GLUE validation, seq_len=128",bert_base_glue_seq128:k010,10,bert.encoder.layer.1.intermediate.dense,ffn_expand,1,128,768,3072,301989888,4,24,96,9216,384,393216,2457600,1152,230.4,960.0000000000001,1507.8400000000001,0.5451359388275278,dptc_photonic_tile_schedule,generated canonical BERT-base encoder GEMM schedule,l1,L1 selector,0.7002314814814814,0.0,0.29976851851851843,0.7002314814814816,216.58666666666667,6453,275342
20260513_tetc_pivot,bert_base_glue_seq128,bert_base,"GLUE validation, seq_len=128",bert_base_glue_seq128:k011,11,bert.encoder.layer.1.output.dense,ffn_project,1,128,3072,768,301989888,4,96,24,9216,96,98304,2752512,1152,230.4,1190.4,1738.2400000000002,0.5451359388275278,dptc_photonic_tile_schedule,generated canonical BERT-base encoder GEMM schedule,l1,L1 selector,0.7002314814814814,0.0,0.29976851851851843,0.7002314814814816,216.58666666666667,6453,68836
20260513_tetc_pivot,bert_base_glue_seq128,bert_base,"GLUE validation, seq_len=128",bert_base_glue_seq128:k012,12,bert.encoder.layer.2.attention.self.qkv,mha_qkv_projection,2,128,768,2304,226492416,4,24,72,6912,288,294912,1867776,864,172.8,1420.8000000000002,1833.2800000000002,0.5774843077791098,dptc_photonic_tile_schedule,generated canonical BERT-base encoder GEMM schedule,l1,L1 selector,0.7002314814814814,0.0,0.29976851851851843,0.7002314814814816,162.44000000000003,4840,206507
20260513_tetc_pivot,bert_base_glue_seq128,bert_base,"GLUE validation, seq_len=128",bert_base_glue_seq128:k013,13,bert.encoder.layer.2.attention.self.qk_scores,mha_qk_scores,2,1536,64,128,12582912,48,2,4,384,192,196608,106496,48,9.600000000000001,1593.6000000000001,1622.56,0.605901557006526,dptc_photonic_tile_schedule,generated canonical BERT-base encoder GEMM schedule,l1,L1 selector,0.7002314814814814,0.0,0.29976851851851843,0.7002314814814816,9.024444444444446,269,137671
20260513_tetc_pivot,bert_base_glue_seq128,bert_base,"GLUE validation, seq_len=128",bert_base_glue_seq128:k014,14,bert.encoder.layer.2.attention.self.av_context,mha_av_context,2,1536,128,64,12582912,48,4,2,384,96,98304,204800,48,9.600000000000001,1603.2,1632.1599999999999,0.605901557006526,dptc_photonic_tile_schedule,generated canonical BERT-base encoder GEMM schedule,l1,L1 selector,0.7002314814814814,0.0,0.29976851851851843,0.7002314814814816,9.024444444444446,269,68836
20260513_tetc_pivot,bert_base_glue_seq128,bert_base,"GLUE validation, seq_len=128",bert_base_glue_seq128:k015,15,bert.encoder.layer.2.attention.output.dense,mha_output_projection,2,128,768,768,75497472,4,24,24,2304,96,98304,688128,288,57.6,1612.8,1754.56,0.5815821875641289,dptc_photonic_tile_schedule,generated canonical BERT-base encoder GEMM schedule,l1,L1 selector,0.7002314814814814,0.0,0.29976851851851843,0.7002314814814816,54.14666666666667,1613,68836
20260513_tetc_pivot,bert_base_glue_seq128,bert_base,"GLUE validation, seq_len=128",bert_base_glue_seq128:k016,16,bert.encoder.layer.2.intermediate.dense,ffn_expand,2,128,768,3072,301989888,4,24,96,9216,384,393216,2457600,1152,230.4,1670.3999999999999,2218.24,0.5769541206457092,dptc_photonic_tile_schedule,generated canonical BERT-base encoder GEMM schedule,l1,L1 selector,0.7002314814814814,0.0,0.29976851851851843,0.7002314814814816,216.58666666666667,6453,275342
20260513_tetc_pivot,bert_base_glue_seq128,bert_base,"GLUE validation, seq_len=128",bert_base_glue_seq128:k017,17,bert.encoder.layer.2.output.dense,ffn_project,2,128,3072,768,301989888,4,96,24,9216,96,98304,2752512,1152,230.4,1900.8,2448.64,0.5769541206457092,dptc_photonic_tile_schedule,generated canonical BERT-base encoder GEMM schedule,l1,L1 selector,0.7002314814814814,0.0,0.29976851851851843,0.7002314814814816,216.58666666666667,6453,68836
20260513_tetc_pivot,bert_base_glue_seq128,bert_base,"GLUE validation, seq_len=128",bert_base_glue_seq128:k018,18,bert.encoder.layer.3.attention.self.qkv,mha_qkv_projection,3,128,768,2304,226492416,4,24,72,6912,288,294912,1867776,864,172.8,2131.2,2543.68,0.6093024895972916,dptc_photonic_tile_schedule,generated canonical BERT-base encoder GEMM schedule,l1,L1 selector,0.7002314814814814,0.0,0.29976851851851843,0.7002314814814816,162.44000000000003,4840,206507
20260513_tetc_pivot,bert_base_glue_seq128,bert_base,"GLUE validation, seq_len=128",bert_base_glue_seq128:k019,19,bert.encoder.layer.3.attention.self.qk_scores,mha_qk_scores,3,1536,64,128,12582912,48,2,4,384,192,196608,106496,48,9.600000000000001,2304.0,2332.96,0.6377197388247079,dptc_photonic_tile_schedule,generated canonical BERT-base encoder GEMM schedule,l1,L1 selector,0.7002314814814814,0.0,0.29976851851851843,0.7002314814814816,9.024444444444446,269,137671
20260513_tetc_pivot,bert_base_glue_seq128,bert_base,"GLUE validation, seq_len=128",bert_base_glue_seq128:k020,20,bert.encoder.layer.3.attention.self.av_context,mha_av_context,3,1536,128,64,12582912,48,4,2,384,96,98304,204800,48,9.600000000000001,2313.6,2342.56,0.6377197388247079,dptc_photonic_tile_schedule,generated canonical BERT-base encoder GEMM schedule,l1,L1 selector,0.7002314814814814,0.0,0.29976851851851843,0.7002314814814816,9.024444444444446,269,68836
20260513_tetc_pivot,bert_base_glue_seq128,bert_base,"GLUE validation, seq_len=128",bert_base_glue_seq128:k021,21,bert.encoder.layer.3.attention.output.dense,mha_output_projection,3,128,768,768,75497472,4,24,24,2304,96,98304,688128,288,57.6,2323.2,2464.9599999999996,0.6134003693823087,dptc_photonic_tile_schedule,generated canonical BERT-base encoder GEMM schedule,l1,L1 selector,0.7002314814814814,0.0,0.29976851851851843,0.7002314814814816,54.14666666666667,1613,68836
20260513_tetc_pivot,bert_base_glue_seq128,bert_base,"GLUE validation, seq_len=128",bert_base_glue_seq128:k022,22,bert.encoder.layer.3.intermediate.dense,ffn_expand,3,128,768,3072,301989888,4,24,96,9216,384,393216,2457600,1152,230.4,2380.7999999999997,2928.64,0.6087723024638917,dptc_photonic_tile_schedule,generated canonical BERT-base encoder GEMM schedule,l1,L1 selector,0.7002314814814814,0.0,0.29976851851851843,0.7002314814814816,216.58666666666667,6453,275342
20260513_tetc_pivot,bert_base_glue_seq128,bert_base,"GLUE validation, seq_len=128",bert_base_glue_seq128:k023,23,bert.encoder.layer.3.output.dense,ffn_project,3,128,3072,768,301989888,4,96,24,9216,96,98304,2752512,1152,230.4,2611.2,3159.04,0.6087723024638917,dptc_photonic_tile_schedule,generated canonical BERT-base encoder GEMM schedule,l1,L1 selector,0.7002314814814814,0.0,0.29976851851851843,0.7002314814814816,216.58666666666667,6453,68836
20260513_tetc_pivot,bert_base_glue_seq128,bert_base,"GLUE validation, seq_len=128",bert_base_glue_seq128:k024,24,bert.encoder.layer.4.attention.self.qkv,mha_qkv_projection,4,128,768,2304,226492416,4,24,72,6912,288,294912,1867776,864,172.8,2841.6,3254.08,0.6411206714154734,dptc_photonic_tile_schedule,generated canonical BERT-base encoder GEMM schedule,l1,L1 selector,0.7002314814814814,0.0,0.29976851851851843,0.7002314814814816,162.44000000000003,4840,206507
20260513_tetc_pivot,bert_base_glue_seq128,bert_base,"GLUE validation, seq_len=128",bert_base_glue_seq128:k025,25,bert.encoder.layer.4.attention.self.qk_scores,mha_qk_scores,4,1536,64,128,12582912,48,2,4,384,192,196608,106496,48,9.600000000000001,3014.4,3043.36,0.6695379206428898,dptc_photonic_tile_schedule,generated canonical BERT-base encoder GEMM schedule,l1,L1 selector,0.7002314814814814,0.0,0.29976851851851843,0.7002314814814816,9.024444444444446,269,137671
20260513_tetc_pivot,bert_base_glue_seq128,bert_base,"GLUE validation, seq_len=128",bert_base_glue_seq128:k026,26,bert.encoder.layer.4.attention.self.av_context,mha_av_context,4,1536,128,64,12582912,48,4,2,384,96,98304,204800,48,9.600000000000001,3024.0,3052.96,0.6695379206428898,dptc_photonic_tile_schedule,generated canonical BERT-base encoder GEMM schedule,l1,L1 selector,0.7002314814814814,0.0,0.29976851851851843,0.7002314814814816,9.024444444444446,269,68836
20260513_tetc_pivot,bert_base_glue_seq128,bert_base,"GLUE validation, seq_len=128",bert_base_glue_seq128:k027,27,bert.encoder.layer.4.attention.output.dense,mha_output_projection,4,128,768,768,75497472,4,24,24,2304,96,98304,688128,288,57.6,3033.6,3175.3599999999997,0.6452185512004904,dptc_photonic_tile_schedule,generated canonical BERT-base encoder GEMM schedule,l1,L1 selector,0.7002314814814814,0.0,0.29976851851851843,0.7002314814814816,54.14666666666667,1613,68836
20260513_tetc_pivot,bert_base_glue_seq128,bert_base,"GLUE validation, seq_len=128",bert_base_glue_seq128:k028,28,bert.encoder.layer.4.intermediate.dense,ffn_expand,4,128,768,3072,301989888,4,24,96,9216,384,393216,2457600,1152,230.4,3091.2,3639.04,0.6405904842820735,dptc_photonic_tile_schedule,generated canonical BERT-base encoder GEMM schedule,l1,L1 selector,0.7002314814814814,0.0,0.29976851851851843,0.7002314814814816,216.58666666666667,6453,275342
20260513_tetc_pivot,bert_base_glue_seq128,bert_base,"GLUE validation, seq_len=128",bert_base_glue_seq128:k029,29,bert.encoder.layer.4.output.dense,ffn_project,4,128,3072,768,301989888,4,96,24,9216,96,98304,2752512,1152,230.4,3321.6,3869.44,0.6405904842820735,dptc_photonic_tile_schedule,generated canonical BERT-base encoder GEMM schedule,l1,L1 selector,0.7002314814814814,0.0,0.29976851851851843,0.7002314814814816,216.58666666666667,6453,68836
20260513_tetc_pivot,bert_base_glue_seq128,bert_base,"GLUE validation, seq_len=128",bert_base_glue_seq128:k030,30,bert.encoder.layer.5.attention.self.qkv,mha_qkv_projection,5,128,768,2304,226492416,4,24,72,6912,288,294912,1867776,864,172.8,3552.0,3964.48,0.6729388532336552,dptc_photonic_tile_schedule,generated canonical BERT-base encoder GEMM schedule,l1,L1 selector,0.7002314814814814,0.0,0.29976851851851843,0.7002314814814816,162.44000000000003,4840,206507
20260513_tetc_pivot,bert_base_glue_seq128,bert_base,"GLUE validation, seq_len=128",bert_base_glue_seq128:k031,31,bert.encoder.layer.5.attention.self.qk_scores,mha_qk_scores,5,1536,64,128,12582912,48,2,4,384,192,196608,106496,48,9.600000000000001,3724.8,3753.76,0.7013561024610715,dptc_photonic_tile_schedule,generated canonical BERT-base encoder GEMM schedule,l1,L1 selector,0.7002314814814814,0.0,0.29976851851851843,0.7002314814814816,9.024444444444446,269,137671
20260513_tetc_pivot,bert_base_glue_seq128,bert_base,"GLUE validation, seq_len=128",bert_base_glue_seq128:k032,32,bert.encoder.layer.5.attention.self.av_context,mha_av_context,5,1536,128,64,12582912,48,4,2,384,96,98304,204800,48,9.600000000000001,3734.4,3763.36,0.7013561024610715,dptc_photonic_tile_schedule,generated canonical BERT-base encoder GEMM schedule,l1,L1 selector,0.7002314814814814,0.0,0.29976851851851843,0.7002314814814816,9.024444444444446,269,68836
20260513_tetc_pivot,bert_base_glue_seq128,bert_base,"GLUE validation, seq_len=128",bert_base_glue_seq128:k033,33,bert.encoder.layer.5.attention.output.dense,mha_output_projection,5,128,768,768,75497472,4,24,24,2304,96,98304,688128,288,57.6,3744.0,3885.7599999999998,0.6770367330186723,dptc_photonic_tile_schedule,generated canonical BERT-base encoder GEMM schedule,l1,L1 selector,0.7002314814814814,0.0,0.29976851851851843,0.7002314814814816,54.14666666666667,1613,68836
20260513_tetc_pivot,bert_base_glue_seq128,bert_base,"GLUE validation, seq_len=128",bert_base_glue_seq128:k034,34,bert.encoder.layer.5.intermediate.dense,ffn_expand,5,128,768,3072,301989888,4,24,96,9216,384,393216,2457600,1152,230.4,3801.6,4349.44,0.6724086661002546,dptc_photonic_tile_schedule,generated canonical BERT-base encoder GEMM schedule,l1,L1 selector,0.7002314814814814,0.0,0.29976851851851843,0.7002314814814816,216.58666666666667,6453,275342
20260513_tetc_pivot,bert_base_glue_seq128,bert_base,"GLUE validation, seq_len=128",bert_base_glue_seq128:k035,35,bert.encoder.layer.5.output.dense,ffn_project,5,128,3072,768,301989888,4,96,24,9216,96,98304,2752512,1152,230.4,4032.0,4579.839999999999,0.6724086661002542,dptc_photonic_tile_schedule,generated canonical BERT-base encoder GEMM schedule,l1,L1 selector,0.7002314814814814,0.0,0.29976851851851843,0.7002314814814816,216.58666666666667,6453,68836
20260513_tetc_pivot,bert_base_glue_seq128,bert_base,"GLUE validation, seq_len=128",bert_base_glue_seq128:k036,36,bert.encoder.layer.6.attention.self.qkv,mha_qkv_projection,6,128,768,2304,226492416,4,24,72,6912,288,294912,1867776,864,172.8,4262.4,4674.88,0.7047570350518385,dptc_photonic_tile_schedule,generated canonical BERT-base encoder GEMM schedule,l1,L1 selector,0.7002314814814814,0.0,0.29976851851851843,0.7002314814814816,162.44000000000003,4840,206507
20260513_tetc_pivot,bert_base_glue_seq128,bert_base,"GLUE validation, seq_len=128",bert_base_glue_seq128:k037,37,bert.encoder.layer.6.attention.self.qk_scores,mha_qk_scores,6,1536,64,128,12582912,48,2,4,384,192,196608,106496,48,9.600000000000001,4435.2,4464.16,0.7331742842792534,dptc_photonic_tile_schedule,generated canonical BERT-base encoder GEMM schedule,l1,L1 selector,0.7002314814814814,0.0,0.29976851851851843,0.7002314814814816,9.024444444444446,269,137671
20260513_tetc_pivot,bert_base_glue_seq128,bert_base,"GLUE validation, seq_len=128",bert_base_glue_seq128:k038,38,bert.encoder.layer.6.attention.self.av_context,mha_av_context,6,1536,128,64,12582912,48,4,2,384,96,98304,204800,48,9.600000000000001,4444.8,4473.76,0.7331742842792534,dptc_photonic_tile_schedule,generated canonical BERT-base encoder GEMM schedule,l1,L1 selector,0.7002314814814814,0.0,0.29976851851851843,0.7002314814814816,9.024444444444446,269,68836
20260513_tetc_pivot,bert_base_glue_seq128,bert_base,"GLUE validation, seq_len=128",bert_base_glue_seq128:k039,39,bert.encoder.layer.6.attention.output.dense,mha_output_projection,6,128,768,768,75497472,4,24,24,2304,96,98304,688128,288,57.6,4454.400000000001,4596.160000000001,0.7088549148368563,dptc_photonic_tile_schedule,generated canonical BERT-base encoder GEMM schedule,l1,L1 selector,0.7002314814814814,0.0,0.29976851851851843,0.7002314814814816,54.14666666666667,1613,68836
20260513_tetc_pivot,bert_base_glue_seq128,bert_base,"GLUE validation, seq_len=128",bert_base_glue_seq128:k040,40,bert.encoder.layer.6.intermediate.dense,ffn_expand,6,128,768,3072,301989888,4,24,96,9216,384,393216,2457600,1152,230.4,4512.000000000001,5059.84,0.704226847918436,dptc_photonic_tile_schedule,generated canonical BERT-base encoder GEMM schedule,l1,L1 selector,0.7002314814814814,0.0,0.29976851851851843,0.7002314814814816,216.58666666666667,6453,275342
20260513_tetc_pivot,bert_base_glue_seq128,bert_base,"GLUE validation, seq_len=128",bert_base_glue_seq128:k041,41,bert.encoder.layer.6.output.dense,ffn_project,6,128,3072,768,301989888,4,96,24,9216,96,98304,2752512,1152,230.4,4742.400000000001,5290.24,0.704226847918436,dptc_photonic_tile_schedule,generated canonical BERT-base encoder GEMM schedule,l1,L1 selector,0.7002314814814814,0.0,0.29976851851851843,0.7002314814814816,216.58666666666667,6453,68836
20260513_tetc_pivot,bert_base_glue_seq128,bert_base,"GLUE validation, seq_len=128",bert_base_glue_seq128:k042,42,bert.encoder.layer.7.attention.self.qkv,mha_qkv_projection,7,128,768,2304,226492416,4,24,72,6912,288,294912,1867776,864,172.8,4972.8,5385.280000000001,0.7365752168700204,dptc_photonic_tile_schedule,generated canonical BERT-base encoder GEMM schedule,l1,L1 selector,0.7002314814814814,0.0,0.29976851851851843,0.7002314814814816,162.44000000000003,4840,206507
20260513_tetc_pivot,bert_base_glue_seq128,bert_base,"GLUE validation, seq_len=128",bert_base_glue_seq128:k043,43,bert.encoder.layer.7.attention.self.qk_scores,mha_qk_scores,7,1536,64,128,12582912,48,2,4,384,192,196608,106496,48,9.600000000000001,5145.6,5174.56,0.7649924660974352,dptc_photonic_tile_schedule,generated canonical BERT-base encoder GEMM schedule,l1,L1 selector,0.7002314814814814,0.0,0.29976851851851843,0.7002314814814816,9.024444444444446,269,137671
20260513_tetc_pivot,bert_base_glue_seq128,bert_base,"GLUE validation, seq_len=128",bert_base_glue_seq128:k044,44,bert.encoder.layer.7.attention.self.av_context,mha_av_context,7,1536,128,64,12582912,48,4,2,384,96,98304,204800,48,9.600000000000001,5155.200000000001,5184.160000000001,0.7649924660974352,dptc_photonic_tile_schedule,generated canonical BERT-base encoder GEMM schedule,l1,L1 selector,0.7002314814814814,0.0,0.29976851851851843,0.7002314814814816,9.024444444444446,269,68836
20260513_tetc_pivot,bert_base_glue_seq128,bert_base,"GLUE validation, seq_len=128",bert_base_glue_seq128:k045,45,bert.encoder.layer.7.attention.output.dense,mha_output_projection,7,128,768,768,75497472,4,24,24,2304,96,98304,688128,288,57.6,5164.800000000001,5306.560000000001,0.7406730966550381,dptc_photonic_tile_schedule,generated canonical BERT-base encoder GEMM schedule,l1,L1 selector,0.7002314814814814,0.0,0.29976851851851843,0.7002314814814816,54.14666666666667,1613,68836
20260513_tetc_pivot,bert_base_glue_seq128,bert_base,"GLUE validation, seq_len=128",bert_base_glue_seq128:k046,46,bert.encoder.layer.7.intermediate.dense,ffn_expand,7,128,768,3072,301989888,4,24,96,9216,384,393216,2457600,1152,230.4,5222.4000000000015,5770.240000000001,0.7360450297366179,dptc_photonic_tile_schedule,generated canonical BERT-base encoder GEMM schedule,l1,L1 selector,0.7002314814814814,0.0,0.29976851851851843,0.7002314814814816,216.58666666666667,6453,275342
20260513_tetc_pivot,bert_base_glue_seq128,bert_base,"GLUE validation, seq_len=128",bert_base_glue_seq128:k047,47,bert.encoder.layer.7.output.dense,ffn_project,7,128,3072,768,301989888,4,96,24,9216,96,98304,2752512,1152,230.4,5452.800000000001,6000.64,0.7360450297366179,dptc_photonic_tile_schedule,generated canonical BERT-base encoder GEMM schedule,l1,L1 selector,0.7002314814814814,0.0,0.29976851851851843,0.7002314814814816,216.58666666666667,6453,68836
20260513_tetc_pivot,bert_base_glue_seq128,bert_base,"GLUE validation, seq_len=128",bert_base_glue_seq128:k048,48,bert.encoder.layer.8.attention.self.qkv,mha_qkv_projection,8,128,768,2304,226492416,4,24,72,6912,288,294912,1867776,864,172.8,5683.200000000001,6095.680000000001,0.7683933986882021,dptc_photonic_tile_schedule,generated canonical BERT-base encoder GEMM schedule,l1,L1 selector,0.7002314814814814,0.0,0.29976851851851843,0.7002314814814816,162.44000000000003,4840,206507
20260513_tetc_pivot,bert_base_glue_seq128,bert_base,"GLUE validation, seq_len=128",bert_base_glue_seq128:k049,49,bert.encoder.layer.8.attention.self.qk_scores,mha_qk_scores,8,1536,64,128,12582912,48,2,4,384,192,196608,106496,48,9.600000000000001,5856.000000000001,5884.960000000001,0.796810647915617,dptc_photonic_tile_schedule,generated canonical BERT-base encoder GEMM schedule,l1,L1 selector,0.7002314814814814,0.0,0.29976851851851843,0.7002314814814816,9.024444444444446,269,137671
20260513_tetc_pivot,bert_base_glue_seq128,bert_base,"GLUE validation, seq_len=128",bert_base_glue_seq128:k050,50,bert.encoder.layer.8.attention.self.av_context,mha_av_context,8,1536,128,64,12582912,48,4,2,384,96,98304,204800,48,9.600000000000001,5865.600000000001,5894.560000000001,0.796810647915617,dptc_photonic_tile_schedule,generated canonical BERT-base encoder GEMM schedule,l1,L1 selector,0.7002314814814814,0.0,0.29976851851851843,0.7002314814814816,9.024444444444446,269,68836
20260513_tetc_pivot,bert_base_glue_seq128,bert_base,"GLUE validation, seq_len=128",bert_base_glue_seq128:k051,51,bert.encoder.layer.8.attention.output.dense,mha_output_projection,8,128,768,768,75497472,4,24,24,2304,96,98304,688128,288,57.6,5875.200000000002,6016.960000000002,0.7724912784732199,dptc_photonic_tile_schedule,generated canonical BERT-base encoder GEMM schedule,l1,L1 selector,0.7002314814814814,0.0,0.29976851851851843,0.7002314814814816,54.14666666666667,1613,68836
20260513_tetc_pivot,bert_base_glue_seq128,bert_base,"GLUE validation, seq_len=128",bert_base_glue_seq128:k052,52,bert.encoder.layer.8.intermediate.dense,ffn_expand,8,128,768,3072,301989888,4,24,96,9216,384,393216,2457600,1152,230.4,5932.800000000002,6480.640000000001,0.7678632115547996,dptc_photonic_tile_schedule,generated canonical BERT-base encoder GEMM schedule,l1,L1 selector,0.7002314814814814,0.0,0.29976851851851843,0.7002314814814816,216.58666666666667,6453,275342
20260513_tetc_pivot,bert_base_glue_seq128,bert_base,"GLUE validation, seq_len=128",bert_base_glue_seq128:k053,53,bert.encoder.layer.8.output.dense,ffn_project,8,128,3072,768,301989888,4,96,24,9216,96,98304,2752512,1152,230.4,6163.200000000002,6711.040000000001,0.7678632115547996,dptc_photonic_tile_schedule,generated canonical BERT-base encoder GEMM schedule,l1,L1 selector,0.7002314814814814,0.0,0.29976851851851843,0.7002314814814816,216.58666666666667,6453,68836
20260513_tetc_pivot,bert_base_glue_seq128,bert_base,"GLUE validation, seq_len=128",bert_base_glue_seq128:k054,54,bert.encoder.layer.9.attention.self.qkv,mha_qkv_projection,9,128,768,2304,226492416,4,24,72,6912,288,294912,1867776,864,172.8,6393.600000000001,6806.080000000002,0.800211580506384,dptc_photonic_tile_schedule,generated canonical BERT-base encoder GEMM schedule,l1,L1 selector,0.7002314814814814,0.0,0.29976851851851843,0.7002314814814816,162.44000000000003,4840,206507
20260513_tetc_pivot,bert_base_glue_seq128,bert_base,"GLUE validation, seq_len=128",bert_base_glue_seq128:k055,55,bert.encoder.layer.9.attention.self.qk_scores,mha_qk_scores,9,1536,64,128,12582912,48,2,4,384,192,196608,106496,48,9.600000000000001,6566.4000000000015,6595.3600000000015,0.8286288297337988,dptc_photonic_tile_schedule,generated canonical BERT-base encoder GEMM schedule,l1,L1 selector,0.7002314814814814,0.0,0.29976851851851843,0.7002314814814816,9.024444444444446,269,137671
20260513_tetc_pivot,bert_base_glue_seq128,bert_base,"GLUE validation, seq_len=128",bert_base_glue_seq128:k056,56,bert.encoder.layer.9.attention.self.av_context,mha_av_context,9,1536,128,64,12582912,48,4,2,384,96,98304,204800,48,9.600000000000001,6576.000000000002,6604.960000000002,0.8286288297337988,dptc_photonic_tile_schedule,generated canonical BERT-base encoder GEMM schedule,l1,L1 selector,0.7002314814814814,0.0,0.29976851851851843,0.7002314814814816,9.024444444444446,269,68836
20260513_tetc_pivot,bert_base_glue_seq128,bert_base,"GLUE validation, seq_len=128",bert_base_glue_seq128:k057,57,bert.encoder.layer.9.attention.output.dense,mha_output_projection,9,128,768,768,75497472,4,24,24,2304,96,98304,688128,288,57.6,6585.600000000002,6727.360000000002,0.8043094602914017,dptc_photonic_tile_schedule,generated canonical BERT-base encoder GEMM schedule,l1,L1 selector,0.7002314814814814,0.0,0.29976851851851843,0.7002314814814816,54.14666666666667,1613,68836
20260513_tetc_pivot,bert_base_glue_seq128,bert_base,"GLUE validation, seq_len=128",bert_base_glue_seq128:k058,58,bert.encoder.layer.9.intermediate.dense,ffn_expand,9,128,768,3072,301989888,4,24,96,9216,384,393216,2457600,1152,230.4,6643.200000000003,7191.040000000002,0.7996813933729815,dptc_photonic_tile_schedule,generated canonical BERT-base encoder GEMM schedule,l1,L1 selector,0.7002314814814814,0.0,0.29976851851851843,0.7002314814814816,216.58666666666667,6453,275342
20260513_tetc_pivot,bert_base_glue_seq128,bert_base,"GLUE validation, seq_len=128",bert_base_glue_seq128:k059,59,bert.encoder.layer.9.output.dense,ffn_project,9,128,3072,768,301989888,4,96,24,9216,96,98304,2752512,1152,230.4,6873.600000000002,7421.440000000001,0.7996813933729815,dptc_photonic_tile_schedule,generated canonical BERT-base encoder GEMM schedule,l1,L1 selector,0.7002314814814814,0.0,0.29976851851851843,0.7002314814814816,216.58666666666667,6453,68836
20260513_tetc_pivot,bert_base_glue_seq128,bert_base,"GLUE validation, seq_len=128",bert_base_glue_seq128:k060,60,bert.encoder.layer.10.attention.self.qkv,mha_qkv_projection,10,128,768,2304,226492416,4,24,72,6912,288,294912,1867776,864,172.8,7104.000000000002,7516.480000000002,0.8320297623245658,dptc_photonic_tile_schedule,generated canonical BERT-base encoder GEMM schedule,l1,L1 selector,0.7002314814814814,0.0,0.29976851851851843,0.7002314814814816,162.44000000000003,4840,206507
20260513_tetc_pivot,bert_base_glue_seq128,bert_base,"GLUE validation, seq_len=128",bert_base_glue_seq128:k061,61,bert.encoder.layer.10.attention.self.qk_scores,mha_qk_scores,10,1536,64,128,12582912,48,2,4,384,192,196608,106496,48,9.600000000000001,7276.800000000002,7305.760000000002,0.8604470115519807,dptc_photonic_tile_schedule,generated canonical BERT-base encoder GEMM schedule,l1,L1 selector,0.7002314814814814,0.0,0.29976851851851843,0.7002314814814816,9.024444444444446,269,137671
20260513_tetc_pivot,bert_base_glue_seq128,bert_base,"GLUE validation, seq_len=128",bert_base_glue_seq128:k062,62,bert.encoder.layer.10.attention.self.av_context,mha_av_context,10,1536,128,64,12582912,48,4,2,384,96,98304,204800,48,9.600000000000001,7286.400000000002,7315.360000000002,0.8604470115519807,dptc_photonic_tile_schedule,generated canonical BERT-base encoder GEMM schedule,l1,L1 selector,0.7002314814814814,0.0,0.29976851851851843,0.7002314814814816,9.024444444444446,269,68836
20260513_tetc_pivot,bert_base_glue_seq128,bert_base,"GLUE validation, seq_len=128",bert_base_glue_seq128:k063,63,bert.encoder.layer.10.attention.output.dense,mha_output_projection,10,128,768,768,75497472,4,24,24,2304,96,98304,688128,288,57.6,7296.000000000003,7437.760000000003,0.8361276421095836,dptc_photonic_tile_schedule,generated canonical BERT-base encoder GEMM schedule,l1,L1 selector,0.7002314814814814,0.0,0.29976851851851843,0.7002314814814816,54.14666666666667,1613,68836
20260513_tetc_pivot,bert_base_glue_seq128,bert_base,"GLUE validation, seq_len=128",bert_base_glue_seq128:k064,64,bert.encoder.layer.10.intermediate.dense,ffn_expand,10,128,768,3072,301989888,4,24,96,9216,384,393216,2457600,1152,230.4,7353.600000000003,7901.440000000002,0.8314995751911634,dptc_photonic_tile_schedule,generated canonical BERT-base encoder GEMM schedule,l1,L1 selector,0.7002314814814814,0.0,0.29976851851851843,0.7002314814814816,216.58666666666667,6453,275342
20260513_tetc_pivot,bert_base_glue_seq128,bert_base,"GLUE validation, seq_len=128",bert_base_glue_seq128:k065,65,bert.encoder.layer.10.output.dense,ffn_project,10,128,3072,768,301989888,4,96,24,9216,96,98304,2752512,1152,230.4,7584.000000000003,8131.840000000002,0.8314995751911634,dptc_photonic_tile_schedule,generated canonical BERT-base encoder GEMM schedule,l1,L1 selector,0.7002314814814814,0.0,0.29976851851851843,0.7002314814814816,216.58666666666667,6453,68836
20260513_tetc_pivot,bert_base_glue_seq128,bert_base,"GLUE validation, seq_len=128",bert_base_glue_seq128:k066,66,bert.encoder.layer.11.attention.self.qkv,mha_qkv_projection,11,128,768,2304,226492416,4,24,72,6912,288,294912,1867776,864,172.8,7814.400000000002,8226.880000000003,0.8638479441427476,dptc_photonic_tile_schedule,generated canonical BERT-base encoder GEMM schedule,l1,L1 selector,0.7002314814814814,0.0,0.29976851851851843,0.7002314814814816,162.44000000000003,4840,206507
20260513_tetc_pivot,bert_base_glue_seq128,bert_base,"GLUE validation, seq_len=128",bert_base_glue_seq128:k067,67,bert.encoder.layer.11.attention.self.qk_scores,mha_qk_scores,11,1536,64,128,12582912,48,2,4,384,192,196608,106496,48,9.600000000000001,7987.200000000003,8016.160000000003,0.8922651933701624,dptc_photonic_tile_schedule,generated canonical BERT-base encoder GEMM schedule,l1,L1 selector,0.7002314814814814,0.0,0.29976851851851843,0.7002314814814816,9.024444444444446,269,137671
20260513_tetc_pivot,bert_base_glue_seq128,bert_base,"GLUE validation, seq_len=128",bert_base_glue_seq128:k068,68,bert.encoder.layer.11.attention.self.av_context,mha_av_context,11,1536,128,64,12582912,48,4,2,384,96,98304,204800,48,9.600000000000001,7996.800000000003,8025.760000000003,0.8922651933701624,dptc_photonic_tile_schedule,generated canonical BERT-base encoder GEMM schedule,l1,L1 selector,0.7002314814814814,0.0,0.29976851851851843,0.7002314814814816,9.024444444444446,269,68836
20260513_tetc_pivot,bert_base_glue_seq128,bert_base,"GLUE validation, seq_len=128",bert_base_glue_seq128:k069,69,bert.encoder.layer.11.attention.output.dense,mha_output_projection,11,128,768,768,75497472,4,24,24,2304,96,98304,688128,288,57.6,8006.400000000003,8148.1600000000035,0.8679458239277653,dptc_photonic_tile_schedule,generated canonical BERT-base encoder GEMM schedule,l1,L1 selector,0.7002314814814814,0.0,0.29976851851851843,0.7002314814814816,54.14666666666667,1613,68836
20260513_tetc_pivot,bert_base_glue_seq128,bert_base,"GLUE validation, seq_len=128",bert_base_glue_seq128:k070,70,bert.encoder.layer.11.intermediate.dense,ffn_expand,11,128,768,3072,301989888,4,24,96,9216,384,393216,2457600,1152,230.4,8064.000000000004,8611.840000000004,0.8633177570093462,dptc_photonic_tile_schedule,generated canonical BERT-base encoder GEMM schedule,l1,L1 selector,0.7002314814814814,0.0,0.29976851851851843,0.7002314814814816,216.58666666666667,6453,275342
20260513_tetc_pivot,bert_base_glue_seq128,bert_base,"GLUE validation, seq_len=128",bert_base_glue_seq128:k071,71,bert.encoder.layer.11.output.dense,ffn_project,11,128,3072,768,301989888,4,96,24,9216,96,98304,2752512,1152,230.4,8294.400000000003,8842.240000000003,0.8633177570093451,dptc_photonic_tile_schedule,generated canonical BERT-base encoder GEMM schedule,l1,L1 selector,0.7002314814814814,0.0,0.29976851851851843,0.7002314814814816,216.58666666666667,6453,68836
20260513_tetc_pivot,bert_base_glue_seq128,bert_base,"GLUE validation, seq_len=128",bert_base_glue_seq128:k000,0,bert.encoder.layer.0.attention.self.qkv,mha_qkv_projection,0,128,768,2304,226492416,4,24,72,6912,288,294912,1867776,864,172.8,0.0,412.48,0.5138479441427464,dptc_photonic_tile_schedule,generated canonical BERT-base encoder GEMM schedule,slack_only,Slack-only selector,0.7002314814814814,0.0,0.29976851851851843,0.7002314814814816,162.44000000000003,4840,206507
20260513_tetc_pivot,bert_base_glue_seq128,bert_base,"GLUE validation, seq_len=128",bert_base_glue_seq128:k001,1,bert.encoder.layer.0.attention.self.qk_scores,mha_qk_scores,0,1536,64,128,12582912,48,2,4,384,192,196608,106496,48,9.600000000000001,172.8,201.76000000000002,0.5422651933701657,dptc_photonic_tile_schedule,generated canonical BERT-base encoder GEMM schedule,slack_only,Slack-only selector,0.7002314814814814,0.0,0.29976851851851843,0.7002314814814816,9.024444444444446,269,137671
20260513_tetc_pivot,bert_base_glue_seq128,bert_base,"GLUE validation, seq_len=128",bert_base_glue_seq128:k002,2,bert.encoder.layer.0.attention.self.av_context,mha_av_context,0,1536,128,64,12582912,48,4,2,384,96,98304,204800,48,9.600000000000001,182.4,211.36,0.5422651933701657,dptc_photonic_tile_schedule,generated canonical BERT-base encoder GEMM schedule,slack_only,Slack-only selector,0.7002314814814814,0.0,0.29976851851851843,0.7002314814814816,9.024444444444446,269,68836
20260513_tetc_pivot,bert_base_glue_seq128,bert_base,"GLUE validation, seq_len=128",bert_base_glue_seq128:k003,3,bert.encoder.layer.0.attention.output.dense,mha_output_projection,0,128,768,768,75497472,4,24,24,2304,96,98304,688128,288,57.6,192.0,333.76,0.517945823927765,dptc_photonic_tile_schedule,generated canonical BERT-base encoder GEMM schedule,slack_only,Slack-only selector,0.7002314814814814,0.0,0.29976851851851843,0.7002314814814816,54.14666666666667,1613,68836
20260513_tetc_pivot,bert_base_glue_seq128,bert_base,"GLUE validation, seq_len=128",bert_base_glue_seq128:k004,4,bert.encoder.layer.0.intermediate.dense,ffn_expand,0,128,768,3072,301989888,4,24,96,9216,384,393216,2457600,1152,230.4,249.6,797.44,0.5133177570093458,dptc_photonic_tile_schedule,generated canonical BERT-base encoder GEMM schedule,slack_only,Slack-only selector,0.7002314814814814,0.0,0.29976851851851843,0.7002314814814816,216.58666666666667,6453,275342
20260513_tetc_pivot,bert_base_glue_seq128,bert_base,"GLUE validation, seq_len=128",bert_base_glue_seq128:k005,5,bert.encoder.layer.0.output.dense,ffn_project,0,128,3072,768,301989888,4,96,24,9216,96,98304,2752512,1152,230.4,480.0,1027.84,0.5133177570093456,dptc_photonic_tile_schedule,generated canonical BERT-base encoder GEMM schedule,slack_only,Slack-only selector,0.7002314814814814,0.0,0.29976851851851843,0.7002314814814816,216.58666666666667,6453,68836
20260513_tetc_pivot,bert_base_glue_seq128,bert_base,"GLUE validation, seq_len=128",bert_base_glue_seq128:k006,6,bert.encoder.layer.1.attention.self.qkv,mha_qkv_projection,1,128,768,2304,226492416,4,24,72,6912,288,294912,1867776,864,172.8,710.4,1122.88,0.5456661259609283,dptc_photonic_tile_schedule,generated canonical BERT-base encoder GEMM schedule,slack_only,Slack-only selector,0.7002314814814814,0.0,0.29976851851851843,0.7002314814814816,162.44000000000003,4840,206507
20260513_tetc_pivot,bert_base_glue_seq128,bert_base,"GLUE validation, seq_len=128",bert_base_glue_seq128:k007,7,bert.encoder.layer.1.attention.self.qk_scores,mha_qk_scores,1,1536,64,128,12582912,48,2,4,384,192,196608,106496,48,9.600000000000001,883.2,912.1600000000001,0.5740833751883494,dptc_photonic_tile_schedule,generated canonical BERT-base encoder GEMM schedule,slack_only,Slack-only selector,0.7002314814814814,0.0,0.29976851851851843,0.7002314814814816,9.024444444444446,269,137671
20260513_tetc_pivot,bert_base_glue_seq128,bert_base,"GLUE validation, seq_len=128",bert_base_glue_seq128:k008,8,bert.encoder.layer.1.attention.self.av_context,mha_av_context,1,1536,128,64,12582912,48,4,2,384,96,98304,204800,48,9.600000000000001,892.8000000000001,921.7600000000001,0.5740833751883494,dptc_photonic_tile_schedule,generated canonical BERT-base encoder GEMM schedule,slack_only,Slack-only selector,0.7002314814814814,0.0,0.29976851851851843,0.7002314814814816,9.024444444444446,269,68836
20260513_tetc_pivot,bert_base_glue_seq128,bert_base,"GLUE validation, seq_len=128",bert_base_glue_seq128:k009,9,bert.encoder.layer.1.attention.output.dense,mha_output_projection,1,128,768,768,75497472,4,24,24,2304,96,98304,688128,288,57.6,902.4000000000001,1044.16,0.5497640057459472,dptc_photonic_tile_schedule,generated canonical BERT-base encoder GEMM schedule,slack_only,Slack-only selector,0.7002314814814814,0.0,0.29976851851851843,0.7002314814814816,54.14666666666667,1613,68836
20260513_tetc_pivot,bert_base_glue_seq128,bert_base,"GLUE validation, seq_len=128",bert_base_glue_seq128:k010,10,bert.encoder.layer.1.intermediate.dense,ffn_expand,1,128,768,3072,301989888,4,24,96,9216,384,393216,2457600,1152,230.4,960.0000000000001,1507.8400000000001,0.5451359388275278,dptc_photonic_tile_schedule,generated canonical BERT-base encoder GEMM schedule,slack_only,Slack-only selector,0.7002314814814814,0.0,0.29976851851851843,0.7002314814814816,216.58666666666667,6453,275342
20260513_tetc_pivot,bert_base_glue_seq128,bert_base,"GLUE validation, seq_len=128",bert_base_glue_seq128:k011,11,bert.encoder.layer.1.output.dense,ffn_project,1,128,3072,768,301989888,4,96,24,9216,96,98304,2752512,1152,230.4,1190.4,1738.2400000000002,0.5451359388275278,dptc_photonic_tile_schedule,generated canonical BERT-base encoder GEMM schedule,slack_only,Slack-only selector,0.7002314814814814,0.0,0.29976851851851843,0.7002314814814816,216.58666666666667,6453,68836
20260513_tetc_pivot,bert_base_glue_seq128,bert_base,"GLUE validation, seq_len=128",bert_base_glue_seq128:k012,12,bert.encoder.layer.2.attention.self.qkv,mha_qkv_projection,2,128,768,2304,226492416,4,24,72,6912,288,294912,1867776,864,172.8,1420.8000000000002,1833.2800000000002,0.5774843077791098,dptc_photonic_tile_schedule,generated canonical BERT-base encoder GEMM schedule,slack_only,Slack-only selector,0.7002314814814814,0.0,0.29976851851851843,0.7002314814814816,162.44000000000003,4840,206507
20260513_tetc_pivot,bert_base_glue_seq128,bert_base,"GLUE validation, seq_len=128",bert_base_glue_seq128:k013,13,bert.encoder.layer.2.attention.self.qk_scores,mha_qk_scores,2,1536,64,128,12582912,48,2,4,384,192,196608,106496,48,9.600000000000001,1593.6000000000001,1622.56,0.605901557006526,dptc_photonic_tile_schedule,generated canonical BERT-base encoder GEMM schedule,slack_only,Slack-only selector,0.7002314814814814,0.0,0.29976851851851843,0.7002314814814816,9.024444444444446,269,137671
20260513_tetc_pivot,bert_base_glue_seq128,bert_base,"GLUE validation, seq_len=128",bert_base_glue_seq128:k014,14,bert.encoder.layer.2.attention.self.av_context,mha_av_context,2,1536,128,64,12582912,48,4,2,384,96,98304,204800,48,9.600000000000001,1603.2,1632.1599999999999,0.605901557006526,dptc_photonic_tile_schedule,generated canonical BERT-base encoder GEMM schedule,slack_only,Slack-only selector,0.7002314814814814,0.0,0.29976851851851843,0.7002314814814816,9.024444444444446,269,68836
20260513_tetc_pivot,bert_base_glue_seq128,bert_base,"GLUE validation, seq_len=128",bert_base_glue_seq128:k015,15,bert.encoder.layer.2.attention.output.dense,mha_output_projection,2,128,768,768,75497472,4,24,24,2304,96,98304,688128,288,57.6,1612.8,1754.56,0.5815821875641289,dptc_photonic_tile_schedule,generated canonical BERT-base encoder GEMM schedule,slack_only,Slack-only selector,0.7002314814814814,0.0,0.29976851851851843,0.7002314814814816,54.14666666666667,1613,68836
20260513_tetc_pivot,bert_base_glue_seq128,bert_base,"GLUE validation, seq_len=128",bert_base_glue_seq128:k016,16,bert.encoder.layer.2.intermediate.dense,ffn_expand,2,128,768,3072,301989888,4,24,96,9216,384,393216,2457600,1152,230.4,1670.3999999999999,2218.24,0.5769541206457092,dptc_photonic_tile_schedule,generated canonical BERT-base encoder GEMM schedule,slack_only,Slack-only selector,0.7002314814814814,0.0,0.29976851851851843,0.7002314814814816,216.58666666666667,6453,275342
20260513_tetc_pivot,bert_base_glue_seq128,bert_base,"GLUE validation, seq_len=128",bert_base_glue_seq128:k017,17,bert.encoder.layer.2.output.dense,ffn_project,2,128,3072,768,301989888,4,96,24,9216,96,98304,2752512,1152,230.4,1900.8,2448.64,0.5769541206457092,dptc_photonic_tile_schedule,generated canonical BERT-base encoder GEMM schedule,slack_only,Slack-only selector,0.7002314814814814,0.0,0.29976851851851843,0.7002314814814816,216.58666666666667,6453,68836
20260513_tetc_pivot,bert_base_glue_seq128,bert_base,"GLUE validation, seq_len=128",bert_base_glue_seq128:k018,18,bert.encoder.layer.3.attention.self.qkv,mha_qkv_projection,3,128,768,2304,226492416,4,24,72,6912,288,294912,1867776,864,172.8,2131.2,2543.68,0.6093024895972916,dptc_photonic_tile_schedule,generated canonical BERT-base encoder GEMM schedule,slack_only,Slack-only selector,0.7002314814814814,0.0,0.29976851851851843,0.7002314814814816,162.44000000000003,4840,206507
20260513_tetc_pivot,bert_base_glue_seq128,bert_base,"GLUE validation, seq_len=128",bert_base_glue_seq128:k019,19,bert.encoder.layer.3.attention.self.qk_scores,mha_qk_scores,3,1536,64,128,12582912,48,2,4,384,192,196608,106496,48,9.600000000000001,2304.0,2332.96,0.6377197388247079,dptc_photonic_tile_schedule,generated canonical BERT-base encoder GEMM schedule,slack_only,Slack-only selector,0.7002314814814814,0.0,0.29976851851851843,0.7002314814814816,9.024444444444446,269,137671
20260513_tetc_pivot,bert_base_glue_seq128,bert_base,"GLUE validation, seq_len=128",bert_base_glue_seq128:k020,20,bert.encoder.layer.3.attention.self.av_context,mha_av_context,3,1536,128,64,12582912,48,4,2,384,96,98304,204800,48,9.600000000000001,2313.6,2342.56,0.6377197388247079,dptc_photonic_tile_schedule,generated canonical BERT-base encoder GEMM schedule,slack_only,Slack-only selector,0.7002314814814814,0.0,0.29976851851851843,0.7002314814814816,9.024444444444446,269,68836
20260513_tetc_pivot,bert_base_glue_seq128,bert_base,"GLUE validation, seq_len=128",bert_base_glue_seq128:k021,21,bert.encoder.layer.3.attention.output.dense,mha_output_projection,3,128,768,768,75497472,4,24,24,2304,96,98304,688128,288,57.6,2323.2,2464.9599999999996,0.6134003693823087,dptc_photonic_tile_schedule,generated canonical BERT-base encoder GEMM schedule,slack_only,Slack-only selector,0.7002314814814814,0.0,0.29976851851851843,0.7002314814814816,54.14666666666667,1613,68836
20260513_tetc_pivot,bert_base_glue_seq128,bert_base,"GLUE validation, seq_len=128",bert_base_glue_seq128:k022,22,bert.encoder.layer.3.intermediate.dense,ffn_expand,3,128,768,3072,301989888,4,24,96,9216,384,393216,2457600,1152,230.4,2380.7999999999997,2928.64,0.6087723024638917,dptc_photonic_tile_schedule,generated canonical BERT-base encoder GEMM schedule,slack_only,Slack-only selector,0.7002314814814814,0.0,0.29976851851851843,0.7002314814814816,216.58666666666667,6453,275342
20260513_tetc_pivot,bert_base_glue_seq128,bert_base,"GLUE validation, seq_len=128",bert_base_glue_seq128:k023,23,bert.encoder.layer.3.output.dense,ffn_project,3,128,3072,768,301989888,4,96,24,9216,96,98304,2752512,1152,230.4,2611.2,3159.04,0.6087723024638917,dptc_photonic_tile_schedule,generated canonical BERT-base encoder GEMM schedule,slack_only,Slack-only selector,0.7002314814814814,0.0,0.29976851851851843,0.7002314814814816,216.58666666666667,6453,68836
20260513_tetc_pivot,bert_base_glue_seq128,bert_base,"GLUE validation, seq_len=128",bert_base_glue_seq128:k024,24,bert.encoder.layer.4.attention.self.qkv,mha_qkv_projection,4,128,768,2304,226492416,4,24,72,6912,288,294912,1867776,864,172.8,2841.6,3254.08,0.6411206714154734,dptc_photonic_tile_schedule,generated canonical BERT-base encoder GEMM schedule,slack_only,Slack-only selector,0.7002314814814814,0.0,0.29976851851851843,0.7002314814814816,162.44000000000003,4840,206507
20260513_tetc_pivot,bert_base_glue_seq128,bert_base,"GLUE validation, seq_len=128",bert_base_glue_seq128:k025,25,bert.encoder.layer.4.attention.self.qk_scores,mha_qk_scores,4,1536,64,128,12582912,48,2,4,384,192,196608,106496,48,9.600000000000001,3014.4,3043.36,0.6695379206428898,dptc_photonic_tile_schedule,generated canonical BERT-base encoder GEMM schedule,slack_only,Slack-only selector,0.7002314814814814,0.0,0.29976851851851843,0.7002314814814816,9.024444444444446,269,137671
20260513_tetc_pivot,bert_base_glue_seq128,bert_base,"GLUE validation, seq_len=128",bert_base_glue_seq128:k026,26,bert.encoder.layer.4.attention.self.av_context,mha_av_context,4,1536,128,64,12582912,48,4,2,384,96,98304,204800,48,9.600000000000001,3024.0,3052.96,0.6695379206428898,dptc_photonic_tile_schedule,generated canonical BERT-base encoder GEMM schedule,slack_only,Slack-only selector,0.7002314814814814,0.0,0.29976851851851843,0.7002314814814816,9.024444444444446,269,68836
20260513_tetc_pivot,bert_base_glue_seq128,bert_base,"GLUE validation, seq_len=128",bert_base_glue_seq128:k027,27,bert.encoder.layer.4.attention.output.dense,mha_output_projection,4,128,768,768,75497472,4,24,24,2304,96,98304,688128,288,57.6,3033.6,3175.3599999999997,0.6452185512004904,dptc_photonic_tile_schedule,generated canonical BERT-base encoder GEMM schedule,slack_only,Slack-only selector,0.7002314814814814,0.0,0.29976851851851843,0.7002314814814816,54.14666666666667,1613,68836
20260513_tetc_pivot,bert_base_glue_seq128,bert_base,"GLUE validation, seq_len=128",bert_base_glue_seq128:k028,28,bert.encoder.layer.4.intermediate.dense,ffn_expand,4,128,768,3072,301989888,4,24,96,9216,384,393216,2457600,1152,230.4,3091.2,3639.04,0.6405904842820735,dptc_photonic_tile_schedule,generated canonical BERT-base encoder GEMM schedule,slack_only,Slack-only selector,0.7002314814814814,0.0,0.29976851851851843,0.7002314814814816,216.58666666666667,6453,275342
20260513_tetc_pivot,bert_base_glue_seq128,bert_base,"GLUE validation, seq_len=128",bert_base_glue_seq128:k029,29,bert.encoder.layer.4.output.dense,ffn_project,4,128,3072,768,301989888,4,96,24,9216,96,98304,2752512,1152,230.4,3321.6,3869.44,0.6405904842820735,dptc_photonic_tile_schedule,generated canonical BERT-base encoder GEMM schedule,slack_only,Slack-only selector,0.7002314814814814,0.0,0.29976851851851843,0.7002314814814816,216.58666666666667,6453,68836
20260513_tetc_pivot,bert_base_glue_seq128,bert_base,"GLUE validation, seq_len=128",bert_base_glue_seq128:k030,30,bert.encoder.layer.5.attention.self.qkv,mha_qkv_projection,5,128,768,2304,226492416,4,24,72,6912,288,294912,1867776,864,172.8,3552.0,3964.48,0.6729388532336552,dptc_photonic_tile_schedule,generated canonical BERT-base encoder GEMM schedule,slack_only,Slack-only selector,0.7002314814814814,0.0,0.29976851851851843,0.7002314814814816,162.44000000000003,4840,206507
20260513_tetc_pivot,bert_base_glue_seq128,bert_base,"GLUE validation, seq_len=128",bert_base_glue_seq128:k031,31,bert.encoder.layer.5.attention.self.qk_scores,mha_qk_scores,5,1536,64,128,12582912,48,2,4,384,192,196608,106496,48,9.600000000000001,3724.8,3753.76,0.7013561024610715,dptc_photonic_tile_schedule,generated canonical BERT-base encoder GEMM schedule,slack_only,Slack-only selector,0.7002314814814814,0.0,0.29976851851851843,0.7002314814814816,9.024444444444446,269,137671
20260513_tetc_pivot,bert_base_glue_seq128,bert_base,"GLUE validation, seq_len=128",bert_base_glue_seq128:k032,32,bert.encoder.layer.5.attention.self.av_context,mha_av_context,5,1536,128,64,12582912,48,4,2,384,96,98304,204800,48,9.600000000000001,3734.4,3763.36,0.7013561024610715,dptc_photonic_tile_schedule,generated canonical BERT-base encoder GEMM schedule,slack_only,Slack-only selector,0.7002314814814814,0.0,0.29976851851851843,0.7002314814814816,9.024444444444446,269,68836
20260513_tetc_pivot,bert_base_glue_seq128,bert_base,"GLUE validation, seq_len=128",bert_base_glue_seq128:k033,33,bert.encoder.layer.5.attention.output.dense,mha_output_projection,5,128,768,768,75497472,4,24,24,2304,96,98304,688128,288,57.6,3744.0,3885.7599999999998,0.6770367330186723,dptc_photonic_tile_schedule,generated canonical BERT-base encoder GEMM schedule,slack_only,Slack-only selector,0.7002314814814814,0.0,0.29976851851851843,0.7002314814814816,54.14666666666667,1613,68836
20260513_tetc_pivot,bert_base_glue_seq128,bert_base,"GLUE validation, seq_len=128",bert_base_glue_seq128:k034,34,bert.encoder.layer.5.intermediate.dense,ffn_expand,5,128,768,3072,301989888,4,24,96,9216,384,393216,2457600,1152,230.4,3801.6,4349.44,0.6724086661002546,dptc_photonic_tile_schedule,generated canonical BERT-base encoder GEMM schedule,slack_only,Slack-only selector,0.7002314814814814,0.0,0.29976851851851843,0.7002314814814816,216.58666666666667,6453,275342
20260513_tetc_pivot,bert_base_glue_seq128,bert_base,"GLUE validation, seq_len=128",bert_base_glue_seq128:k035,35,bert.encoder.layer.5.output.dense,ffn_project,5,128,3072,768,301989888,4,96,24,9216,96,98304,2752512,1152,230.4,4032.0,4579.839999999999,0.6724086661002542,dptc_photonic_tile_schedule,generated canonical BERT-base encoder GEMM schedule,slack_only,Slack-only selector,0.7002314814814814,0.0,0.29976851851851843,0.7002314814814816,216.58666666666667,6453,68836
20260513_tetc_pivot,bert_base_glue_seq128,bert_base,"GLUE validation, seq_len=128",bert_base_glue_seq128:k036,36,bert.encoder.layer.6.attention.self.qkv,mha_qkv_projection,6,128,768,2304,226492416,4,24,72,6912,288,294912,1867776,864,172.8,4262.4,4674.88,0.7047570350518385,dptc_photonic_tile_schedule,generated canonical BERT-base encoder GEMM schedule,slack_only,Slack-only selector,0.7002314814814814,0.0,0.29976851851851843,0.7002314814814816,162.44000000000003,4840,206507
20260513_tetc_pivot,bert_base_glue_seq128,bert_base,"GLUE validation, seq_len=128",bert_base_glue_seq128:k037,37,bert.encoder.layer.6.attention.self.qk_scores,mha_qk_scores,6,1536,64,128,12582912,48,2,4,384,192,196608,106496,48,9.600000000000001,4435.2,4464.16,0.7331742842792534,dptc_photonic_tile_schedule,generated canonical BERT-base encoder GEMM schedule,slack_only,Slack-only selector,0.7002314814814814,0.0,0.29976851851851843,0.7002314814814816,9.024444444444446,269,137671
20260513_tetc_pivot,bert_base_glue_seq128,bert_base,"GLUE validation, seq_len=128",bert_base_glue_seq128:k038,38,bert.encoder.layer.6.attention.self.av_context,mha_av_context,6,1536,128,64,12582912,48,4,2,384,96,98304,204800,48,9.600000000000001,4444.8,4473.76,0.7331742842792534,dptc_photonic_tile_schedule,generated canonical BERT-base encoder GEMM schedule,slack_only,Slack-only selector,0.7002314814814814,0.0,0.29976851851851843,0.7002314814814816,9.024444444444446,269,68836
20260513_tetc_pivot,bert_base_glue_seq128,bert_base,"GLUE validation, seq_len=128",bert_base_glue_seq128:k039,39,bert.encoder.layer.6.attention.output.dense,mha_output_projection,6,128,768,768,75497472,4,24,24,2304,96,98304,688128,288,57.6,4454.400000000001,4596.160000000001,0.7088549148368563,dptc_photonic_tile_schedule,generated canonical BERT-base encoder GEMM schedule,slack_only,Slack-only selector,0.7002314814814814,0.0,0.29976851851851843,0.7002314814814816,54.14666666666667,1613,68836
20260513_tetc_pivot,bert_base_glue_seq128,bert_base,"GLUE validation, seq_len=128",bert_base_glue_seq128:k040,40,bert.encoder.layer.6.intermediate.dense,ffn_expand,6,128,768,3072,301989888,4,24,96,9216,384,393216,2457600,1152,230.4,4512.000000000001,5059.84,0.704226847918436,dptc_photonic_tile_schedule,generated canonical BERT-base encoder GEMM schedule,slack_only,Slack-only selector,0.7002314814814814,0.0,0.29976851851851843,0.7002314814814816,216.58666666666667,6453,275342
20260513_tetc_pivot,bert_base_glue_seq128,bert_base,"GLUE validation, seq_len=128",bert_base_glue_seq128:k041,41,bert.encoder.layer.6.output.dense,ffn_project,6,128,3072,768,301989888,4,96,24,9216,96,98304,2752512,1152,230.4,4742.400000000001,5290.24,0.704226847918436,dptc_photonic_tile_schedule,generated canonical BERT-base encoder GEMM schedule,slack_only,Slack-only selector,0.7002314814814814,0.0,0.29976851851851843,0.7002314814814816,216.58666666666667,6453,68836
20260513_tetc_pivot,bert_base_glue_seq128,bert_base,"GLUE validation, seq_len=128",bert_base_glue_seq128:k042,42,bert.encoder.layer.7.attention.self.qkv,mha_qkv_projection,7,128,768,2304,226492416,4,24,72,6912,288,294912,1867776,864,172.8,4972.8,5385.280000000001,0.7365752168700204,dptc_photonic_tile_schedule,generated canonical BERT-base encoder GEMM schedule,slack_only,Slack-only selector,0.7002314814814814,0.0,0.29976851851851843,0.7002314814814816,162.44000000000003,4840,206507
20260513_tetc_pivot,bert_base_glue_seq128,bert_base,"GLUE validation, seq_len=128",bert_base_glue_seq128:k043,43,bert.encoder.layer.7.attention.self.qk_scores,mha_qk_scores,7,1536,64,128,12582912,48,2,4,384,192,196608,106496,48,9.600000000000001,5145.6,5174.56,0.7649924660974352,dptc_photonic_tile_schedule,generated canonical BERT-base encoder GEMM schedule,slack_only,Slack-only selector,0.7002314814814814,0.0,0.29976851851851843,0.7002314814814816,9.024444444444446,269,137671
20260513_tetc_pivot,bert_base_glue_seq128,bert_base,"GLUE validation, seq_len=128",bert_base_glue_seq128:k044,44,bert.encoder.layer.7.attention.self.av_context,mha_av_context,7,1536,128,64,12582912,48,4,2,384,96,98304,204800,48,9.600000000000001,5155.200000000001,5184.160000000001,0.7649924660974352,dptc_photonic_tile_schedule,generated canonical BERT-base encoder GEMM schedule,slack_only,Slack-only selector,0.7002314814814814,0.0,0.29976851851851843,0.7002314814814816,9.024444444444446,269,68836
20260513_tetc_pivot,bert_base_glue_seq128,bert_base,"GLUE validation, seq_len=128",bert_base_glue_seq128:k045,45,bert.encoder.layer.7.attention.output.dense,mha_output_projection,7,128,768,768,75497472,4,24,24,2304,96,98304,688128,288,57.6,5164.800000000001,5306.560000000001,0.7406730966550381,dptc_photonic_tile_schedule,generated canonical BERT-base encoder GEMM schedule,slack_only,Slack-only selector,0.7002314814814814,0.0,0.29976851851851843,0.7002314814814816,54.14666666666667,1613,68836
20260513_tetc_pivot,bert_base_glue_seq128,bert_base,"GLUE validation, seq_len=128",bert_base_glue_seq128:k046,46,bert.encoder.layer.7.intermediate.dense,ffn_expand,7,128,768,3072,301989888,4,24,96,9216,384,393216,2457600,1152,230.4,5222.4000000000015,5770.240000000001,0.7360450297366179,dptc_photonic_tile_schedule,generated canonical BERT-base encoder GEMM schedule,slack_only,Slack-only selector,0.7002314814814814,0.0,0.29976851851851843,0.7002314814814816,216.58666666666667,6453,275342
20260513_tetc_pivot,bert_base_glue_seq128,bert_base,"GLUE validation, seq_len=128",bert_base_glue_seq128:k047,47,bert.encoder.layer.7.output.dense,ffn_project,7,128,3072,768,301989888,4,96,24,9216,96,98304,2752512,1152,230.4,5452.800000000001,6000.64,0.7360450297366179,dptc_photonic_tile_schedule,generated canonical BERT-base encoder GEMM schedule,slack_only,Slack-only selector,0.7002314814814814,0.0,0.29976851851851843,0.7002314814814816,216.58666666666667,6453,68836
20260513_tetc_pivot,bert_base_glue_seq128,bert_base,"GLUE validation, seq_len=128",bert_base_glue_seq128:k048,48,bert.encoder.layer.8.attention.self.qkv,mha_qkv_projection,8,128,768,2304,226492416,4,24,72,6912,288,294912,1867776,864,172.8,5683.200000000001,6095.680000000001,0.7683933986882021,dptc_photonic_tile_schedule,generated canonical BERT-base encoder GEMM schedule,slack_only,Slack-only selector,0.7002314814814814,0.0,0.29976851851851843,0.7002314814814816,162.44000000000003,4840,206507
20260513_tetc_pivot,bert_base_glue_seq128,bert_base,"GLUE validation, seq_len=128",bert_base_glue_seq128:k049,49,bert.encoder.layer.8.attention.self.qk_scores,mha_qk_scores,8,1536,64,128,12582912,48,2,4,384,192,196608,106496,48,9.600000000000001,5856.000000000001,5884.960000000001,0.796810647915617,dptc_photonic_tile_schedule,generated canonical BERT-base encoder GEMM schedule,slack_only,Slack-only selector,0.7002314814814814,0.0,0.29976851851851843,0.7002314814814816,9.024444444444446,269,137671
20260513_tetc_pivot,bert_base_glue_seq128,bert_base,"GLUE validation, seq_len=128",bert_base_glue_seq128:k050,50,bert.encoder.layer.8.attention.self.av_context,mha_av_context,8,1536,128,64,12582912,48,4,2,384,96,98304,204800,48,9.600000000000001,5865.600000000001,5894.560000000001,0.796810647915617,dptc_photonic_tile_schedule,generated canonical BERT-base encoder GEMM schedule,slack_only,Slack-only selector,0.7002314814814814,0.0,0.29976851851851843,0.7002314814814816,9.024444444444446,269,68836
20260513_tetc_pivot,bert_base_glue_seq128,bert_base,"GLUE validation, seq_len=128",bert_base_glue_seq128:k051,51,bert.encoder.layer.8.attention.output.dense,mha_output_projection,8,128,768,768,75497472,4,24,24,2304,96,98304,688128,288,57.6,5875.200000000002,6016.960000000002,0.7724912784732199,dptc_photonic_tile_schedule,generated canonical BERT-base encoder GEMM schedule,slack_only,Slack-only selector,0.7002314814814814,0.0,0.29976851851851843,0.7002314814814816,54.14666666666667,1613,68836
20260513_tetc_pivot,bert_base_glue_seq128,bert_base,"GLUE validation, seq_len=128",bert_base_glue_seq128:k052,52,bert.encoder.layer.8.intermediate.dense,ffn_expand,8,128,768,3072,301989888,4,24,96,9216,384,393216,2457600,1152,230.4,5932.800000000002,6480.640000000001,0.7678632115547996,dptc_photonic_tile_schedule,generated canonical BERT-base encoder GEMM schedule,slack_only,Slack-only selector,0.7002314814814814,0.0,0.29976851851851843,0.7002314814814816,216.58666666666667,6453,275342
20260513_tetc_pivot,bert_base_glue_seq128,bert_base,"GLUE validation, seq_len=128",bert_base_glue_seq128:k053,53,bert.encoder.layer.8.output.dense,ffn_project,8,128,3072,768,301989888,4,96,24,9216,96,98304,2752512,1152,230.4,6163.200000000002,6711.040000000001,0.7678632115547996,dptc_photonic_tile_schedule,generated canonical BERT-base encoder GEMM schedule,slack_only,Slack-only selector,0.7002314814814814,0.0,0.29976851851851843,0.7002314814814816,216.58666666666667,6453,68836
20260513_tetc_pivot,bert_base_glue_seq128,bert_base,"GLUE validation, seq_len=128",bert_base_glue_seq128:k054,54,bert.encoder.layer.9.attention.self.qkv,mha_qkv_projection,9,128,768,2304,226492416,4,24,72,6912,288,294912,1867776,864,172.8,6393.600000000001,6806.080000000002,0.800211580506384,dptc_photonic_tile_schedule,generated canonical BERT-base encoder GEMM schedule,slack_only,Slack-only selector,0.7002314814814814,0.0,0.29976851851851843,0.7002314814814816,162.44000000000003,4840,206507
20260513_tetc_pivot,bert_base_glue_seq128,bert_base,"GLUE validation, seq_len=128",bert_base_glue_seq128:k055,55,bert.encoder.layer.9.attention.self.qk_scores,mha_qk_scores,9,1536,64,128,12582912,48,2,4,384,192,196608,106496,48,9.600000000000001,6566.4000000000015,6595.3600000000015,0.8286288297337988,dptc_photonic_tile_schedule,generated canonical BERT-base encoder GEMM schedule,slack_only,Slack-only selector,0.7002314814814814,0.0,0.29976851851851843,0.7002314814814816,9.024444444444446,269,137671
20260513_tetc_pivot,bert_base_glue_seq128,bert_base,"GLUE validation, seq_len=128",bert_base_glue_seq128:k056,56,bert.encoder.layer.9.attention.self.av_context,mha_av_context,9,1536,128,64,12582912,48,4,2,384,96,98304,204800,48,9.600000000000001,6576.000000000002,6604.960000000002,0.8286288297337988,dptc_photonic_tile_schedule,generated canonical BERT-base encoder GEMM schedule,slack_only,Slack-only selector,0.7002314814814814,0.0,0.29976851851851843,0.7002314814814816,9.024444444444446,269,68836
20260513_tetc_pivot,bert_base_glue_seq128,bert_base,"GLUE validation, seq_len=128",bert_base_glue_seq128:k057,57,bert.encoder.layer.9.attention.output.dense,mha_output_projection,9,128,768,768,75497472,4,24,24,2304,96,98304,688128,288,57.6,6585.600000000002,6727.360000000002,0.8043094602914017,dptc_photonic_tile_schedule,generated canonical BERT-base encoder GEMM schedule,slack_only,Slack-only selector,0.7002314814814814,0.0,0.29976851851851843,0.7002314814814816,54.14666666666667,1613,68836
20260513_tetc_pivot,bert_base_glue_seq128,bert_base,"GLUE validation, seq_len=128",bert_base_glue_seq128:k058,58,bert.encoder.layer.9.intermediate.dense,ffn_expand,9,128,768,3072,301989888,4,24,96,9216,384,393216,2457600,1152,230.4,6643.200000000003,7191.040000000002,0.7996813933729815,dptc_photonic_tile_schedule,generated canonical BERT-base encoder GEMM schedule,slack_only,Slack-only selector,0.7002314814814814,0.0,0.29976851851851843,0.7002314814814816,216.58666666666667,6453,275342
20260513_tetc_pivot,bert_base_glue_seq128,bert_base,"GLUE validation, seq_len=128",bert_base_glue_seq128:k059,59,bert.encoder.layer.9.output.dense,ffn_project,9,128,3072,768,301989888,4,96,24,9216,96,98304,2752512,1152,230.4,6873.600000000002,7421.440000000001,0.7996813933729815,dptc_photonic_tile_schedule,generated canonical BERT-base encoder GEMM schedule,slack_only,Slack-only selector,0.7002314814814814,0.0,0.29976851851851843,0.7002314814814816,216.58666666666667,6453,68836
20260513_tetc_pivot,bert_base_glue_seq128,bert_base,"GLUE validation, seq_len=128",bert_base_glue_seq128:k060,60,bert.encoder.layer.10.attention.self.qkv,mha_qkv_projection,10,128,768,2304,226492416,4,24,72,6912,288,294912,1867776,864,172.8,7104.000000000002,7516.480000000002,0.8320297623245658,dptc_photonic_tile_schedule,generated canonical BERT-base encoder GEMM schedule,slack_only,Slack-only selector,0.7002314814814814,0.0,0.29976851851851843,0.7002314814814816,162.44000000000003,4840,206507
20260513_tetc_pivot,bert_base_glue_seq128,bert_base,"GLUE validation, seq_len=128",bert_base_glue_seq128:k061,61,bert.encoder.layer.10.attention.self.qk_scores,mha_qk_scores,10,1536,64,128,12582912,48,2,4,384,192,196608,106496,48,9.600000000000001,7276.800000000002,7305.760000000002,0.8604470115519807,dptc_photonic_tile_schedule,generated canonical BERT-base encoder GEMM schedule,slack_only,Slack-only selector,0.7002314814814814,0.0,0.29976851851851843,0.7002314814814816,9.024444444444446,269,137671
20260513_tetc_pivot,bert_base_glue_seq128,bert_base,"GLUE validation, seq_len=128",bert_base_glue_seq128:k062,62,bert.encoder.layer.10.attention.self.av_context,mha_av_context,10,1536,128,64,12582912,48,4,2,384,96,98304,204800,48,9.600000000000001,7286.400000000002,7315.360000000002,0.8604470115519807,dptc_photonic_tile_schedule,generated canonical BERT-base encoder GEMM schedule,slack_only,Slack-only selector,0.7002314814814814,0.0,0.29976851851851843,0.7002314814814816,9.024444444444446,269,68836
20260513_tetc_pivot,bert_base_glue_seq128,bert_base,"GLUE validation, seq_len=128",bert_base_glue_seq128:k063,63,bert.encoder.layer.10.attention.output.dense,mha_output_projection,10,128,768,768,75497472,4,24,24,2304,96,98304,688128,288,57.6,7296.000000000003,7437.760000000003,0.8361276421095836,dptc_photonic_tile_schedule,generated canonical BERT-base encoder GEMM schedule,slack_only,Slack-only selector,0.7002314814814814,0.0,0.29976851851851843,0.7002314814814816,54.14666666666667,1613,68836
20260513_tetc_pivot,bert_base_glue_seq128,bert_base,"GLUE validation, seq_len=128",bert_base_glue_seq128:k064,64,bert.encoder.layer.10.intermediate.dense,ffn_expand,10,128,768,3072,301989888,4,24,96,9216,384,393216,2457600,1152,230.4,7353.600000000003,7901.440000000002,0.8314995751911634,dptc_photonic_tile_schedule,generated canonical BERT-base encoder GEMM schedule,slack_only,Slack-only selector,0.7002314814814814,0.0,0.29976851851851843,0.7002314814814816,216.58666666666667,6453,275342
20260513_tetc_pivot,bert_base_glue_seq128,bert_base,"GLUE validation, seq_len=128",bert_base_glue_seq128:k065,65,bert.encoder.layer.10.output.dense,ffn_project,10,128,3072,768,301989888,4,96,24,9216,96,98304,2752512,1152,230.4,7584.000000000003,8131.840000000002,0.8314995751911634,dptc_photonic_tile_schedule,generated canonical BERT-base encoder GEMM schedule,slack_only,Slack-only selector,0.7002314814814814,0.0,0.29976851851851843,0.7002314814814816,216.58666666666667,6453,68836
20260513_tetc_pivot,bert_base_glue_seq128,bert_base,"GLUE validation, seq_len=128",bert_base_glue_seq128:k066,66,bert.encoder.layer.11.attention.self.qkv,mha_qkv_projection,11,128,768,2304,226492416,4,24,72,6912,288,294912,1867776,864,172.8,7814.400000000002,8226.880000000003,0.8638479441427476,dptc_photonic_tile_schedule,generated canonical BERT-base encoder GEMM schedule,slack_only,Slack-only selector,0.7002314814814814,0.0,0.29976851851851843,0.7002314814814816,162.44000000000003,4840,206507
20260513_tetc_pivot,bert_base_glue_seq128,bert_base,"GLUE validation, seq_len=128",bert_base_glue_seq128:k067,67,bert.encoder.layer.11.attention.self.qk_scores,mha_qk_scores,11,1536,64,128,12582912,48,2,4,384,192,196608,106496,48,9.600000000000001,7987.200000000003,8016.160000000003,0.8922651933701624,dptc_photonic_tile_schedule,generated canonical BERT-base encoder GEMM schedule,slack_only,Slack-only selector,0.7002314814814814,0.0,0.29976851851851843,0.7002314814814816,9.024444444444446,269,137671
20260513_tetc_pivot,bert_base_glue_seq128,bert_base,"GLUE validation, seq_len=128",bert_base_glue_seq128:k068,68,bert.encoder.layer.11.attention.self.av_context,mha_av_context,11,1536,128,64,12582912,48,4,2,384,96,98304,204800,48,9.600000000000001,7996.800000000003,8025.760000000003,0.8922651933701624,dptc_photonic_tile_schedule,generated canonical BERT-base encoder GEMM schedule,slack_only,Slack-only selector,0.7002314814814814,0.0,0.29976851851851843,0.7002314814814816,9.024444444444446,269,68836
20260513_tetc_pivot,bert_base_glue_seq128,bert_base,"GLUE validation, seq_len=128",bert_base_glue_seq128:k069,69,bert.encoder.layer.11.attention.output.dense,mha_output_projection,11,128,768,768,75497472,4,24,24,2304,96,98304,688128,288,57.6,8006.400000000003,8148.1600000000035,0.8679458239277653,dptc_photonic_tile_schedule,generated canonical BERT-base encoder GEMM schedule,slack_only,Slack-only selector,0.7002314814814814,0.0,0.29976851851851843,0.7002314814814816,54.14666666666667,1613,68836
20260513_tetc_pivot,bert_base_glue_seq128,bert_base,"GLUE validation, seq_len=128",bert_base_glue_seq128:k070,70,bert.encoder.layer.11.intermediate.dense,ffn_expand,11,128,768,3072,301989888,4,24,96,9216,384,393216,2457600,1152,230.4,8064.000000000004,8611.840000000004,0.8633177570093462,dptc_photonic_tile_schedule,generated canonical BERT-base encoder GEMM schedule,slack_only,Slack-only selector,0.7002314814814814,0.0,0.29976851851851843,0.7002314814814816,216.58666666666667,6453,275342
20260513_tetc_pivot,bert_base_glue_seq128,bert_base,"GLUE validation, seq_len=128",bert_base_glue_seq128:k071,71,bert.encoder.layer.11.output.dense,ffn_project,11,128,3072,768,301989888,4,96,24,9216,96,98304,2752512,1152,230.4,8294.400000000003,8842.240000000003,0.8633177570093451,dptc_photonic_tile_schedule,generated canonical BERT-base encoder GEMM schedule,slack_only,Slack-only selector,0.7002314814814814,0.0,0.29976851851851843,0.7002314814814816,216.58666666666667,6453,68836
20260513_tetc_pivot,bert_base_glue_seq128,bert_base,"GLUE validation, seq_len=128",bert_base_glue_seq128:k000,0,bert.encoder.layer.0.attention.self.qkv,mha_qkv_projection,0,128,768,2304,226492416,4,24,72,6912,288,294912,1867776,864,172.8,0.0,412.48,0.5138479441427464,dptc_photonic_tile_schedule,generated canonical BERT-base encoder GEMM schedule,suds_only,SUDS budget only,0.026945891203703706,0.7718340084876546,0.20122010030864199,0.798779899691358,165.84583333333336,5521,235570
20260513_tetc_pivot,bert_base_glue_seq128,bert_base,"GLUE validation, seq_len=128",bert_base_glue_seq128:k001,1,bert.encoder.layer.0.attention.self.qk_scores,mha_qk_scores,0,1536,64,128,12582912,48,2,4,384,192,196608,106496,48,9.600000000000001,172.8,201.76000000000002,0.5422651933701657,dptc_photonic_tile_schedule,generated canonical BERT-base encoder GEMM schedule,suds_only,SUDS budget only,0.026945891203703706,0.7718340084876546,0.20122010030864199,0.798779899691358,9.213657407407409,307,157047
20260513_tetc_pivot,bert_base_glue_seq128,bert_base,"GLUE validation, seq_len=128",bert_base_glue_seq128:k002,2,bert.encoder.layer.0.attention.self.av_context,mha_av_context,0,1536,128,64,12582912,48,4,2,384,96,98304,204800,48,9.600000000000001,182.4,211.36,0.5422651933701657,dptc_photonic_tile_schedule,generated canonical BERT-base encoder GEMM schedule,suds_only,SUDS budget only,0.026945891203703706,0.7718340084876546,0.20122010030864199,0.798779899691358,9.213657407407409,307,78523
20260513_tetc_pivot,bert_base_glue_seq128,bert_base,"GLUE validation, seq_len=128",bert_base_glue_seq128:k003,3,bert.encoder.layer.0.attention.output.dense,mha_output_projection,0,128,768,768,75497472,4,24,24,2304,96,98304,688128,288,57.6,192.0,333.76,0.517945823927765,dptc_photonic_tile_schedule,generated canonical BERT-base encoder GEMM schedule,suds_only,SUDS budget only,0.026945891203703706,0.7718340084876546,0.20122010030864199,0.798779899691358,55.28194444444445,1840,78523
20260513_tetc_pivot,bert_base_glue_seq128,bert_base,"GLUE validation, seq_len=128",bert_base_glue_seq128:k004,4,bert.encoder.layer.0.intermediate.dense,ffn_expand,0,128,768,3072,301989888,4,24,96,9216,384,393216,2457600,1152,230.4,249.6,797.44,0.5133177570093458,dptc_photonic_tile_schedule,generated canonical BERT-base encoder GEMM schedule,suds_only,SUDS budget only,0.026945891203703706,0.7718340084876546,0.20122010030864199,0.798779899691358,221.1277777777778,7362,314093
20260513_tetc_pivot,bert_base_glue_seq128,bert_base,"GLUE validation, seq_len=128",bert_base_glue_seq128:k005,5,bert.encoder.layer.0.output.dense,ffn_project,0,128,3072,768,301989888,4,96,24,9216,96,98304,2752512,1152,230.4,480.0,1027.84,0.5133177570093456,dptc_photonic_tile_schedule,generated canonical BERT-base encoder GEMM schedule,suds_only,SUDS budget only,0.026945891203703706,0.7718340084876546,0.20122010030864199,0.798779899691358,221.1277777777778,7362,78523
20260513_tetc_pivot,bert_base_glue_seq128,bert_base,"GLUE validation, seq_len=128",bert_base_glue_seq128:k006,6,bert.encoder.layer.1.attention.self.qkv,mha_qkv_projection,1,128,768,2304,226492416,4,24,72,6912,288,294912,1867776,864,172.8,710.4,1122.88,0.5456661259609283,dptc_photonic_tile_schedule,generated canonical BERT-base encoder GEMM schedule,suds_only,SUDS budget only,0.026945891203703706,0.7718340084876546,0.20122010030864199,0.798779899691358,165.84583333333336,5521,235570
20260513_tetc_pivot,bert_base_glue_seq128,bert_base,"GLUE validation, seq_len=128",bert_base_glue_seq128:k007,7,bert.encoder.layer.1.attention.self.qk_scores,mha_qk_scores,1,1536,64,128,12582912,48,2,4,384,192,196608,106496,48,9.600000000000001,883.2,912.1600000000001,0.5740833751883494,dptc_photonic_tile_schedule,generated canonical BERT-base encoder GEMM schedule,suds_only,SUDS budget only,0.026945891203703706,0.7718340084876546,0.20122010030864199,0.798779899691358,9.213657407407409,307,157047
20260513_tetc_pivot,bert_base_glue_seq128,bert_base,"GLUE validation, seq_len=128",bert_base_glue_seq128:k008,8,bert.encoder.layer.1.attention.self.av_context,mha_av_context,1,1536,128,64,12582912,48,4,2,384,96,98304,204800,48,9.600000000000001,892.8000000000001,921.7600000000001,0.5740833751883494,dptc_photonic_tile_schedule,generated canonical BERT-base encoder GEMM schedule,suds_only,SUDS budget only,0.026945891203703706,0.7718340084876546,0.20122010030864199,0.798779899691358,9.213657407407409,307,78523
20260513_tetc_pivot,bert_base_glue_seq128,bert_base,"GLUE validation, seq_len=128",bert_base_glue_seq128:k009,9,bert.encoder.layer.1.attention.output.dense,mha_output_projection,1,128,768,768,75497472,4,24,24,2304,96,98304,688128,288,57.6,902.4000000000001,1044.16,0.5497640057459472,dptc_photonic_tile_schedule,generated canonical BERT-base encoder GEMM schedule,suds_only,SUDS budget only,0.026945891203703706,0.7718340084876546,0.20122010030864199,0.798779899691358,55.28194444444445,1840,78523
20260513_tetc_pivot,bert_base_glue_seq128,bert_base,"GLUE validation, seq_len=128",bert_base_glue_seq128:k010,10,bert.encoder.layer.1.intermediate.dense,ffn_expand,1,128,768,3072,301989888,4,24,96,9216,384,393216,2457600,1152,230.4,960.0000000000001,1507.8400000000001,0.5451359388275278,dptc_photonic_tile_schedule,generated canonical BERT-base encoder GEMM schedule,suds_only,SUDS budget only,0.026945891203703706,0.7718340084876546,0.20122010030864199,0.798779899691358,221.1277777777778,7362,314093
20260513_tetc_pivot,bert_base_glue_seq128,bert_base,"GLUE validation, seq_len=128",bert_base_glue_seq128:k011,11,bert.encoder.layer.1.output.dense,ffn_project,1,128,3072,768,301989888,4,96,24,9216,96,98304,2752512,1152,230.4,1190.4,1738.2400000000002,0.5451359388275278,dptc_photonic_tile_schedule,generated canonical BERT-base encoder GEMM schedule,suds_only,SUDS budget only,0.026945891203703706,0.7718340084876546,0.20122010030864199,0.798779899691358,221.1277777777778,7362,78523
20260513_tetc_pivot,bert_base_glue_seq128,bert_base,"GLUE validation, seq_len=128",bert_base_glue_seq128:k012,12,bert.encoder.layer.2.attention.self.qkv,mha_qkv_projection,2,128,768,2304,226492416,4,24,72,6912,288,294912,1867776,864,172.8,1420.8000000000002,1833.2800000000002,0.5774843077791098,dptc_photonic_tile_schedule,generated canonical BERT-base encoder GEMM schedule,suds_only,SUDS budget only,0.026945891203703706,0.7718340084876546,0.20122010030864199,0.798779899691358,165.84583333333336,5521,235570
20260513_tetc_pivot,bert_base_glue_seq128,bert_base,"GLUE validation, seq_len=128",bert_base_glue_seq128:k013,13,bert.encoder.layer.2.attention.self.qk_scores,mha_qk_scores,2,1536,64,128,12582912,48,2,4,384,192,196608,106496,48,9.600000000000001,1593.6000000000001,1622.56,0.605901557006526,dptc_photonic_tile_schedule,generated canonical BERT-base encoder GEMM schedule,suds_only,SUDS budget only,0.026945891203703706,0.7718340084876546,0.20122010030864199,0.798779899691358,9.213657407407409,307,157047
20260513_tetc_pivot,bert_base_glue_seq128,bert_base,"GLUE validation, seq_len=128",bert_base_glue_seq128:k014,14,bert.encoder.layer.2.attention.self.av_context,mha_av_context,2,1536,128,64,12582912,48,4,2,384,96,98304,204800,48,9.600000000000001,1603.2,1632.1599999999999,0.605901557006526,dptc_photonic_tile_schedule,generated canonical BERT-base encoder GEMM schedule,suds_only,SUDS budget only,0.026945891203703706,0.7718340084876546,0.20122010030864199,0.798779899691358,9.213657407407409,307,78523
20260513_tetc_pivot,bert_base_glue_seq128,bert_base,"GLUE validation, seq_len=128",bert_base_glue_seq128:k015,15,bert.encoder.layer.2.attention.output.dense,mha_output_projection,2,128,768,768,75497472,4,24,24,2304,96,98304,688128,288,57.6,1612.8,1754.56,0.5815821875641289,dptc_photonic_tile_schedule,generated canonical BERT-base encoder GEMM schedule,suds_only,SUDS budget only,0.026945891203703706,0.7718340084876546,0.20122010030864199,0.798779899691358,55.28194444444445,1840,78523
20260513_tetc_pivot,bert_base_glue_seq128,bert_base,"GLUE validation, seq_len=128",bert_base_glue_seq128:k016,16,bert.encoder.layer.2.intermediate.dense,ffn_expand,2,128,768,3072,301989888,4,24,96,9216,384,393216,2457600,1152,230.4,1670.3999999999999,2218.24,0.5769541206457092,dptc_photonic_tile_schedule,generated canonical BERT-base encoder GEMM schedule,suds_only,SUDS budget only,0.026945891203703706,0.7718340084876546,0.20122010030864199,0.798779899691358,221.1277777777778,7362,314093
20260513_tetc_pivot,bert_base_glue_seq128,bert_base,"GLUE validation, seq_len=128",bert_base_glue_seq128:k017,17,bert.encoder.layer.2.output.dense,ffn_project,2,128,3072,768,301989888,4,96,24,9216,96,98304,2752512,1152,230.4,1900.8,2448.64,0.5769541206457092,dptc_photonic_tile_schedule,generated canonical BERT-base encoder GEMM schedule,suds_only,SUDS budget only,0.026945891203703706,0.7718340084876546,0.20122010030864199,0.798779899691358,221.1277777777778,7362,78523
20260513_tetc_pivot,bert_base_glue_seq128,bert_base,"GLUE validation, seq_len=128",bert_base_glue_seq128:k018,18,bert.encoder.layer.3.attention.self.qkv,mha_qkv_projection,3,128,768,2304,226492416,4,24,72,6912,288,294912,1867776,864,172.8,2131.2,2543.68,0.6093024895972916,dptc_photonic_tile_schedule,generated canonical BERT-base encoder GEMM schedule,suds_only,SUDS budget only,0.026945891203703706,0.7718340084876546,0.20122010030864199,0.798779899691358,165.84583333333336,5521,235570
20260513_tetc_pivot,bert_base_glue_seq128,bert_base,"GLUE validation, seq_len=128",bert_base_glue_seq128:k019,19,bert.encoder.layer.3.attention.self.qk_scores,mha_qk_scores,3,1536,64,128,12582912,48,2,4,384,192,196608,106496,48,9.600000000000001,2304.0,2332.96,0.6377197388247079,dptc_photonic_tile_schedule,generated canonical BERT-base encoder GEMM schedule,suds_only,SUDS budget only,0.026945891203703706,0.7718340084876546,0.20122010030864199,0.798779899691358,9.213657407407409,307,157047
20260513_tetc_pivot,bert_base_glue_seq128,bert_base,"GLUE validation, seq_len=128",bert_base_glue_seq128:k020,20,bert.encoder.layer.3.attention.self.av_context,mha_av_context,3,1536,128,64,12582912,48,4,2,384,96,98304,204800,48,9.600000000000001,2313.6,2342.56,0.6377197388247079,dptc_photonic_tile_schedule,generated canonical BERT-base encoder GEMM schedule,suds_only,SUDS budget only,0.026945891203703706,0.7718340084876546,0.20122010030864199,0.798779899691358,9.213657407407409,307,78523
20260513_tetc_pivot,bert_base_glue_seq128,bert_base,"GLUE validation, seq_len=128",bert_base_glue_seq128:k021,21,bert.encoder.layer.3.attention.output.dense,mha_output_projection,3,128,768,768,75497472,4,24,24,2304,96,98304,688128,288,57.6,2323.2,2464.9599999999996,0.6134003693823087,dptc_photonic_tile_schedule,generated canonical BERT-base encoder GEMM schedule,suds_only,SUDS budget only,0.026945891203703706,0.7718340084876546,0.20122010030864199,0.798779899691358,55.28194444444445,1840,78523
20260513_tetc_pivot,bert_base_glue_seq128,bert_base,"GLUE validation, seq_len=128",bert_base_glue_seq128:k022,22,bert.encoder.layer.3.intermediate.dense,ffn_expand,3,128,768,3072,301989888,4,24,96,9216,384,393216,2457600,1152,230.4,2380.7999999999997,2928.64,0.6087723024638917,dptc_photonic_tile_schedule,generated canonical BERT-base encoder GEMM schedule,suds_only,SUDS budget only,0.026945891203703706,0.7718340084876546,0.20122010030864199,0.798779899691358,221.1277777777778,7362,314093
20260513_tetc_pivot,bert_base_glue_seq128,bert_base,"GLUE validation, seq_len=128",bert_base_glue_seq128:k023,23,bert.encoder.layer.3.output.dense,ffn_project,3,128,3072,768,301989888,4,96,24,9216,96,98304,2752512,1152,230.4,2611.2,3159.04,0.6087723024638917,dptc_photonic_tile_schedule,generated canonical BERT-base encoder GEMM schedule,suds_only,SUDS budget only,0.026945891203703706,0.7718340084876546,0.20122010030864199,0.798779899691358,221.1277777777778,7362,78523
20260513_tetc_pivot,bert_base_glue_seq128,bert_base,"GLUE validation, seq_len=128",bert_base_glue_seq128:k024,24,bert.encoder.layer.4.attention.self.qkv,mha_qkv_projection,4,128,768,2304,226492416,4,24,72,6912,288,294912,1867776,864,172.8,2841.6,3254.08,0.6411206714154734,dptc_photonic_tile_schedule,generated canonical BERT-base encoder GEMM schedule,suds_only,SUDS budget only,0.026945891203703706,0.7718340084876546,0.20122010030864199,0.798779899691358,165.84583333333336,5521,235570
20260513_tetc_pivot,bert_base_glue_seq128,bert_base,"GLUE validation, seq_len=128",bert_base_glue_seq128:k025,25,bert.encoder.layer.4.attention.self.qk_scores,mha_qk_scores,4,1536,64,128,12582912,48,2,4,384,192,196608,106496,48,9.600000000000001,3014.4,3043.36,0.6695379206428898,dptc_photonic_tile_schedule,generated canonical BERT-base encoder GEMM schedule,suds_only,SUDS budget only,0.026945891203703706,0.7718340084876546,0.20122010030864199,0.798779899691358,9.213657407407409,307,157047
20260513_tetc_pivot,bert_base_glue_seq128,bert_base,"GLUE validation, seq_len=128",bert_base_glue_seq128:k026,26,bert.encoder.layer.4.attention.self.av_context,mha_av_context,4,1536,128,64,12582912,48,4,2,384,96,98304,204800,48,9.600000000000001,3024.0,3052.96,0.6695379206428898,dptc_photonic_tile_schedule,generated canonical BERT-base encoder GEMM schedule,suds_only,SUDS budget only,0.026945891203703706,0.7718340084876546,0.20122010030864199,0.798779899691358,9.213657407407409,307,78523
20260513_tetc_pivot,bert_base_glue_seq128,bert_base,"GLUE validation, seq_len=128",bert_base_glue_seq128:k027,27,bert.encoder.layer.4.attention.output.dense,mha_output_projection,4,128,768,768,75497472,4,24,24,2304,96,98304,688128,288,57.6,3033.6,3175.3599999999997,0.6452185512004904,dptc_photonic_tile_schedule,generated canonical BERT-base encoder GEMM schedule,suds_only,SUDS budget only,0.026945891203703706,0.7718340084876546,0.20122010030864199,0.798779899691358,55.28194444444445,1840,78523
20260513_tetc_pivot,bert_base_glue_seq128,bert_base,"GLUE validation, seq_len=128",bert_base_glue_seq128:k028,28,bert.encoder.layer.4.intermediate.dense,ffn_expand,4,128,768,3072,301989888,4,24,96,9216,384,393216,2457600,1152,230.4,3091.2,3639.04,0.6405904842820735,dptc_photonic_tile_schedule,generated canonical BERT-base encoder GEMM schedule,suds_only,SUDS budget only,0.026945891203703706,0.7718340084876546,0.20122010030864199,0.798779899691358,221.1277777777778,7362,314093
20260513_tetc_pivot,bert_base_glue_seq128,bert_base,"GLUE validation, seq_len=128",bert_base_glue_seq128:k029,29,bert.encoder.layer.4.output.dense,ffn_project,4,128,3072,768,301989888,4,96,24,9216,96,98304,2752512,1152,230.4,3321.6,3869.44,0.6405904842820735,dptc_photonic_tile_schedule,generated canonical BERT-base encoder GEMM schedule,suds_only,SUDS budget only,0.026945891203703706,0.7718340084876546,0.20122010030864199,0.798779899691358,221.1277777777778,7362,78523
20260513_tetc_pivot,bert_base_glue_seq128,bert_base,"GLUE validation, seq_len=128",bert_base_glue_seq128:k030,30,bert.encoder.layer.5.attention.self.qkv,mha_qkv_projection,5,128,768,2304,226492416,4,24,72,6912,288,294912,1867776,864,172.8,3552.0,3964.48,0.6729388532336552,dptc_photonic_tile_schedule,generated canonical BERT-base encoder GEMM schedule,suds_only,SUDS budget only,0.026945891203703706,0.7718340084876546,0.20122010030864199,0.798779899691358,165.84583333333336,5521,235570
20260513_tetc_pivot,bert_base_glue_seq128,bert_base,"GLUE validation, seq_len=128",bert_base_glue_seq128:k031,31,bert.encoder.layer.5.attention.self.qk_scores,mha_qk_scores,5,1536,64,128,12582912,48,2,4,384,192,196608,106496,48,9.600000000000001,3724.8,3753.76,0.7013561024610715,dptc_photonic_tile_schedule,generated canonical BERT-base encoder GEMM schedule,suds_only,SUDS budget only,0.026945891203703706,0.7718340084876546,0.20122010030864199,0.798779899691358,9.213657407407409,307,157047
20260513_tetc_pivot,bert_base_glue_seq128,bert_base,"GLUE validation, seq_len=128",bert_base_glue_seq128:k032,32,bert.encoder.layer.5.attention.self.av_context,mha_av_context,5,1536,128,64,12582912,48,4,2,384,96,98304,204800,48,9.600000000000001,3734.4,3763.36,0.7013561024610715,dptc_photonic_tile_schedule,generated canonical BERT-base encoder GEMM schedule,suds_only,SUDS budget only,0.026945891203703706,0.7718340084876546,0.20122010030864199,0.798779899691358,9.213657407407409,307,78523
20260513_tetc_pivot,bert_base_glue_seq128,bert_base,"GLUE validation, seq_len=128",bert_base_glue_seq128:k033,33,bert.encoder.layer.5.attention.output.dense,mha_output_projection,5,128,768,768,75497472,4,24,24,2304,96,98304,688128,288,57.6,3744.0,3885.7599999999998,0.6770367330186723,dptc_photonic_tile_schedule,generated canonical BERT-base encoder GEMM schedule,suds_only,SUDS budget only,0.026945891203703706,0.7718340084876546,0.20122010030864199,0.798779899691358,55.28194444444445,1840,78523
20260513_tetc_pivot,bert_base_glue_seq128,bert_base,"GLUE validation, seq_len=128",bert_base_glue_seq128:k034,34,bert.encoder.layer.5.intermediate.dense,ffn_expand,5,128,768,3072,301989888,4,24,96,9216,384,393216,2457600,1152,230.4,3801.6,4349.44,0.6724086661002546,dptc_photonic_tile_schedule,generated canonical BERT-base encoder GEMM schedule,suds_only,SUDS budget only,0.026945891203703706,0.7718340084876546,0.20122010030864199,0.798779899691358,221.1277777777778,7362,314093
20260513_tetc_pivot,bert_base_glue_seq128,bert_base,"GLUE validation, seq_len=128",bert_base_glue_seq128:k035,35,bert.encoder.layer.5.output.dense,ffn_project,5,128,3072,768,301989888,4,96,24,9216,96,98304,2752512,1152,230.4,4032.0,4579.839999999999,0.6724086661002542,dptc_photonic_tile_schedule,generated canonical BERT-base encoder GEMM schedule,suds_only,SUDS budget only,0.026945891203703706,0.7718340084876546,0.20122010030864199,0.798779899691358,221.1277777777778,7362,78523
20260513_tetc_pivot,bert_base_glue_seq128,bert_base,"GLUE validation, seq_len=128",bert_base_glue_seq128:k036,36,bert.encoder.layer.6.attention.self.qkv,mha_qkv_projection,6,128,768,2304,226492416,4,24,72,6912,288,294912,1867776,864,172.8,4262.4,4674.88,0.7047570350518385,dptc_photonic_tile_schedule,generated canonical BERT-base encoder GEMM schedule,suds_only,SUDS budget only,0.026945891203703706,0.7718340084876546,0.20122010030864199,0.798779899691358,165.84583333333336,5521,235570
20260513_tetc_pivot,bert_base_glue_seq128,bert_base,"GLUE validation, seq_len=128",bert_base_glue_seq128:k037,37,bert.encoder.layer.6.attention.self.qk_scores,mha_qk_scores,6,1536,64,128,12582912,48,2,4,384,192,196608,106496,48,9.600000000000001,4435.2,4464.16,0.7331742842792534,dptc_photonic_tile_schedule,generated canonical BERT-base encoder GEMM schedule,suds_only,SUDS budget only,0.026945891203703706,0.7718340084876546,0.20122010030864199,0.798779899691358,9.213657407407409,307,157047
20260513_tetc_pivot,bert_base_glue_seq128,bert_base,"GLUE validation, seq_len=128",bert_base_glue_seq128:k038,38,bert.encoder.layer.6.attention.self.av_context,mha_av_context,6,1536,128,64,12582912,48,4,2,384,96,98304,204800,48,9.600000000000001,4444.8,4473.76,0.7331742842792534,dptc_photonic_tile_schedule,generated canonical BERT-base encoder GEMM schedule,suds_only,SUDS budget only,0.026945891203703706,0.7718340084876546,0.20122010030864199,0.798779899691358,9.213657407407409,307,78523
20260513_tetc_pivot,bert_base_glue_seq128,bert_base,"GLUE validation, seq_len=128",bert_base_glue_seq128:k039,39,bert.encoder.layer.6.attention.output.dense,mha_output_projection,6,128,768,768,75497472,4,24,24,2304,96,98304,688128,288,57.6,4454.400000000001,4596.160000000001,0.7088549148368563,dptc_photonic_tile_schedule,generated canonical BERT-base encoder GEMM schedule,suds_only,SUDS budget only,0.026945891203703706,0.7718340084876546,0.20122010030864199,0.798779899691358,55.28194444444445,1840,78523
20260513_tetc_pivot,bert_base_glue_seq128,bert_base,"GLUE validation, seq_len=128",bert_base_glue_seq128:k040,40,bert.encoder.layer.6.intermediate.dense,ffn_expand,6,128,768,3072,301989888,4,24,96,9216,384,393216,2457600,1152,230.4,4512.000000000001,5059.84,0.704226847918436,dptc_photonic_tile_schedule,generated canonical BERT-base encoder GEMM schedule,suds_only,SUDS budget only,0.026945891203703706,0.7718340084876546,0.20122010030864199,0.798779899691358,221.1277777777778,7362,314093
20260513_tetc_pivot,bert_base_glue_seq128,bert_base,"GLUE validation, seq_len=128",bert_base_glue_seq128:k041,41,bert.encoder.layer.6.output.dense,ffn_project,6,128,3072,768,301989888,4,96,24,9216,96,98304,2752512,1152,230.4,4742.400000000001,5290.24,0.704226847918436,dptc_photonic_tile_schedule,generated canonical BERT-base encoder GEMM schedule,suds_only,SUDS budget only,0.026945891203703706,0.7718340084876546,0.20122010030864199,0.798779899691358,221.1277777777778,7362,78523
20260513_tetc_pivot,bert_base_glue_seq128,bert_base,"GLUE validation, seq_len=128",bert_base_glue_seq128:k042,42,bert.encoder.layer.7.attention.self.qkv,mha_qkv_projection,7,128,768,2304,226492416,4,24,72,6912,288,294912,1867776,864,172.8,4972.8,5385.280000000001,0.7365752168700204,dptc_photonic_tile_schedule,generated canonical BERT-base encoder GEMM schedule,suds_only,SUDS budget only,0.026945891203703706,0.7718340084876546,0.20122010030864199,0.798779899691358,165.84583333333336,5521,235570
20260513_tetc_pivot,bert_base_glue_seq128,bert_base,"GLUE validation, seq_len=128",bert_base_glue_seq128:k043,43,bert.encoder.layer.7.attention.self.qk_scores,mha_qk_scores,7,1536,64,128,12582912,48,2,4,384,192,196608,106496,48,9.600000000000001,5145.6,5174.56,0.7649924660974352,dptc_photonic_tile_schedule,generated canonical BERT-base encoder GEMM schedule,suds_only,SUDS budget only,0.026945891203703706,0.7718340084876546,0.20122010030864199,0.798779899691358,9.213657407407409,307,157047
20260513_tetc_pivot,bert_base_glue_seq128,bert_base,"GLUE validation, seq_len=128",bert_base_glue_seq128:k044,44,bert.encoder.layer.7.attention.self.av_context,mha_av_context,7,1536,128,64,12582912,48,4,2,384,96,98304,204800,48,9.600000000000001,5155.200000000001,5184.160000000001,0.7649924660974352,dptc_photonic_tile_schedule,generated canonical BERT-base encoder GEMM schedule,suds_only,SUDS budget only,0.026945891203703706,0.7718340084876546,0.20122010030864199,0.798779899691358,9.213657407407409,307,78523
20260513_tetc_pivot,bert_base_glue_seq128,bert_base,"GLUE validation, seq_len=128",bert_base_glue_seq128:k045,45,bert.encoder.layer.7.attention.output.dense,mha_output_projection,7,128,768,768,75497472,4,24,24,2304,96,98304,688128,288,57.6,5164.800000000001,5306.560000000001,0.7406730966550381,dptc_photonic_tile_schedule,generated canonical BERT-base encoder GEMM schedule,suds_only,SUDS budget only,0.026945891203703706,0.7718340084876546,0.20122010030864199,0.798779899691358,55.28194444444445,1840,78523
20260513_tetc_pivot,bert_base_glue_seq128,bert_base,"GLUE validation, seq_len=128",bert_base_glue_seq128:k046,46,bert.encoder.layer.7.intermediate.dense,ffn_expand,7,128,768,3072,301989888,4,24,96,9216,384,393216,2457600,1152,230.4,5222.4000000000015,5770.240000000001,0.7360450297366179,dptc_photonic_tile_schedule,generated canonical BERT-base encoder GEMM schedule,suds_only,SUDS budget only,0.026945891203703706,0.7718340084876546,0.20122010030864199,0.798779899691358,221.1277777777778,7362,314093
20260513_tetc_pivot,bert_base_glue_seq128,bert_base,"GLUE validation, seq_len=128",bert_base_glue_seq128:k047,47,bert.encoder.layer.7.output.dense,ffn_project,7,128,3072,768,301989888,4,96,24,9216,96,98304,2752512,1152,230.4,5452.800000000001,6000.64,0.7360450297366179,dptc_photonic_tile_schedule,generated canonical BERT-base encoder GEMM schedule,suds_only,SUDS budget only,0.026945891203703706,0.7718340084876546,0.20122010030864199,0.798779899691358,221.1277777777778,7362,78523
20260513_tetc_pivot,bert_base_glue_seq128,bert_base,"GLUE validation, seq_len=128",bert_base_glue_seq128:k048,48,bert.encoder.layer.8.attention.self.qkv,mha_qkv_projection,8,128,768,2304,226492416,4,24,72,6912,288,294912,1867776,864,172.8,5683.200000000001,6095.680000000001,0.7683933986882021,dptc_photonic_tile_schedule,generated canonical BERT-base encoder GEMM schedule,suds_only,SUDS budget only,0.026945891203703706,0.7718340084876546,0.20122010030864199,0.798779899691358,165.84583333333336,5521,235570
20260513_tetc_pivot,bert_base_glue_seq128,bert_base,"GLUE validation, seq_len=128",bert_base_glue_seq128:k049,49,bert.encoder.layer.8.attention.self.qk_scores,mha_qk_scores,8,1536,64,128,12582912,48,2,4,384,192,196608,106496,48,9.600000000000001,5856.000000000001,5884.960000000001,0.796810647915617,dptc_photonic_tile_schedule,generated canonical BERT-base encoder GEMM schedule,suds_only,SUDS budget only,0.026945891203703706,0.7718340084876546,0.20122010030864199,0.798779899691358,9.213657407407409,307,157047
20260513_tetc_pivot,bert_base_glue_seq128,bert_base,"GLUE validation, seq_len=128",bert_base_glue_seq128:k050,50,bert.encoder.layer.8.attention.self.av_context,mha_av_context,8,1536,128,64,12582912,48,4,2,384,96,98304,204800,48,9.600000000000001,5865.600000000001,5894.560000000001,0.796810647915617,dptc_photonic_tile_schedule,generated canonical BERT-base encoder GEMM schedule,suds_only,SUDS budget only,0.026945891203703706,0.7718340084876546,0.20122010030864199,0.798779899691358,9.213657407407409,307,78523
20260513_tetc_pivot,bert_base_glue_seq128,bert_base,"GLUE validation, seq_len=128",bert_base_glue_seq128:k051,51,bert.encoder.layer.8.attention.output.dense,mha_output_projection,8,128,768,768,75497472,4,24,24,2304,96,98304,688128,288,57.6,5875.200000000002,6016.960000000002,0.7724912784732199,dptc_photonic_tile_schedule,generated canonical BERT-base encoder GEMM schedule,suds_only,SUDS budget only,0.026945891203703706,0.7718340084876546,0.20122010030864199,0.798779899691358,55.28194444444445,1840,78523
20260513_tetc_pivot,bert_base_glue_seq128,bert_base,"GLUE validation, seq_len=128",bert_base_glue_seq128:k052,52,bert.encoder.layer.8.intermediate.dense,ffn_expand,8,128,768,3072,301989888,4,24,96,9216,384,393216,2457600,1152,230.4,5932.800000000002,6480.640000000001,0.7678632115547996,dptc_photonic_tile_schedule,generated canonical BERT-base encoder GEMM schedule,suds_only,SUDS budget only,0.026945891203703706,0.7718340084876546,0.20122010030864199,0.798779899691358,221.1277777777778,7362,314093
20260513_tetc_pivot,bert_base_glue_seq128,bert_base,"GLUE validation, seq_len=128",bert_base_glue_seq128:k053,53,bert.encoder.layer.8.output.dense,ffn_project,8,128,3072,768,301989888,4,96,24,9216,96,98304,2752512,1152,230.4,6163.200000000002,6711.040000000001,0.7678632115547996,dptc_photonic_tile_schedule,generated canonical BERT-base encoder GEMM schedule,suds_only,SUDS budget only,0.026945891203703706,0.7718340084876546,0.20122010030864199,0.798779899691358,221.1277777777778,7362,78523
20260513_tetc_pivot,bert_base_glue_seq128,bert_base,"GLUE validation, seq_len=128",bert_base_glue_seq128:k054,54,bert.encoder.layer.9.attention.self.qkv,mha_qkv_projection,9,128,768,2304,226492416,4,24,72,6912,288,294912,1867776,864,172.8,6393.600000000001,6806.080000000002,0.800211580506384,dptc_photonic_tile_schedule,generated canonical BERT-base encoder GEMM schedule,suds_only,SUDS budget only,0.026945891203703706,0.7718340084876546,0.20122010030864199,0.798779899691358,165.84583333333336,5521,235570
20260513_tetc_pivot,bert_base_glue_seq128,bert_base,"GLUE validation, seq_len=128",bert_base_glue_seq128:k055,55,bert.encoder.layer.9.attention.self.qk_scores,mha_qk_scores,9,1536,64,128,12582912,48,2,4,384,192,196608,106496,48,9.600000000000001,6566.4000000000015,6595.3600000000015,0.8286288297337988,dptc_photonic_tile_schedule,generated canonical BERT-base encoder GEMM schedule,suds_only,SUDS budget only,0.026945891203703706,0.7718340084876546,0.20122010030864199,0.798779899691358,9.213657407407409,307,157047
20260513_tetc_pivot,bert_base_glue_seq128,bert_base,"GLUE validation, seq_len=128",bert_base_glue_seq128:k056,56,bert.encoder.layer.9.attention.self.av_context,mha_av_context,9,1536,128,64,12582912,48,4,2,384,96,98304,204800,48,9.600000000000001,6576.000000000002,6604.960000000002,0.8286288297337988,dptc_photonic_tile_schedule,generated canonical BERT-base encoder GEMM schedule,suds_only,SUDS budget only,0.026945891203703706,0.7718340084876546,0.20122010030864199,0.798779899691358,9.213657407407409,307,78523
20260513_tetc_pivot,bert_base_glue_seq128,bert_base,"GLUE validation, seq_len=128",bert_base_glue_seq128:k057,57,bert.encoder.layer.9.attention.output.dense,mha_output_projection,9,128,768,768,75497472,4,24,24,2304,96,98304,688128,288,57.6,6585.600000000002,6727.360000000002,0.8043094602914017,dptc_photonic_tile_schedule,generated canonical BERT-base encoder GEMM schedule,suds_only,SUDS budget only,0.026945891203703706,0.7718340084876546,0.20122010030864199,0.798779899691358,55.28194444444445,1840,78523
20260513_tetc_pivot,bert_base_glue_seq128,bert_base,"GLUE validation, seq_len=128",bert_base_glue_seq128:k058,58,bert.encoder.layer.9.intermediate.dense,ffn_expand,9,128,768,3072,301989888,4,24,96,9216,384,393216,2457600,1152,230.4,6643.200000000003,7191.040000000002,0.7996813933729815,dptc_photonic_tile_schedule,generated canonical BERT-base encoder GEMM schedule,suds_only,SUDS budget only,0.026945891203703706,0.7718340084876546,0.20122010030864199,0.798779899691358,221.1277777777778,7362,314093
20260513_tetc_pivot,bert_base_glue_seq128,bert_base,"GLUE validation, seq_len=128",bert_base_glue_seq128:k059,59,bert.encoder.layer.9.output.dense,ffn_project,9,128,3072,768,301989888,4,96,24,9216,96,98304,2752512,1152,230.4,6873.600000000002,7421.440000000001,0.7996813933729815,dptc_photonic_tile_schedule,generated canonical BERT-base encoder GEMM schedule,suds_only,SUDS budget only,0.026945891203703706,0.7718340084876546,0.20122010030864199,0.798779899691358,221.1277777777778,7362,78523
20260513_tetc_pivot,bert_base_glue_seq128,bert_base,"GLUE validation, seq_len=128",bert_base_glue_seq128:k060,60,bert.encoder.layer.10.attention.self.qkv,mha_qkv_projection,10,128,768,2304,226492416,4,24,72,6912,288,294912,1867776,864,172.8,7104.000000000002,7516.480000000002,0.8320297623245658,dptc_photonic_tile_schedule,generated canonical BERT-base encoder GEMM schedule,suds_only,SUDS budget only,0.026945891203703706,0.7718340084876546,0.20122010030864199,0.798779899691358,165.84583333333336,5521,235570
20260513_tetc_pivot,bert_base_glue_seq128,bert_base,"GLUE validation, seq_len=128",bert_base_glue_seq128:k061,61,bert.encoder.layer.10.attention.self.qk_scores,mha_qk_scores,10,1536,64,128,12582912,48,2,4,384,192,196608,106496,48,9.600000000000001,7276.800000000002,7305.760000000002,0.8604470115519807,dptc_photonic_tile_schedule,generated canonical BERT-base encoder GEMM schedule,suds_only,SUDS budget only,0.026945891203703706,0.7718340084876546,0.20122010030864199,0.798779899691358,9.213657407407409,307,157047
20260513_tetc_pivot,bert_base_glue_seq128,bert_base,"GLUE validation, seq_len=128",bert_base_glue_seq128:k062,62,bert.encoder.layer.10.attention.self.av_context,mha_av_context,10,1536,128,64,12582912,48,4,2,384,96,98304,204800,48,9.600000000000001,7286.400000000002,7315.360000000002,0.8604470115519807,dptc_photonic_tile_schedule,generated canonical BERT-base encoder GEMM schedule,suds_only,SUDS budget only,0.026945891203703706,0.7718340084876546,0.20122010030864199,0.798779899691358,9.213657407407409,307,78523
20260513_tetc_pivot,bert_base_glue_seq128,bert_base,"GLUE validation, seq_len=128",bert_base_glue_seq128:k063,63,bert.encoder.layer.10.attention.output.dense,mha_output_projection,10,128,768,768,75497472,4,24,24,2304,96,98304,688128,288,57.6,7296.000000000003,7437.760000000003,0.8361276421095836,dptc_photonic_tile_schedule,generated canonical BERT-base encoder GEMM schedule,suds_only,SUDS budget only,0.026945891203703706,0.7718340084876546,0.20122010030864199,0.798779899691358,55.28194444444445,1840,78523
20260513_tetc_pivot,bert_base_glue_seq128,bert_base,"GLUE validation, seq_len=128",bert_base_glue_seq128:k064,64,bert.encoder.layer.10.intermediate.dense,ffn_expand,10,128,768,3072,301989888,4,24,96,9216,384,393216,2457600,1152,230.4,7353.600000000003,7901.440000000002,0.8314995751911634,dptc_photonic_tile_schedule,generated canonical BERT-base encoder GEMM schedule,suds_only,SUDS budget only,0.026945891203703706,0.7718340084876546,0.20122010030864199,0.798779899691358,221.1277777777778,7362,314093
20260513_tetc_pivot,bert_base_glue_seq128,bert_base,"GLUE validation, seq_len=128",bert_base_glue_seq128:k065,65,bert.encoder.layer.10.output.dense,ffn_project,10,128,3072,768,301989888,4,96,24,9216,96,98304,2752512,1152,230.4,7584.000000000003,8131.840000000002,0.8314995751911634,dptc_photonic_tile_schedule,generated canonical BERT-base encoder GEMM schedule,suds_only,SUDS budget only,0.026945891203703706,0.7718340084876546,0.20122010030864199,0.798779899691358,221.1277777777778,7362,78523
20260513_tetc_pivot,bert_base_glue_seq128,bert_base,"GLUE validation, seq_len=128",bert_base_glue_seq128:k066,66,bert.encoder.layer.11.attention.self.qkv,mha_qkv_projection,11,128,768,2304,226492416,4,24,72,6912,288,294912,1867776,864,172.8,7814.400000000002,8226.880000000003,0.8638479441427476,dptc_photonic_tile_schedule,generated canonical BERT-base encoder GEMM schedule,suds_only,SUDS budget only,0.026945891203703706,0.7718340084876546,0.20122010030864199,0.798779899691358,165.84583333333336,5521,235570
20260513_tetc_pivot,bert_base_glue_seq128,bert_base,"GLUE validation, seq_len=128",bert_base_glue_seq128:k067,67,bert.encoder.layer.11.attention.self.qk_scores,mha_qk_scores,11,1536,64,128,12582912,48,2,4,384,192,196608,106496,48,9.600000000000001,7987.200000000003,8016.160000000003,0.8922651933701624,dptc_photonic_tile_schedule,generated canonical BERT-base encoder GEMM schedule,suds_only,SUDS budget only,0.026945891203703706,0.7718340084876546,0.20122010030864199,0.798779899691358,9.213657407407409,307,157047
20260513_tetc_pivot,bert_base_glue_seq128,bert_base,"GLUE validation, seq_len=128",bert_base_glue_seq128:k068,68,bert.encoder.layer.11.attention.self.av_context,mha_av_context,11,1536,128,64,12582912,48,4,2,384,96,98304,204800,48,9.600000000000001,7996.800000000003,8025.760000000003,0.8922651933701624,dptc_photonic_tile_schedule,generated canonical BERT-base encoder GEMM schedule,suds_only,SUDS budget only,0.026945891203703706,0.7718340084876546,0.20122010030864199,0.798779899691358,9.213657407407409,307,78523
20260513_tetc_pivot,bert_base_glue_seq128,bert_base,"GLUE validation, seq_len=128",bert_base_glue_seq128:k069,69,bert.encoder.layer.11.attention.output.dense,mha_output_projection,11,128,768,768,75497472,4,24,24,2304,96,98304,688128,288,57.6,8006.400000000003,8148.1600000000035,0.8679458239277653,dptc_photonic_tile_schedule,generated canonical BERT-base encoder GEMM schedule,suds_only,SUDS budget only,0.026945891203703706,0.7718340084876546,0.20122010030864199,0.798779899691358,55.28194444444445,1840,78523
20260513_tetc_pivot,bert_base_glue_seq128,bert_base,"GLUE validation, seq_len=128",bert_base_glue_seq128:k070,70,bert.encoder.layer.11.intermediate.dense,ffn_expand,11,128,768,3072,301989888,4,24,96,9216,384,393216,2457600,1152,230.4,8064.000000000004,8611.840000000004,0.8633177570093462,dptc_photonic_tile_schedule,generated canonical BERT-base encoder GEMM schedule,suds_only,SUDS budget only,0.026945891203703706,0.7718340084876546,0.20122010030864199,0.798779899691358,221.1277777777778,7362,314093
20260513_tetc_pivot,bert_base_glue_seq128,bert_base,"GLUE validation, seq_len=128",bert_base_glue_seq128:k071,71,bert.encoder.layer.11.output.dense,ffn_project,11,128,3072,768,301989888,4,96,24,9216,96,98304,2752512,1152,230.4,8294.400000000003,8842.240000000003,0.8633177570093451,dptc_photonic_tile_schedule,generated canonical BERT-base encoder GEMM schedule,suds_only,SUDS budget only,0.026945891203703706,0.7718340084876546,0.20122010030864199,0.798779899691358,221.1277777777778,7362,78523
20260513_tetc_pivot,bert_base_glue_seq128,bert_base,"GLUE validation, seq_len=128",bert_base_glue_seq128:k000,0,bert.encoder.layer.0.attention.self.qkv,mha_qkv_projection,0,128,768,2304,226492416,4,24,72,6912,288,294912,1867776,864,172.8,0.0,412.48,0.5138479441427464,dptc_photonic_tile_schedule,generated canonical BERT-base encoder GEMM schedule,signal_only,Signal/L1 tier selector,0.026945891203703706,0.7718340084876546,0.20122010030864199,0.798779899691358,165.84583333333336,5521,235570
20260513_tetc_pivot,bert_base_glue_seq128,bert_base,"GLUE validation, seq_len=128",bert_base_glue_seq128:k001,1,bert.encoder.layer.0.attention.self.qk_scores,mha_qk_scores,0,1536,64,128,12582912,48,2,4,384,192,196608,106496,48,9.600000000000001,172.8,201.76000000000002,0.5422651933701657,dptc_photonic_tile_schedule,generated canonical BERT-base encoder GEMM schedule,signal_only,Signal/L1 tier selector,0.026945891203703706,0.7718340084876546,0.20122010030864199,0.798779899691358,9.213657407407409,307,157047
20260513_tetc_pivot,bert_base_glue_seq128,bert_base,"GLUE validation, seq_len=128",bert_base_glue_seq128:k002,2,bert.encoder.layer.0.attention.self.av_context,mha_av_context,0,1536,128,64,12582912,48,4,2,384,96,98304,204800,48,9.600000000000001,182.4,211.36,0.5422651933701657,dptc_photonic_tile_schedule,generated canonical BERT-base encoder GEMM schedule,signal_only,Signal/L1 tier selector,0.026945891203703706,0.7718340084876546,0.20122010030864199,0.798779899691358,9.213657407407409,307,78523
20260513_tetc_pivot,bert_base_glue_seq128,bert_base,"GLUE validation, seq_len=128",bert_base_glue_seq128:k003,3,bert.encoder.layer.0.attention.output.dense,mha_output_projection,0,128,768,768,75497472,4,24,24,2304,96,98304,688128,288,57.6,192.0,333.76,0.517945823927765,dptc_photonic_tile_schedule,generated canonical BERT-base encoder GEMM schedule,signal_only,Signal/L1 tier selector,0.026945891203703706,0.7718340084876546,0.20122010030864199,0.798779899691358,55.28194444444445,1840,78523
20260513_tetc_pivot,bert_base_glue_seq128,bert_base,"GLUE validation, seq_len=128",bert_base_glue_seq128:k004,4,bert.encoder.layer.0.intermediate.dense,ffn_expand,0,128,768,3072,301989888,4,24,96,9216,384,393216,2457600,1152,230.4,249.6,797.44,0.5133177570093458,dptc_photonic_tile_schedule,generated canonical BERT-base encoder GEMM schedule,signal_only,Signal/L1 tier selector,0.026945891203703706,0.7718340084876546,0.20122010030864199,0.798779899691358,221.1277777777778,7362,314093
20260513_tetc_pivot,bert_base_glue_seq128,bert_base,"GLUE validation, seq_len=128",bert_base_glue_seq128:k005,5,bert.encoder.layer.0.output.dense,ffn_project,0,128,3072,768,301989888,4,96,24,9216,96,98304,2752512,1152,230.4,480.0,1027.84,0.5133177570093456,dptc_photonic_tile_schedule,generated canonical BERT-base encoder GEMM schedule,signal_only,Signal/L1 tier selector,0.026945891203703706,0.7718340084876546,0.20122010030864199,0.798779899691358,221.1277777777778,7362,78523
20260513_tetc_pivot,bert_base_glue_seq128,bert_base,"GLUE validation, seq_len=128",bert_base_glue_seq128:k006,6,bert.encoder.layer.1.attention.self.qkv,mha_qkv_projection,1,128,768,2304,226492416,4,24,72,6912,288,294912,1867776,864,172.8,710.4,1122.88,0.5456661259609283,dptc_photonic_tile_schedule,generated canonical BERT-base encoder GEMM schedule,signal_only,Signal/L1 tier selector,0.026945891203703706,0.7718340084876546,0.20122010030864199,0.798779899691358,165.84583333333336,5521,235570
20260513_tetc_pivot,bert_base_glue_seq128,bert_base,"GLUE validation, seq_len=128",bert_base_glue_seq128:k007,7,bert.encoder.layer.1.attention.self.qk_scores,mha_qk_scores,1,1536,64,128,12582912,48,2,4,384,192,196608,106496,48,9.600000000000001,883.2,912.1600000000001,0.5740833751883494,dptc_photonic_tile_schedule,generated canonical BERT-base encoder GEMM schedule,signal_only,Signal/L1 tier selector,0.026945891203703706,0.7718340084876546,0.20122010030864199,0.798779899691358,9.213657407407409,307,157047
20260513_tetc_pivot,bert_base_glue_seq128,bert_base,"GLUE validation, seq_len=128",bert_base_glue_seq128:k008,8,bert.encoder.layer.1.attention.self.av_context,mha_av_context,1,1536,128,64,12582912,48,4,2,384,96,98304,204800,48,9.600000000000001,892.8000000000001,921.7600000000001,0.5740833751883494,dptc_photonic_tile_schedule,generated canonical BERT-base encoder GEMM schedule,signal_only,Signal/L1 tier selector,0.026945891203703706,0.7718340084876546,0.20122010030864199,0.798779899691358,9.213657407407409,307,78523
20260513_tetc_pivot,bert_base_glue_seq128,bert_base,"GLUE validation, seq_len=128",bert_base_glue_seq128:k009,9,bert.encoder.layer.1.attention.output.dense,mha_output_projection,1,128,768,768,75497472,4,24,24,2304,96,98304,688128,288,57.6,902.4000000000001,1044.16,0.5497640057459472,dptc_photonic_tile_schedule,generated canonical BERT-base encoder GEMM schedule,signal_only,Signal/L1 tier selector,0.026945891203703706,0.7718340084876546,0.20122010030864199,0.798779899691358,55.28194444444445,1840,78523
20260513_tetc_pivot,bert_base_glue_seq128,bert_base,"GLUE validation, seq_len=128",bert_base_glue_seq128:k010,10,bert.encoder.layer.1.intermediate.dense,ffn_expand,1,128,768,3072,301989888,4,24,96,9216,384,393216,2457600,1152,230.4,960.0000000000001,1507.8400000000001,0.5451359388275278,dptc_photonic_tile_schedule,generated canonical BERT-base encoder GEMM schedule,signal_only,Signal/L1 tier selector,0.026945891203703706,0.7718340084876546,0.20122010030864199,0.798779899691358,221.1277777777778,7362,314093
20260513_tetc_pivot,bert_base_glue_seq128,bert_base,"GLUE validation, seq_len=128",bert_base_glue_seq128:k011,11,bert.encoder.layer.1.output.dense,ffn_project,1,128,3072,768,301989888,4,96,24,9216,96,98304,2752512,1152,230.4,1190.4,1738.2400000000002,0.5451359388275278,dptc_photonic_tile_schedule,generated canonical BERT-base encoder GEMM schedule,signal_only,Signal/L1 tier selector,0.026945891203703706,0.7718340084876546,0.20122010030864199,0.798779899691358,221.1277777777778,7362,78523
20260513_tetc_pivot,bert_base_glue_seq128,bert_base,"GLUE validation, seq_len=128",bert_base_glue_seq128:k012,12,bert.encoder.layer.2.attention.self.qkv,mha_qkv_projection,2,128,768,2304,226492416,4,24,72,6912,288,294912,1867776,864,172.8,1420.8000000000002,1833.2800000000002,0.5774843077791098,dptc_photonic_tile_schedule,generated canonical BERT-base encoder GEMM schedule,signal_only,Signal/L1 tier selector,0.026945891203703706,0.7718340084876546,0.20122010030864199,0.798779899691358,165.84583333333336,5521,235570
20260513_tetc_pivot,bert_base_glue_seq128,bert_base,"GLUE validation, seq_len=128",bert_base_glue_seq128:k013,13,bert.encoder.layer.2.attention.self.qk_scores,mha_qk_scores,2,1536,64,128,12582912,48,2,4,384,192,196608,106496,48,9.600000000000001,1593.6000000000001,1622.56,0.605901557006526,dptc_photonic_tile_schedule,generated canonical BERT-base encoder GEMM schedule,signal_only,Signal/L1 tier selector,0.026945891203703706,0.7718340084876546,0.20122010030864199,0.798779899691358,9.213657407407409,307,157047
20260513_tetc_pivot,bert_base_glue_seq128,bert_base,"GLUE validation, seq_len=128",bert_base_glue_seq128:k014,14,bert.encoder.layer.2.attention.self.av_context,mha_av_context,2,1536,128,64,12582912,48,4,2,384,96,98304,204800,48,9.600000000000001,1603.2,1632.1599999999999,0.605901557006526,dptc_photonic_tile_schedule,generated canonical BERT-base encoder GEMM schedule,signal_only,Signal/L1 tier selector,0.026945891203703706,0.7718340084876546,0.20122010030864199,0.798779899691358,9.213657407407409,307,78523
20260513_tetc_pivot,bert_base_glue_seq128,bert_base,"GLUE validation, seq_len=128",bert_base_glue_seq128:k015,15,bert.encoder.layer.2.attention.output.dense,mha_output_projection,2,128,768,768,75497472,4,24,24,2304,96,98304,688128,288,57.6,1612.8,1754.56,0.5815821875641289,dptc_photonic_tile_schedule,generated canonical BERT-base encoder GEMM schedule,signal_only,Signal/L1 tier selector,0.026945891203703706,0.7718340084876546,0.20122010030864199,0.798779899691358,55.28194444444445,1840,78523
20260513_tetc_pivot,bert_base_glue_seq128,bert_base,"GLUE validation, seq_len=128",bert_base_glue_seq128:k016,16,bert.encoder.layer.2.intermediate.dense,ffn_expand,2,128,768,3072,301989888,4,24,96,9216,384,393216,2457600,1152,230.4,1670.3999999999999,2218.24,0.5769541206457092,dptc_photonic_tile_schedule,generated canonical BERT-base encoder GEMM schedule,signal_only,Signal/L1 tier selector,0.026945891203703706,0.7718340084876546,0.20122010030864199,0.798779899691358,221.1277777777778,7362,314093
20260513_tetc_pivot,bert_base_glue_seq128,bert_base,"GLUE validation, seq_len=128",bert_base_glue_seq128:k017,17,bert.encoder.layer.2.output.dense,ffn_project,2,128,3072,768,301989888,4,96,24,9216,96,98304,2752512,1152,230.4,1900.8,2448.64,0.5769541206457092,dptc_photonic_tile_schedule,generated canonical BERT-base encoder GEMM schedule,signal_only,Signal/L1 tier selector,0.026945891203703706,0.7718340084876546,0.20122010030864199,0.798779899691358,221.1277777777778,7362,78523
20260513_tetc_pivot,bert_base_glue_seq128,bert_base,"GLUE validation, seq_len=128",bert_base_glue_seq128:k018,18,bert.encoder.layer.3.attention.self.qkv,mha_qkv_projection,3,128,768,2304,226492416,4,24,72,6912,288,294912,1867776,864,172.8,2131.2,2543.68,0.6093024895972916,dptc_photonic_tile_schedule,generated canonical BERT-base encoder GEMM schedule,signal_only,Signal/L1 tier selector,0.026945891203703706,0.7718340084876546,0.20122010030864199,0.798779899691358,165.84583333333336,5521,235570
20260513_tetc_pivot,bert_base_glue_seq128,bert_base,"GLUE validation, seq_len=128",bert_base_glue_seq128:k019,19,bert.encoder.layer.3.attention.self.qk_scores,mha_qk_scores,3,1536,64,128,12582912,48,2,4,384,192,196608,106496,48,9.600000000000001,2304.0,2332.96,0.6377197388247079,dptc_photonic_tile_schedule,generated canonical BERT-base encoder GEMM schedule,signal_only,Signal/L1 tier selector,0.026945891203703706,0.7718340084876546,0.20122010030864199,0.798779899691358,9.213657407407409,307,157047
20260513_tetc_pivot,bert_base_glue_seq128,bert_base,"GLUE validation, seq_len=128",bert_base_glue_seq128:k020,20,bert.encoder.layer.3.attention.self.av_context,mha_av_context,3,1536,128,64,12582912,48,4,2,384,96,98304,204800,48,9.600000000000001,2313.6,2342.56,0.6377197388247079,dptc_photonic_tile_schedule,generated canonical BERT-base encoder GEMM schedule,signal_only,Signal/L1 tier selector,0.026945891203703706,0.7718340084876546,0.20122010030864199,0.798779899691358,9.213657407407409,307,78523
20260513_tetc_pivot,bert_base_glue_seq128,bert_base,"GLUE validation, seq_len=128",bert_base_glue_seq128:k021,21,bert.encoder.layer.3.attention.output.dense,mha_output_projection,3,128,768,768,75497472,4,24,24,2304,96,98304,688128,288,57.6,2323.2,2464.9599999999996,0.6134003693823087,dptc_photonic_tile_schedule,generated canonical BERT-base encoder GEMM schedule,signal_only,Signal/L1 tier selector,0.026945891203703706,0.7718340084876546,0.20122010030864199,0.798779899691358,55.28194444444445,1840,78523
20260513_tetc_pivot,bert_base_glue_seq128,bert_base,"GLUE validation, seq_len=128",bert_base_glue_seq128:k022,22,bert.encoder.layer.3.intermediate.dense,ffn_expand,3,128,768,3072,301989888,4,24,96,9216,384,393216,2457600,1152,230.4,2380.7999999999997,2928.64,0.6087723024638917,dptc_photonic_tile_schedule,generated canonical BERT-base encoder GEMM schedule,signal_only,Signal/L1 tier selector,0.026945891203703706,0.7718340084876546,0.20122010030864199,0.798779899691358,221.1277777777778,7362,314093
20260513_tetc_pivot,bert_base_glue_seq128,bert_base,"GLUE validation, seq_len=128",bert_base_glue_seq128:k023,23,bert.encoder.layer.3.output.dense,ffn_project,3,128,3072,768,301989888,4,96,24,9216,96,98304,2752512,1152,230.4,2611.2,3159.04,0.6087723024638917,dptc_photonic_tile_schedule,generated canonical BERT-base encoder GEMM schedule,signal_only,Signal/L1 tier selector,0.026945891203703706,0.7718340084876546,0.20122010030864199,0.798779899691358,221.1277777777778,7362,78523
20260513_tetc_pivot,bert_base_glue_seq128,bert_base,"GLUE validation, seq_len=128",bert_base_glue_seq128:k024,24,bert.encoder.layer.4.attention.self.qkv,mha_qkv_projection,4,128,768,2304,226492416,4,24,72,6912,288,294912,1867776,864,172.8,2841.6,3254.08,0.6411206714154734,dptc_photonic_tile_schedule,generated canonical BERT-base encoder GEMM schedule,signal_only,Signal/L1 tier selector,0.026945891203703706,0.7718340084876546,0.20122010030864199,0.798779899691358,165.84583333333336,5521,235570
20260513_tetc_pivot,bert_base_glue_seq128,bert_base,"GLUE validation, seq_len=128",bert_base_glue_seq128:k025,25,bert.encoder.layer.4.attention.self.qk_scores,mha_qk_scores,4,1536,64,128,12582912,48,2,4,384,192,196608,106496,48,9.600000000000001,3014.4,3043.36,0.6695379206428898,dptc_photonic_tile_schedule,generated canonical BERT-base encoder GEMM schedule,signal_only,Signal/L1 tier selector,0.026945891203703706,0.7718340084876546,0.20122010030864199,0.798779899691358,9.213657407407409,307,157047
20260513_tetc_pivot,bert_base_glue_seq128,bert_base,"GLUE validation, seq_len=128",bert_base_glue_seq128:k026,26,bert.encoder.layer.4.attention.self.av_context,mha_av_context,4,1536,128,64,12582912,48,4,2,384,96,98304,204800,48,9.600000000000001,3024.0,3052.96,0.6695379206428898,dptc_photonic_tile_schedule,generated canonical BERT-base encoder GEMM schedule,signal_only,Signal/L1 tier selector,0.026945891203703706,0.7718340084876546,0.20122010030864199,0.798779899691358,9.213657407407409,307,78523
20260513_tetc_pivot,bert_base_glue_seq128,bert_base,"GLUE validation, seq_len=128",bert_base_glue_seq128:k027,27,bert.encoder.layer.4.attention.output.dense,mha_output_projection,4,128,768,768,75497472,4,24,24,2304,96,98304,688128,288,57.6,3033.6,3175.3599999999997,0.6452185512004904,dptc_photonic_tile_schedule,generated canonical BERT-base encoder GEMM schedule,signal_only,Signal/L1 tier selector,0.026945891203703706,0.7718340084876546,0.20122010030864199,0.798779899691358,55.28194444444445,1840,78523
20260513_tetc_pivot,bert_base_glue_seq128,bert_base,"GLUE validation, seq_len=128",bert_base_glue_seq128:k028,28,bert.encoder.layer.4.intermediate.dense,ffn_expand,4,128,768,3072,301989888,4,24,96,9216,384,393216,2457600,1152,230.4,3091.2,3639.04,0.6405904842820735,dptc_photonic_tile_schedule,generated canonical BERT-base encoder GEMM schedule,signal_only,Signal/L1 tier selector,0.026945891203703706,0.7718340084876546,0.20122010030864199,0.798779899691358,221.1277777777778,7362,314093
20260513_tetc_pivot,bert_base_glue_seq128,bert_base,"GLUE validation, seq_len=128",bert_base_glue_seq128:k029,29,bert.encoder.layer.4.output.dense,ffn_project,4,128,3072,768,301989888,4,96,24,9216,96,98304,2752512,1152,230.4,3321.6,3869.44,0.6405904842820735,dptc_photonic_tile_schedule,generated canonical BERT-base encoder GEMM schedule,signal_only,Signal/L1 tier selector,0.026945891203703706,0.7718340084876546,0.20122010030864199,0.798779899691358,221.1277777777778,7362,78523
20260513_tetc_pivot,bert_base_glue_seq128,bert_base,"GLUE validation, seq_len=128",bert_base_glue_seq128:k030,30,bert.encoder.layer.5.attention.self.qkv,mha_qkv_projection,5,128,768,2304,226492416,4,24,72,6912,288,294912,1867776,864,172.8,3552.0,3964.48,0.6729388532336552,dptc_photonic_tile_schedule,generated canonical BERT-base encoder GEMM schedule,signal_only,Signal/L1 tier selector,0.026945891203703706,0.7718340084876546,0.20122010030864199,0.798779899691358,165.84583333333336,5521,235570
20260513_tetc_pivot,bert_base_glue_seq128,bert_base,"GLUE validation, seq_len=128",bert_base_glue_seq128:k031,31,bert.encoder.layer.5.attention.self.qk_scores,mha_qk_scores,5,1536,64,128,12582912,48,2,4,384,192,196608,106496,48,9.600000000000001,3724.8,3753.76,0.7013561024610715,dptc_photonic_tile_schedule,generated canonical BERT-base encoder GEMM schedule,signal_only,Signal/L1 tier selector,0.026945891203703706,0.7718340084876546,0.20122010030864199,0.798779899691358,9.213657407407409,307,157047
20260513_tetc_pivot,bert_base_glue_seq128,bert_base,"GLUE validation, seq_len=128",bert_base_glue_seq128:k032,32,bert.encoder.layer.5.attention.self.av_context,mha_av_context,5,1536,128,64,12582912,48,4,2,384,96,98304,204800,48,9.600000000000001,3734.4,3763.36,0.7013561024610715,dptc_photonic_tile_schedule,generated canonical BERT-base encoder GEMM schedule,signal_only,Signal/L1 tier selector,0.026945891203703706,0.7718340084876546,0.20122010030864199,0.798779899691358,9.213657407407409,307,78523
20260513_tetc_pivot,bert_base_glue_seq128,bert_base,"GLUE validation, seq_len=128",bert_base_glue_seq128:k033,33,bert.encoder.layer.5.attention.output.dense,mha_output_projection,5,128,768,768,75497472,4,24,24,2304,96,98304,688128,288,57.6,3744.0,3885.7599999999998,0.6770367330186723,dptc_photonic_tile_schedule,generated canonical BERT-base encoder GEMM schedule,signal_only,Signal/L1 tier selector,0.026945891203703706,0.7718340084876546,0.20122010030864199,0.798779899691358,55.28194444444445,1840,78523
20260513_tetc_pivot,bert_base_glue_seq128,bert_base,"GLUE validation, seq_len=128",bert_base_glue_seq128:k034,34,bert.encoder.layer.5.intermediate.dense,ffn_expand,5,128,768,3072,301989888,4,24,96,9216,384,393216,2457600,1152,230.4,3801.6,4349.44,0.6724086661002546,dptc_photonic_tile_schedule,generated canonical BERT-base encoder GEMM schedule,signal_only,Signal/L1 tier selector,0.026945891203703706,0.7718340084876546,0.20122010030864199,0.798779899691358,221.1277777777778,7362,314093
20260513_tetc_pivot,bert_base_glue_seq128,bert_base,"GLUE validation, seq_len=128",bert_base_glue_seq128:k035,35,bert.encoder.layer.5.output.dense,ffn_project,5,128,3072,768,301989888,4,96,24,9216,96,98304,2752512,1152,230.4,4032.0,4579.839999999999,0.6724086661002542,dptc_photonic_tile_schedule,generated canonical BERT-base encoder GEMM schedule,signal_only,Signal/L1 tier selector,0.026945891203703706,0.7718340084876546,0.20122010030864199,0.798779899691358,221.1277777777778,7362,78523
20260513_tetc_pivot,bert_base_glue_seq128,bert_base,"GLUE validation, seq_len=128",bert_base_glue_seq128:k036,36,bert.encoder.layer.6.attention.self.qkv,mha_qkv_projection,6,128,768,2304,226492416,4,24,72,6912,288,294912,1867776,864,172.8,4262.4,4674.88,0.7047570350518385,dptc_photonic_tile_schedule,generated canonical BERT-base encoder GEMM schedule,signal_only,Signal/L1 tier selector,0.026945891203703706,0.7718340084876546,0.20122010030864199,0.798779899691358,165.84583333333336,5521,235570
